Link,Topic,Card Title,Tags,Date,Card Text
/news/item/1632614/,murmansk,В Мурманске вынесен обвинительный приговор в отношении бывшего заместителя руководителя Фонда капитального ремонта,"['коммерческий подкуп', 'приговор']",15 Февраля 2019,"Фото СУ СК России по Мурманской области            

Собранные следственными органами Следственного комитета Российской Федерации по Мурманской области доказательства признаны судом достаточными для вынесения обвинительного приговора в отношении бывшего заместителя генерального директора НКО «Фонд капитального ремонта общего имущества в многоквартирных домах в Мурманской области». Он признан виновным в совершении преступления, предусмотренного ч. 8 ст. 204 УК РФ (коммерческий подкуп, то есть незаконное получение лицом, выполняющим управленческие функции в иной организации, денег за совершение действий в интересах дающего, если указанные действия входят в служебные полномочия такого лица, и если оно в силу своего служебного положения может способствовать указанным действиям, совершенные в особо крупном размере).
Указанная некоммерческая организация осуществляет деятельность в качестве регионального оператора, направленную на обеспечение проведения капитального ремонта общего имущества в многоквартирных домах, расположенных на территории Мурманской области.
Следствием и судом установлено, что 11 декабря 2019 года подсудимый, находясь в здании городского делового центра «Меридиан» в Мурманске, незаконно получил от заинтересованного лица первую часть денежного вознаграждения в размере 350 000 рублей от общей суммы коммерческого подкупа в размере более 1 260 000 рублей, то есть в особо крупном размере.
Денежные средства предназначались подсудимому в качестве вознаграждения за содействие в беспрепятственной и скорейшей оплате Фондом задолженности за реально оказанные услуги по строительному контролю в размере более 2 500 000 рублей. При этом по достигнутой договоренности размер незаконного вознаграждения составлял 50 % от суммы задолженности, в перечислении которой содействовал виновный.
Получить оставшуюся часть незаконного денежного подсудимый не смог по не зависящим от него обстоятельствам, так как после содеянного был задержан оперативными сотрудниками управления экономической безопасности и противодействия коррупции УМВД России по Мурманской области при силовой поддержке бойцов Управления Росгвардии по Мурманской области.
Вину в инкриминируемом деянии подсудимый признал частично. Принятыми в ходе расследования мерами на имущество виновного и его близких лиц наложен арест в размере 19 миллионов рублей, в том числе на недвижимое имущество, находящееся за пределами Российской Федерации.
Приговором суда подсудимый признан виновным в совершении преступления, предусмотренного ч. 8 ст. 204 УК РФ, ему назначено наказание в виде лишения свободы на срок 7 лет с отбыванием в колонии строгого режима. Приговор в законную силу не вступил.
 
Старший помощник руководителя Следственного управления Следственного комитета РФ по Мурманской области (по информационному взаимодействию с общественностью и СМИ) Алина Александрович"
/news/item/1870043/,murmansk,"Следователями регионального СК возбуждены уголовные дела в отношении двух лиц, подозреваемых в совершении преступлений против интересов коммерческих организаций",['коммерческий подкуп'],05 Февраля 2019,"Фото СУ СК России по Мурманской области            

Отделом по расследованию особо важных дел следственного управления Следственного комитета Российской Федерации по Мурманской области возбуждено уголовное дело в отношении генерального директора одной из коммерческих организаций региона. Он подозревается в совершении преступления, предусмотренного ч.6 ст.204 УК РФ (незаконное получение лицом, выполняющим управленческие функции в коммерческой организации, денег в значительном размере за бездействие в интересах иных лиц).
Также уголовное дело возбуждено в отношении 29-летнего мужчины, подозреваемого в совершении преступления, предусмотренного ч. 2 ст. 204 УК РФ (незаконная передача лицу, выполняющему управленческие функции в коммерческой организации, денег в значительном размере за бездействие в интересах иных лиц).
По версии следствия, генеральный директор одной из коммерческих организаций в июле 2023 года получил от 29-летнего фигуранта через посредника коммерческий подкуп в размере 50 тыс.рублей за отказ от участия в аукционе на выполнение работ по текущему ремонту системы отопления в здании муниципального учреждения, расположенного в поселке Никель Печенгского района.
Целью подкупа являлось обеспечение беспрепятственной победы в аукционе индивидуального предпринимателя, в интересах которого действовал подозреваемый, непосредственно передавший деньги путем зачисления их на банковский счет супруги генерального директора. 
Преступление выявлено и пресечено следователями следственного управления во взаимодействии с сотрудниками УМВД России по Мурманской области.
В настоящее время по уголовному делу проводится комплекс следственных действий, направленных на установление всех обстоятельств совершенного преступления, проводятся допросы свидетелей, выемки и осмотры документации.
В отношении посредника уголовное дело ранее направлено в суд для рассмотрения по существу.Старший помощник руководителя Следственного управления Следственного комитета РФ по Мурманской области (по информационному взаимодействию с общественностью и СМИ) Ангелина Тенце"
/news/item/1273543/,murmansk,"ПЕРЕД СУДОМ ПРЕДСТАНЕТ ЗАМЕСТИТЕЛЬ ДИРЕКТОРА ОДНОГО ИЗ МУНИЦИПАЛЬНЫХ УЧРЕЖДЕНИЙ ПЕЧЕНГСКОГО РАЙОНА, ОБВИНЯЕМАЯ В МОШЕННИЧЕСТВЕ, ПРИСВОЕНИИ И СЛУЖЕБНОМ ПОДЛОГЕ","['мошенничество', 'присвоение', 'служебный подлог']",04 Февраля 2019,"Фото из открытых источников            

Следственным отделом по городу Заполярный Следственного управления Следственного комитета Российской Федерации по Мурманской области завершено расследование уголовного дела в отношении заместителя директора одного из муниципальных учреждений Печенгского района Мурманской области в сфере дополнительного образования. Она обвиняется в совершении преступлений, предусмотренных ч. 3 ст. 159, ч. 1 ст. 292, ч. 3 ст. 159, ч. 3 ст. 160, ч. 1 ст. 292 УК РФ (мошенничество, совершенное лицом с использованием служебного положения; присвоение имущества, вверенного виновному, совершенное лицом с использованием служебного положения; служебный подлог).
Следствием установлено, что обвиняемая, используя служебное положение, путем составления и утверждения подложных документов, фиктивно трудоустроила на должность рабочего в данное учреждение своего супруга, который фактически в учреждении не работал, при этом ему начислялась заработная плата, которую обвиняемая присваивала и распоряжалась ею по своему усмотрению. 
В результате противоправных действий женщина путем обмана похитила принадлежащие администрации муниципального образования Печенгский район денежные средства в сумме более 160 тысяч рублей.
В настоящее время уголовное дело с утвержденным прокурором обвинительным заключением направлено для рассмотрения в Печенгский районный суд Мурманской области.
 
Старший помощник руководителя Следственного управления Следственного комитета РФ по Мурманской области по взаимодействию со СМИ Ксения Кошелюк"
/news/item/1792865/,murmansk,В Мурманской области бывший сотрудник полиции признан виновным в получении взятки,['взятка'],01 Февраля 2019,"Фото СУ СК России по Мурманской области            

Собранные следственными органами СУ СК России по Мурманской области доказательства признаны судом достаточными для вынесения обвинительного приговора бывшему сотруднику группы комплексного анализа административной практики, организации методического обеспечения УМВД России по Мурманской области. Он признан виновным в совершении преступления, предусмотренного ч. 6 ст. 290 УК РФ (получение должностным лицом лично взятки в виде денег за незаконные действия и бездействия).
Следствием и судом установлено, что с июня 2019 года по январь 2022 года осужденный ежемесячно получал от жителя Мурманска, являющегося его знакомым, денежные средства. Общая сумма полученных денег составила не менее 1340000 рублей. За указанное вознаграждение злоумышленник осуществлял общее покровительство незаконной деятельности мужчины по реализации им спиртосодержащей продукции на территории Мурманска и Колы. Он неоднократно, заблаговременно предупреждал знакомого о планирующихся проверках мест сбыта алкоголя. Тем самым, давал возможность вывезти и скрыть продукцию от изъятия. А также повышал суммы взятки от 20000 рублей до 50000 рублей.
В ходе проведения оперативно-розыскных мероприятий сотрудник полиции был задержан следователем во взаимодействии с сотрудниками УФСБ России по Мурманской в момент получения очередной части денежных средств.
Следователями проведен весь комплекс следственных и процессуальных действий, направленный на установление всех обстоятельств произошедшего и сбор доказательств. В качестве свидетелей допрошено значительное количество человек, изъяты и осмотрены предметы, документы, которые приобщены к делу в качестве вещественных доказательств.
Приговором суда злоумышленнику назначено наказание в виде 9 лет лишения свободы с отбыванием наказания в исправительной колонии строгого режима, с лишением права занимать должности, связанные с осуществлением функций представителя власти в правоохранительных органах на срок 9 лет, с лишением специального звания – майор полиции. 
Кроме того, судом принято решение о конфискации и обращения в доход государства легкового автомобиля осужденного.
 
Старший помощник руководителя Следственного управления Следственного комитета РФ по Мурманской области (по информационному взаимодействию с общественностью и СМИ) Евгений Ребров"
/news/item/1782852/,murmansk,В Мурманске завершено расследование уголовного дела о коммерческом подкупе работника организации,['коммерческий подкуп'],24 Января 2019,"Фото из открытых источников            

Следственным отделом по городу Мурманск Следственного управления Следственного комитета Российской Федерации по Мурманской области завершено расследование уголовного дела по обвинению бывшего начальника отдела развития сетей акционерного общества в совершении преступления, предусмотренного п.п. «в, г» ч. 7 ст. 204 РФ (коммерческий подкуп, за незаконные действия, в крупном размере).
Предварительным следствием установлено, что в сентябре 2022 года мужчина, состоя в должности начальника отдела развития сетей коммерческой организации, получил от представителя другой коммерческой организации денежные средства в сумме 200000 рублей за способствование заключению договора об осуществлении технологического присоединения к электрическим сетям и утверждению технических условий.
Вину в совершении преступления обвиняемый не признал. При этом высказал свою версию о том, что его действия правомерны.
Уголовное дело было возбуждено по материалам, поступившим из УФСБ России по Мурманской области.
В настоящее время расследование завершено, собранные следователями доказательства признаны прокурором достаточными для утверждения обвинительного заключения и направления уголовного дела в суд для рассмотрения по существу.
 
Старший помощник руководителя Следственного управления Следственного комитета РФ по Мурманской области (по информационному взаимодействию с общественностью и СМИ) Евгений Ребров"
/news/item/1383441/,murmansk,В Мурманской области вынесен обвинительный приговор в отношении должностного лица регионального МЧС России,"['должностное лицо', 'мошенничество', 'приговор']",22 Января 2019,"Фото из открытых источников            

Собранные следственными органами Следственного комитета Российской Федерации по Мурманской области доказательства признаны судом достаточными для вынесения обвинительного приговора в отношении должностного лица – начальника одной из специальных пожарно-спасательных частей ФГКУ «Специальное управление ФПС № 48 МЧС России».
Следствием и судом установлено, что в период с 2014 года по 2017 года подсудимый, согласно достигнутой с вышестоящим руководством договоренности, обращался к подчиненным сотрудникам с предложением о написании рапортов о выплате им денежных средств в качестве дополнительной материальной помощи. В указанные документы сотрудниками вносились ложные сведения о необходимости прохождения лечения, приобретения лекарственных средств.
При поступлении бюджетных денежных средств сотрудникам СПСЧ для заявленных нужд, последние передавали часть полученных денег подсудимому, выступавшему в качестве пособника. Злоумышленник передавал незаконно полученные денежные средства лицам из числа вышестоящего руководства, уголовные дела в отношении которых планируются к направлению в суд для рассмотрения по существу.
При пособничестве виновного в 2014 году похищены бюджетные денежные средства, выделенные из федерального бюджета на нужды ФГКУ «Специальное управление ФПС № 48 МЧС России», в размере более 92 тысяч рублей, в период с 2015 по 2017 годы – в размере более 2 миллионов рублей.
Преступление выявлено при содействии оперативных сотрудников УФСБ России по Мурманской области.
На стадии предварительного следствия и в судебном заседании подсудимый вину в инкриминируемом преступлении признал в полном объеме. Установлено, что каких-либо денежных средств злоумышленник не получал, действовал в личных интересах, связанных с прохождением службы.
Приговором суда должностное лицо признано виновным в совершении пособничества в мошенничестве, совершенного с использованием своего служебного положения, то есть преступлении, предусмотренном ч. 5 ст. 33, ч. 3 ст. 159 УК РФ, а также в совершении пособничества в мошенничестве, совершенного с использованием своего служебного положения в особо крупном размере, то есть преступлении, предусмотренном ч. 5 ст. 33, ч. 4 ст. 159 УК РФ. Ему назначено наказание в виде 4 лет лишения свободы условно с испытательным сроком 3 года. Приговор в законную силу не вступил. 
 
Старший помощник руководителя Следственного управления Следственного комитета РФ по Мурманской области по взаимодействию со СМИ Алина Александрович"
