Link,Topic,Card Title,Tags,Date,Card Text
/news/item/1761387/,osetia,"Во Владикавказе перед судом предстанет директор одного из муниципальных учреждений по обвинению в даче взятки должностному лицу, присвоении и растрате и неправомерном обороте средств платежей","['взятка', 'присвоение', 'растрата']",07 Июля 2021,"Следственным управлением Следственного комитета Российской Федерации по Республике Северная Осетия – Алания завершено расследование уголовного дела в отношении директора одного из муниципальных учреждений города Владикавказа. Он обвиняется в совершении преступлений, предусмотренных  ч. 5 ст. 291 УК РФ (дача взятки должностному лицу в особо крупном размере), ч.ч. 3, 4 ст. 160 УК РФ (присвоение и растрата, совершенные с использованием  своего служебного положения в особо крупном размере), ч. 1 ст. 187 УК РФ (неправомерный оборот средств платежей).
По версии следствия, в первой декаде декабря 2020 года обвиняемый вступил с должностным лицом АМС города Владикавказа в преступный сговор, по которому последний посодействовал в заключении управлением благоустройства и озеленения с подконтрольным фигуранту индивидуальным предпринимателем (супругой) 58 прямых контрактов на оказание различного рода услуг, работ, поставку товаров на общую сумму 29,4 млн руб.
В период с 12 декабря 2020 по 4 марта 2022 года индивидуальный предприниматель, не осведомленная о реальных назначениях денежных переводов, по указанию своего супруга, периодически осуществляла безналичные денежные переводы на банковскую карту муниципального служащего, в качестве взятки за оказанное им содействие. Общая сумма таких переводов составила 8,9 млн руб.
Кроме того, обвиняемый, используя свое служебное положение, с февраля по июнь 2022 года противоправно обратил в свою пользу денежные средства, предназначенные для приобретения запасных частей и деталей для грузовой и специализированной техники учреждения, а также совершил хищение дизельного топлива объемом 3 тонны. С целью присвоения вверенных денежных средств, путем незаконного их обналичивания, злоумышленник изготовил поддельные распоряжения об их переводе. В результате его противоправных действий городской администрации причинен имущественный ущерб на сумму более 3,5 млн руб.
Благодаря грамотно спланированным и проведенным сотрудниками следственного управления СК России и регионального УФСБ совместным следственным действиям и оперативно-розыскным мероприятиям обвиняемый был задержан. По ходатайству следственных органов судом в отношении него избрана мера пресечения в виде заключения под стражу.
Следствием собрано достаточно доказательств, в связи с чем уголовное дело с утвержденным обвинительным заключением направлено в суд для рассмотрения по существу.
Уголовное дело в отношении руководителя управления городской администрации по обвинению в получении взятки в особо крупном размере уже направлено в суд для рассмотрения по существу."
/news/item/1624883/,osetia,"По ходатайству следственных органов руководителю региональной службы по тарифам, подозреваемому в превышении должностных полномочий, избрана мера пресечения в виде домашнего ареста",['превышение полномочий'],23 Июня 2021,"Следственным управлением Следственного комитета Российской Федерации по Республике Северная Осетия – Алания продолжается расследование уголовного дела, возбужденного в отношении руководителя Региональной службы по тарифам РСО-Алания (РСТ РСО-Алания), подозреваемого в совершении преступления, предусмотренного п. «в» ч. 3 ст. 286 УК РФ (превышение должностных полномочий с причинением тяжких последствий).  
По версии следствия, 25 декабря 2019 года на заседании Правления РСТ РСО-Алания постановлением утверждены индивидуальные тарифы на передачу электрической энергии для взаиморасчетов между смежными сетевыми организациями на территории республики на 2020 год. В период с 25 по 28 декабря 2019 года подозреваемый, в целях создания тарифного профицита в пользу аффилированных ему сетевых организаций, умышленно внес изменения в установленные тарифы, причинив тем самым имущественный ущерб гарантирующему поставщику электроэнергии в лице филиала ПАО «Россети Северный Кавказ» – «Севкавказэнерго», на сумму более 46 млн рублей.  
В результате профессионально спланированных и проведенных сотрудниками следственного управления СК России и регионального УФСБ совместных следственных действий и оперативно-розыскных мероприятий противоправная деятельность подозреваемого пресечена и он был задержан. По ходатайству следственных органов судом в отношении задержанного избрана мера пресечения в виде домашнего ареста. 
В ближайшее время подозреваемому будет предъявлено обвинение в содеянном. Расследование уголовного дела продолжается."
/news/item/1739579/,osetia,Во Владикавказе перед судом предстанет заместитель руководителя одного из управлений городской администрации по обвинению в получении взятки в особо крупном размере,"['взятка', 'чиновник']",12 Мая 2021,"Следственным управлением Следственного комитета Российской Федерации по Республике Северная Осетия – Алания завершено расследование уголовного дела в отношении заместителя начальника управления благоустройства и озеленения Администрации местного самоуправления города Владикавказа. Он обвиняется в совершении преступления, предусмотренного ч. 6 ст. 290 УК РФ (получение должностным лицом взятки в особо крупном размере).По версии следствия, в первой декаде декабря 2020 года к обвиняемому обратился ранее знакомый ему начальник одного из муниципальных учреждений фактически контролирующий и осуществляющий финансово-хозяйственную деятельность индивидуального предпринимателя, зарегистрированного на его супругу, с просьбой посодействовать в получении большего объема подрядных работ. Обвиняемый согласился и в период с сентября 2021 по март 2022 года помог подконтрольному его знакомому индивидуальному предпринимателю, выступавшему единственным поставщиком заключить с управлением благоустройства и озеленения городской администрации 58 прямых контрактов на общую сумму 29,4 млн рублей. С 12 декабря 2020 по 4 марта 2022 года индивидуальный предприниматель, не осведомленная о реальных назначениях денежных переводов, по указанию своего супруга, действовавшего по ранее достигнутой с обвиняемым договоренности, с банковских карт, зарегистрированных на ее имя, периодически осуществляла безналичные переводы денежных средств на банковскую карту обвиняемого, в качестве взятки за оказанное им содействие в получении подрядных работ, на общую сумму 8,9 млн рублей. По мере поступления денежных средств на банковскую карту обвиняемый периодически снимал их и распоряжался по своему усмотрению.Благодаря грамотно спланированным и проведенным сотрудниками следственного управления СК России и регионального УФСБ совместным следственным действиям и оперативно-розыскным мероприятиям обвиняемый был задержан. По ходатайству следственных органов судом в отношении него избрана мера пресечения в виде домашнего ареста и он отстранен от занимаемой должности.В ходе следствия обвиняемый полностью признал свою вину в инкриминируемом преступлении и активно способствовал раскрытию и расследованию преступления.Следствием собрано достаточно доказательств, в связи с чем уголовное дело с утвержденным обвинительным заключением направлено в суд для рассмотрения по существу.Расследование уголовного дела в отношении начальника одного из муниципальных учреждений продолжается."
/news/item/1691600/,osetia,Перед судом предстанет женщина по обвинению в даче взятки должностному лицу,['взятка'],01 Мая 2021,"Следственным управлением Следственного комитета Российской Федерации по Республике Северная Осетия – Алания завершено расследование уголовного дела в отношении 60-летней жительницы селения Сунжа Пригородного района. Она обвиняется в совершении преступления, предусмотренного п. «б» ч. 4 ст. 291 УК РФ (дача взятки должностному лицу за совершение заведомо незаконных действий в крупном размере).
По данным следствия, в период с 6 декабря 2021 по 4 февраля 2022года сотрудниками регионального УФСБ проведены оперативно-розыскные мероприятия с целью документирования противоправной деятельности обвиняемой, связанной с незаконным завладением пенсионными начислениями ранее умершего местного жителя. 12 января 2022 года женщина, узнав о проводимых в отношении нее мероприятий, с целью избежания привлечения к уголовной ответственности, обратилась к оперуполномоченному ФСБ с предложением за 500 тыс. рублей прекратить проверочные мероприятия в отношении нее, о чем незамедлительно было доложено начальнику УФСБ России по РСО-Алания. В рамках проведения оперативно-розыскных мероприятий, обвиняемая неоднократно подтвердила свое намерение дать взятку должностному лицу за совершение действий в ее пользу. 17 февраля 2022 года примерно в 15 часов при передаче оперуполномоченному 500 тыс. рублей обвиняемая была задержана сотрудниками регионального УФСБ.
Следствием собрано достаточно доказательств, в связи с чем уголовное дело с утвержденным обвинительным заключением направлено в суд для рассмотрения по существу."
/news/item/1589648/,osetia,Перед судом предстанет бывший следователь полиции по обвинению в получении взятки в крупном размере,"['взятка', 'полицейский']",20 Апреля 2021,"Следственным управлением Следственного комитета Российской Федерации по Республике Северная Осетия – Алания завершено расследование уголовного дела в отношении бывшего следователя 1 отдела  следственного управления УМВД России по городу Владикавказу. Он обвиняется в совершении преступления, предусмотренного п. «в» ч. 5 ст. 290 УК РФ (получение взятки в крупном размере).
По данным следствия, 17 марта 2021 года обвиняемый в составе следственно-оперативной группы выехал на место происшествия по факту кражи ноутбука в общежитии Северо-Кавказского горно-металлургического института. В ходе оперативно-розыскных мероприятий было установлено лицо, совершившее кражу, которое доставили в служебный кабинет следователя. В ходе устной беседы обвиняемый потребовал от мужчины взятку в сумме 250 тыс. рублей за возбуждение уголовного дела по менее тяжкой статье и не принятие мер по избранию в отношении него меры пресечения связанной с лишением свободы. Потерпевший, опасаясь негативных для себя последствий, согласился и обратился за помощью в правоохранительные органы. 19 марта 2021 года примерно в 9 часов при получении от потерпевшего части взятки в размере 50 тыс. рублей следователь был задержан сотрудниками регионального УФСБ.
В ходе расследования обвиняемый полностью признал свою вину и ему предъявлено обвинение в инкриминируемом преступлении.  
Следствием собрано достаточно доказательств, в связи с чем уголовное дело с утвержденным обвинительным заключением направлено в суд для рассмотрения по существу."
/news/item/1687961/,osetia,Во Владикавказе женщине предъявлено окончательное обвинение в даче взятки должностному лицу,['взятка'],19 Апреля 2021,"Следственным управлением Следственного комитета Российской Федерации по Республике Северная Осетия – Алания 60-летней жительнице селения Сунжа Пригородного района предъявлено обвинение в совершении преступления, предусмотренного п. «б» ч. 4 ст. 291 УК РФ (дача взятки должностному лицу за совершение заведомо незаконных действий в крупном размере).
По данным следствия, в период с 6 декабря 2021 по 4 февраля 2022года сотрудниками регионального УФСБ проведены оперативно-розыскные мероприятия с целью документирования противоправной деятельности обвиняемой, связанной с незаконным завладением пенсионными начислениями ранее умершего местного жителя. 12 января 2022 года женщина, узнав о проводимых в отношении нее мероприятий, с целью избежания привлечения к уголовной ответственности, обратилась к оперуполномоченному ФСБ с предложением за 500 тыс. рублей прекратить проверочные мероприятия в отношении нее, о чем незамедлительно было доложено начальнику УФСБ России по РСО-Алания. В рамках проведения оперативно-розыскных мероприятий, обвиняемая неоднократно подтвердила свое намерение дать взятку должностному лицу за совершение действий в ее пользу. 17 февраля 2022 года примерно в 15 часов при передаче оперуполномоченному 500 тыс. рублей обвиняемая была задержана сотрудниками регионального УФСБ.
В настоящее время уголовное дело направлено прокурору для утверждения обвинительного заключения."
/news/item/1814095/,osetia,В отношении заместителя начальника отдела региональной налоговой службы возбуждено еще два уголовных дела за коррупционные преступления,"['взятка', 'вымогательство']",31 Марта 2021,"Следственным управлением Следственного комитета Российской Федерации по Республике Северная Осетия – Алания в отношении   заместителя начальника отдела камерального контроля специальных налоговых режимов № 2 Управления федеральной налоговой службы России по РСО-Алания возбуждено еще два уголовных дела. Она подозревается в совершении преступлений, предусмотренных ч. 2 ст. 290 УК РФ (получение взятки в значительном размере) и п. «б» ч. 5 ст. 290 (вымогательство взятки).
По версии следствия, в период с 7 мая 2020 по 11 октября 2022 года подозреваемая, являясь должностным лицом, получила взятки в значительном размере и путем вымогательства на общую сумму 151 тыс. рублей от представителей индивидуальных предпринимателей за непроведение в отношении них налоговых проверок и беспрепятственное осуществление предпринимательской деятельности.  
Противоправная деятельность подозреваемой пресечена благодаря грамотно спланированным и проведенным сотрудниками СК России и Управления «К» 4 службы ФСБ России, УФСБ России по РСО-Алания, ГУ МВД России по СКФО совместным следственным действиям и оперативно-розыскным мероприятиям.
Ранее уже сообщалось, что в отношении подозреваемой расследуется уголовное дело, возбужденное за аналогичные преступления. В рамках расследуемого уголовного дела женщина задержана, по ходатайству следственных органов судом в отношении нее избрана мера пресечения в виде заключения под стражу и ей предъявлено обвинение в содеянном.
В  ближайшее время уголовные дела будут соединены в одном производстве, и чиновнице будет предъявлено обвинение по вновь выявленным эпизодам получения взяток. Кроме того, проводятся следственные действия и оперативно-розыскные мероприятия, направленные на установление других эпизодов ее противоправной деятельности."
