Link,Topic,Card Title,Tags,Date,Card Text
/news/item/1830413/,kamchatka,"Бывший сотрудник исправительной колонии обвиняется в получении взятки, а также в совершении служебного подлога","['взятка', 'служебный подлог']",26 Октября 2018,"Следственным отделом по городу Елизово СУ СК России по Камчатскому краю завершено расследование получения взятки в значительном размере, а также совершения служебного подлога бывшим сотрудником исправительной колонии № 6 УФСИН России по Камчатскому краю (ч. 3 ст. 290, ч. 2 ст. 292 УК РФ).
Следствием установлено, что заместитель начальника ФКУ ИК № 6 УФСИН России по Камчатскому краю в 2022 году организовал преступную схему путем внесения в официальные документы заведомо ложных сведений об условиях поставки товаров для нужд учреждения.
Так, злоумышленник, достоверно зная о том, что индивидуальный предприниматель совместно с мужем с марта 2021 года осуществляют поставку исправительной колонии товаров в рамках государственных закупок, дважды потребовал включить в приложения к государственным контрактам заведомо ложные сведения о поставке 500 единиц продовольственной продукции, приобретение которой фактически не планировалось, а также внести в официальные документы заведомо ложные сведения о поставке учреждению строительного материала, который фактически не приобретался, после чего организовал заключение и подписание  данных государственных контрактов с недостоверными сведениями.
За осуществление данных незаконных мероприятий и дальнейшее общее покровительство предпринимателю для продолжения поставок товаров заместитель начальника исправительного учреждения получил от мужчины взятку в общей сумме 118 000 рублей.
В результате совершенного служебного подлога и незаконного перечисления бюджетных средств за непоставленный товар и товар более дешевый исправительной колонии причинен ущерб на сумму свыше 151 тыс. рублей.
Следствием собрана достаточная доказательственная база, в связи с чем уголовное дело передано прокурору для решения вопроса об утверждении обвинительного заключения и последующего направления в суд для рассмотрения по существу.
Уголовное дело расследовалось при оперативном сопровождении сотрудников собственной безопасности УФСИН России по Камчатскому краю и сотрудников полиции."
/news/item/1877521/,kamchatka,Возбуждено уголовное дело по факту получения должностным лицом взятки в особо крупном размере,['взятка'],26 Октября 2018,"Следственным отделом по г. Елизово СУ СК России по Камчатскому краю возбуждено уголовное дело в отношении 49-летней заведующей дошкольного учреждения по факту получения взятки в особо крупном размере за заведомо незаконные действия (ч. 6 ст. 290 УК РФ).
По версии следствия, в период с июня по июль 2019 года делопроизводитель одного из дошкольных учреждений Елизовского района, в связи с переездом в другой регион и желанием в дальнейшем получения пенсии в повышенном размере за работу в районах Крайнего Севера и приравненных к ним местностям, предложила заведующей учреждения взятку в особо крупном размере в виде предоставления иных имущественных прав, связанных с возможностью получения её заработной платы и иных выплат, путем использования её банковской карты, за совершение заведомо незаконных действий.
Женщина, согласившись, получила от делопроизводителя её банковскую карту, и в период с июля 2019 года по апрель 2024 года вносила в табель учета рабочего времени и расчета заработной платы сотрудников заведомо ложные сведения об осуществлении делопроизводителем трудовой деятельности, а также издавала документы, на основании которых перечислялась её заработная плата на банковский счет банковской карты, используя которую заведующая учреждения получила не менее 2 219 тыс. руб., которыми она распорядилась в личных целях.
Поводом для возбуждения уголовного дела послужили материалы оперативно-розыскной деятельности ОЭБиПК ОМВД России по Елизовскому району.
Расследование уголовного дела продолжается, проводятся следственные и иные процессуальные действия, направленные на установление всех обстоятельств произошедшего."
/news/item/1574421/,kamchatka,"Завершено предварительное расследование уголовного дела по факту присвоения имущества и служебного подлога, совершенных начальником почтового отделения","['присвоение', 'служебный подлог']",15 Октября 2018,"Мильковским межрайонным следственным отделом СУ СК России по Камчатскому краю завершено расследование уголовного дела по обвинению начальника почтового отделения села Эссо в присвоении вверенного имущества и служебном подлоге (ч.1 ст.160, ч.1 ст.292 УК РФ).
В ходе предварительного следствия установлено, что в период с 2019 года по 2020 год злоумышленница, 1978 года рождения, систематически присваивала себе табачную продукцию, принадлежащую АО «Почта России», в результате чего образовалась недостача товарно-материальных ценностей на сумму 178 тысяч рублей.
Желая скрыть хищение, обвиняемая внесла в отчётные документы заведомо ложные сведения о поступлении денежных средств за товар в кассу, чего фактически не сделала.  
В ходе расследования уголовного дела злоумышленница признала свою вину в совершенном преступлении, в содеянном раскаялась, частично возместила причинённый ущерб.
В настоящее время уголовное дело направлено прокурору для решения вопроса об утверждении обвинительного заключения и последующего направления в суд для рассмотрения по существу."
/news/item/1342180/,kamchatka,В Камчатском крае бывший сотрудник Росприроднадзора обвиняется в получении взяток,['взятка'],03 Октября 2018,"Отделом по расследованию особо важных дел следственного управления Следственного комитета России по Камчатскому краю завершено расследование уголовного дела в отношении бывшего заместителя начальника отдела экологического надзора Управления Федеральной службы по надзору в сфере природопользования по Камчатскому краю (далее Росприроднадзор). Он обвиняется в совершении трех преступлений, предусмотренных ч. 3 ст. 290 УК РФ (получение взятки).
По данным следствия, 16 ноября 2018 года заместитель начальника отдела экологического надзора Управления Федеральной службы по надзору в сфере природопользования по Камчатскому краю находясь в автомашине марки «Тойота Ленд Крузер Прадо», около торгового центра  «Шамса-Холдинг» по адресу: г. Петропавловск-Камчатский, проспект Победы, д. 67, за совершение незаконных действий в пользу предприятия, а также за общее покровительство, на которое распространяются его контрольные и надзорные функции, как должностного лица контролирующего органа, а именно: за не включение Общества в ежегодный план проведения плановых проверок юридических лиц в  пределах компетенции Росприроднадзора, предупреждение учредителя Общества о планируемых плановых и внеплановых проверках производственной деятельности Общества, способствование в оформлении различных разрешительных документов, консультирование по вопросам экологического надзора в области водных биологических ресурсов в целях избежать административной ответственности за нарушение экологического законодательства, получил от  учредителя рыбоперерабатывющего предприятия взятку в сумме 50 тысяч рублей.
         После получения взятки сотрудник Росприроднадзора взят с поличным сотрудниками УЭБиПК УМВД России по Камчатскому краю. Силовое сопровождение данной операции осуществляли представители специальных подразделений Росгвардии Камчатского края.
         Кроме того, в ходе следствия установлены еще два факта преступной деятельности обвиняемого. Так, по данным следствия в 2013 и 2015 году он также получал от учредителя этого же рыбоперерабатывающего предприятия взятки в общей сумме 60 тысяч рублей.
Следствием собрана достаточная доказательственная база, в связи с чем, уголовное дело с обвинительным заключением направлено прокурору для утверждения обвинительного заключения и последующего направления в суд для рассмотрения по существу."
/news/item/1646885/,kamchatka,Завершено расследование уголовного дела о даче взятке должностному лицу,['взятка'],01 Октября 2018,"Следственным отделом по г. Петропавловск-Камчатский СУ СК России по Камчатскому краю завершено расследование уголовного дела, возбужденного по факту дачи взятки должностному лицу, совершенной группой лиц по предварительному сговору (п. «а» ч. 4 ст. 291 УК РФ).
По версии следствия, 48-летний подозреваемый совместно со своим 34-летним знакомым в дневное время 10 октября, находясь в салоне автомобиля в районе Приморской улицы краевого центра, дали взятку в виде денег в размере 25 000 рублей старшему государственному инспектору пограничного управления ФСБ России по Восточному арктическому району за возвращение ранее изъятой из незаконного оборота икорной продукции, общей массой свыше 110 кг.
Должностное лицо действовало в рамках оперативно-розыскного мероприятия, в связи с чем к уголовной ответственности за получение взятки не привлекается.
Уголовное дело возбуждено на основании материалов оперативно-розыскной деятельности пограничного управления ФСБ России по Восточному Арктическому району.
Предварительное следствие по уголовному делу завершено и оно передано прокурору для решения вопроса об утверждении обвинительного заключения."
/news/item/1280357/,kamchatka,Бывший бухгалтер предприятия подозревается в присвоении денежных средств,"['деньги', 'присвоение']",28 Сентября 2018,"Мильковским межрайонным следственным отделом следственного управления СК России по Камчатскому краю возбуждено уголовное дело в отношении 35-летней жительницы села Мильково, ранее занимавшей должность бухгалтера Общества, занимающегося реализацией продуктов питания в розницу. Она подозревается в совершении  преступления, предусмотренного  ч.3 ст. 160 УК РФ (присвоение чужого имущества, вверенного виновному с использованием служебного положения).
По версии следствия, злоумышленница, работавшая в должности бухгалтера, из корыстных побуждений, выраженных в стремлении улучшить свое материальное благосостояние, желая погасить ранее взятые кредиты для собственных нужд, самостоятельно без соответствующего разрешения директора и учредителей данной организации, путем переводов с расчетного счета организации денежных средств на собственные лицевые счета, в течении 2018 года произвела не менее 5 переводов денежных средств на общую сумму более 400 тысяч рублей, причинив тем самым имущественный вред в крупном размере юридическому лицу. 
В настоящее время проводятся следственные действия, направленные на установление всех обстоятельств произошедшего. Расследование уголовного дела продолжается."
/news/item/1285833/,kamchatka,В следственном отделе по ЗАТО город Вилючинск проведён «круглый стол»,[],25 Сентября 2018,"В следственном отделе по ЗАТО город Вилючинск следственного управления Следственного комитета Российской Федерации по Камчатскому краю прошла рабочая встреча в форме «круглого стола» под председательством исполняющего обязанности руководителя отдела Артёменко Дмитрия, в которой приняли участие сотрудники администрации Вилючинского городского округа.
Предметом обсуждения собравшихся стали положения антикоррупционного законодательства и Гражданского кодекса, в том числе содержащие запрет на дарение подарков лицам, замещающим должности федеральной государственной службы, федеральной государственной гражданской службы и муниципальной службы. Собравшимся разъяснено, что исключением являются подлежащие сдаче подарки, которые получены в связи с протокольными мероприятиями, со служебными командировками и с другими официальными мероприятиями, а получение должностными лицами подарка в иных случаях является нарушением запрета, установленного законодательством Российской Федерации, создает условия для возникновения конфликта интересов, ставит под сомнение объективность принимаемых ими решений, а также влечет ответственность, предусмотренную законодательством, вплоть до увольнения в связи с утратой доверия, а в случае, когда подарок расценивается как взятка, - уголовную ответственность. В канун новогодних и рождественских праздников эта тема особенно актуальна, поскольку праздники традиционно сопровождаются дарением подарков. При этом получение подарков должностными лицами во внеслужебное время от своих друзей или иных лиц, в отношении которых должностные лица непосредственно осуществляют функции государственного управления, является нарушением установленного запрета.
Необходимо воздерживаться от безвозмездного получения услуг, результатов выполнения работ, а также имущества, в том числе во временное пользование, поскольку получение подарков в виде любой материальной выгоды должностному лицу запрещено."
