Link,Topic,Card Title,Tags,Date,Card Text
/news/item/1830808/,murmansk,"Судом вынесен обвинительный приговор сотрудникам Печенгской ЦРБ, совершившим должностные преступления",['взятка'],19 Января 2023,"Фото СУ СК России по Мурманской области            

Собранные отделом по расследованию особо важных дел регионального СУ СК России доказательства признаны судом достаточными для вынесения обвинительного приговора врачу психиатру-наркологу-профпатологу Печенгской ЦРБ, который признан виновным в совершении преступлений, предусмотренных ч. 3 ст. 290 УК РФ (получение должностным лицом взятки за незаконные действия), ч. 1 ст. 291.2 УК РФ (мелкое взяточничество), ч. 1 ст. 292 УК РФ (служебный подлог), ч. 4, 5 ст. 33, ч. 4 ст. 274.1. УК РФ (подстрекательство, пособничество в неправомерном воздействии на критическую информационную инфраструктуру Российской Федерации), и бывшей медицинской сестре Печенгской ЦРБ, которая признана виновной в совершении преступления, предусмотренного ч. 4 ст. 274.1 УК РФ (неправомерное воздействие на критическую информационную инфраструктуру Российской Федерации).
Следствием и судом установлено, что в 2021 году осужденный, являясь должностным лицом, за денежные вознаграждения осуществлял в пользу взяткодателей заведомо незаконные действия. Они выражались в оформлении фиктивных медицинских заключений об отсутствии противопоказаний к управлению транспортными средствами, медицинских заключений по результатам предварительного, периодического медицинских осмотров,  фиктивных больничных листов. Кроме того, мужчина обеспечил внесение в Единую государственную информационную систему в сфере здравоохранения фиктивных сведений о вакцинации от КОВИД-19 для последующего получения гражданами не соответствующих действительности сертификатов о вакцинации. Всего осужденным в качестве взяток получено более 220000 рублей.
Осужденная при подстрекательстве и пособничестве врача на основании предоставленных ей сфальсифицированных документов вносила в Единую государственную информационную систему фиктивные сведения о якобы пройденной взяткодателями вакцинации от КОВИД-19. Тем самым осужденные оказали неправомерное воздействие на объект критической информационной структуры России.
Противоправная деятельность фигурантов выявлена и пресечена следователями во взаимодействии с оперативными сотрудниками УФСБ России по Мурманской области.
Следователями проведен значительный комплекс следственных и процессуальных действий, направленных на установление всех обстоятельств произошедшего. В качестве свидетелей допрошено более 100 человек, проведено 20 экспертиз и исследований, изъята и осмотрена медицинская документация, которая приобщена к делу в качестве вещественных доказательств.
Приговором суда мужчине назначено наказание в виде исправительных работ с удержанием части заработка в доход государства со штрафом в размере 1,5 млн. рублей и запрета занимать должности в органах и учреждениях здравоохранения, связанные с организационно-распорядительными функциями. Женщина осуждена к исправительным работам с удержанием части заработка в доход государства и запрета занимать должности в органах и учреждениях здравоохранения, связанные с организационно-распорядительными функциями.
 
Старший помощник руководителя Следственного управления Следственного комитета РФ по Мурманской области (по информационному взаимодействию с общественностью и СМИ) Евгений Ребров"
/news/item/1559162/,murmansk,Жителю Кандалакши судом вынесен обвинительный приговор за покушение на дачу взятки должностному лицу,"['взятка', 'приговор']",22 Декабря 2022,"Фото из открытых источников            

Собранные следственным отделом по городу Кандалакша Следственного управления Следственного комитета Российской Федерации по Мурманской области доказательства признаны судом достаточными для вынесения обвинительного приговора в отношении 37-летнего жителя Кандалакши. Он признан виновным в покушении на дачу взятки должностному лицу за совершение последним заведомо незаконных действий, то есть совершения преступления, предусмотренного ч. 3 ст. 30, ч. 3 ст. 291 УК РФ.
Следствием и судом установлено, что в ночь с 6 на 7 января 2021 года подсудимый управлял транспортным средством в состоянии алкогольного опьянения. На одной из улиц в городе Полярные Зори мужчина остановлен нарядом ДПС. После установления факта опьянения водителя, его автомобиль был изъят.
На следующий день в рамках административного разбирательства мужчина прибыл в отдел ГИБДД. Находясь в служебном кабинете, виновный передал инспектору ДПС денежные средства в размере 30 000 рублей, положив их между страниц кодекса Российской Федерации об административных правонарушениях, находившегося на  письменном столе. Он рассчитывал на то, что приняв указанную взятку, сотрудник полиции не будет составлять документы об административном правонарушении, и подсудимый сможет избежать ответственности за управление автомобилем в состоянии опьянения.
Однако инспектор незаконное вознаграждение не принял. Преступные действия взяткодателя пресечены и надлежащим образом зафиксированы.
Вину в совершении преступления подсудимый признал полностью, в содеянном раскаялся, пояснив, что боялся лишиться права управления транспортным средством.
Приговором суда мужчине назначено наказание назначено наказание в виде штрафа в размере 60 000 рублей. Приговор в законную силу не вступил.
 
Старший помощник руководителя Следственного управления Следственного комитета РФ по Мурманской области по взаимодействию со СМИ Алина Александрович"
/news/item/1704878/,murmansk,Начальнику Мурманскавтодора предъявлено обвинение в получении взятки в особо крупном размере,['взятка'],21 Декабря 2022,"Фото СУ СК России по Мурманской области            

Следственным отделом по городу Мурманск Следственного управления Следственного комитета Российской Федерации по Мурманской области расследуется уголовное дело по признакам преступления, предусмотренного ч. 6 ст. 290 УК РФ (получение взятки в особо крупном размере).
По данным следствия, в 2020-2021 годах между ГОКУ «Мурманскавтодор» и коммерческой организацией возникли договорные обязательства в связи с заключением соответствующих государственных контрактов, согласно которым организация, как подрядчик и субподрядчик, обязалась выполнить работы по содержанию и ремонту автомобильных дорог общего пользования регионального или межмуниципального значения Мурманской области. Общая сумма контрактов превысила 320 миллионов рублей.
При этом начальник ГОКУ «Мурманскавтодор» потребовал от руководителя организации передачи ему в качестве взятки в размере более 4 миллионов рублей за невыявление недостатков при осуществлении текущего контроля и приемку выполненных работ вне зависимости от их качества.
9 июля 2022 года в ходе встречи на территории Октябрьского округа в городе Мурманске начальник ГОКУ «Мурманскавтодор» получил требуемую им сумму от руководителя коммерческой организации наличными денежными средствами, после чего его деятельность была пресечена во взаимодействии с УФСБ России по Мурманской области.
В настоящее время чиновнику предъявлено обвинение, он дает показания. По ходатайству следствия судом в отношении него избрана мера пресечения в виде заключения под стражу на срок 2 месяца, то есть по 8 сентября 2022 года.
По уголовному делу проводятся обыски, в том числе в помещениях ГОКУ «Мурманскавтодор» и Министерства транспорта и дорожного хозяйства Мурманской области. Расследование уголовного дела продолжается.
 
Старший помощник руководителя Следственного управления Следственного комитета РФ по Мурманской области (по информационному взаимодействию с общественностью и СМИ) Алина Александрович"
/news/item/1443668/,murmansk,В Мурманской области бывшему сотруднику исправительной колонии вынесен обвинительный приговор по факту получения взятки,"['взятка', 'должностное лицо', 'приговор']",09 Декабря 2022,"Фото из открытых источников            

Собранные следственным отделом по Кольскому району следственного управления Следственного комитета Российской Федерации по Мурманской области доказательства признаны судом достаточными для вынесения обвинительного приговора в отношении бывшего должностного лица ФКУ ИК-18 УФСИН России по Мурманской области. Он признан виновным в совершении преступления, предусмотренного ч. 3 ст. 290 УК РФ (получение должностным лицом лично взятки в виде денег за незаконные действия).
Следствием и судом установлено, что летом 2019 года младший инспектор группы надзора отдела безопасности, вступил в нерегламентированные законодательством РФ отношения с осужденным ФКУ ИК-18. В ходе общения последний предложил сотруднику за взятку совершить заведомо незаконные действия, направленные на пронос на режимную территорию исправительного учреждения и последующую передачу ему запрещенных к свободному обороту на территории колонии предметов – мобильного телефона и комплектующих к нему, обеспечивающих его работу. Согласно правилам внутреннего распорядка исправительных учреждений мобильные телефоны входят в перечень предметов, которые осужденным запрещается иметь при себе, получать в посылках, передачах, бандеролях либо приобретать.
За вышеуказанные незаконные действия сотрудник исправительного учреждения получил денежные средства в размере 17 600 рублей.
Преступление выявлено в ходе мероприятий, проведенных оперативными сотрудниками отдела собственной безопасности УФСИН России по Мурманской области во взаимодействии с сотрудниками экономической безопасности полиции.
В ходе предварительного расследования следователями проведен комплекс следственных действий, направленный на сбор доказательств. Вину в инкриминируемых преступлениях подсудимый признал в полном объеме.
Приговором суда виновному назначено наказание в виде штрафа в размере 250 000 рублей с лишением права занимать должности, связанные с осуществлением организационно-распорядительных и административно-хозяйственных функций на государственной службе, в государственных органах, органах местного самоуправления, государственных и муниципальных учреждениях сроком на 2 года.  Приговор в законную силу не вступил.
 
Старший помощник руководителя Следственного управления Следственного комитета РФ по Мурманской области по взаимодействию со СМИ Алина Александрович"
/news/item/1636130/,murmansk,Сотрудник исправительного учреждения предстанет перед судом за получение взятки,"['взятка', 'коррупция']",07 Декабря 2022,"Фото из открытых источников            

Следственным отделом по Кольскому району Следственного комитета Российской Федерации по Мурманской области завершено расследование уголовного дела в отношении сотрудника ФКУ ИК-16 УФСИН России по Мурманской области, 1989 года рождения. Он обвиняется в совершении преступления, предусмотренного ч. 3 ст. 290 УК РФ (получение взятки за заведомо незаконные действия).
По версии следствия, в сентябре 2021 года младший инспектор отдела безопасности ФКУ ИК-16 УФСИН России по Мурманской области договорился с одним из осужденных о передаче последнему мобильного телефона за незаконное вознаграждение суммой 30 000 рублей. При этом половину взятки осужденный должен был перевести на указанный должностным лицом банковский счет до передачи ему телефона, вторую половину – после.
Согласно правилам внутреннего распорядка исправительных учреждений аудиотехника и мобильные телефоны входят в перечень предметов, которые осужденным запрещается иметь при себе, получать в посылках, передачах, бандеролях либо приобретать.
В октябре 2021 года обвиняемый, получив часть незаконного вознаграждения, передал осужденному мобильный телефон. Получить вторую половину взятки обвиняемому не удалось по независящим от него обстоятельствам, его преступная деятельность была пресечена сотрудниками подразделения собственной безопасности УФСИН России по Мурманской области.
В ходе предварительного расследования следователями проведен комплекс следственных действий, направленный на сбор доказательств. Вину в инкриминируемом деянии подсудимый признал в полном объеме.
В настоящее время следствием собрана достаточная доказательственная база, в связи с чем уголовное дело с утвержденным прокурором обвинительным заключением направлено в суд для рассмотрения по существу.
 
Старший помощник руководителя Следственного управления Следственного комитета РФ по Мурманской области (по информационному взаимодействию с общественностью и СМИ) Алина Александрович"
