Link,Topic,Card Title,Tags,Date,Card Text
/news/item/1545346/,chel,"В Челябинской области возбуждено уголовное дело в отношении лиц, подозреваемых в совершении коррупционных преступлений",[],01 Марта 2019,"Следственными органами Следственного комитета Российской Федерации по Челябинской области возбуждено уголовное дело в отношении пяти соучастников, подозреваемых в соответствии со степенью участия в совершении преступлений, предусмотренных п.п.«а,в» ч.5 ст.290 УК РФ (получение взятки), п.п.«а,б» ч.4 ст.291  УК РФ (дача взятки группой лиц в крупном размере).
По версии следствия, в 2019 году подозреваемые, в число которых входит руководитель коммерческой организации, дали взятку в виде оргтехники на сумму более 185 тысяч рублей двум сотрудникам организации, контролировавшей ведение дорожных работ, за непринятие мер по выявленным нарушениям при выполнении дорожных работ на федеральной трассе.
Преступление выявлено сотрудниками Управления ФСБ России по Челябинской области,   которые осуществляют оперативное сопровождение уголовного дела.
Решается вопрос об избрании меры пресечения и предъявлении обвинения. Расследование уголовного дела продолжается.
 
 
Следственное управление
СК России по Челябинской области
04.03.2021"
/news/item/1572926/,chel,В Челябинской области бывшие сотрудники налоговой инспекции подозреваются в совершении коррупционных преступлений,[],28 Февраля 2019,"Следственными органами Следственного комитета Российской Федерации по Челябинской области возбуждено уголовное дело в отношении бывших начальника отдела районной налоговой инспекции и двух инспекторов (г.Магнитогорск), подозреваемых в соответствии со степенью участия, в совершении преступлений, предусмотренных п.«в»  ч.5 ст.290 УК РФ (получение взятки), п.«б» ч.3 ст.291.1 УК РФ (посредничество во взяточничестве).
По версии следствия, в 2017 году начальник отдела налоговой инспекции и инспектор отдела получили через посредника – бывшего сотрудника налоговой службы от директора коммерческой организации взятки в сумме 750 тысяч рублей за непринятие мер, установленных законодательством по результатам проведенной налоговой проверки юридического лица.
Преступление выявлено сотрудниками Управления ФСБ России по Челябинской области, которые осуществляют оперативное сопровождение уголовного дела.
В настоящее время следователем СК проводятся следственные действия, направленные на установление всех обстоятельств, решается вопрос о предъявлении обвинения и избрании меры пресечения.
  
Следственное управление
СК России по Челябинской области
24.05.2021"
/news/item/1780469/,chel,В Челябинской области сотрудник регионального министерства образования подозревается в получении взятки,"['взятка', 'деньги', 'следователь СК']",27 Февраля 2019,"Следственными органами Следственного комитета Российской Федерации по Челябинской области возбуждено уголовное дело в отношении главного специалиста отдела лицензирования регионального министерства образования,  подозреваемой в совершении преступления, предусмотренного п.«в» ч.5 ст.290 УК РФ (получение взятки).
По данным следствия, подозреваемая получила взятку в виде денежных средств в крупном размере от руководителя образовательного учреждения за беспрепятственную и гарантированную выдачу лицензии на ведение образовательной деятельности.

Преступление выявлено сотрудниками Управления ФСБ России по Челябинской области, которые осуществляют оперативное сопровождение уголовного дела.
Решается вопрос об избрании меры пресечения и предъявлении обвинения. 
  
Следственное управление
СК России по Челябинской области
11.04.2023"
/news/item/1170639/,chel,"В Челябинской области осуждены трое бывших сотрудников ГИБДД, признанные виновными в превышении должностных полномочий и   покушении на вымогательство взятки",[],15 Февраля 2019,"Собранные следственными органами Следственного комитета Российской Федерации по Челябинской области доказательства признаны достаточными для вынесения приговора в отношении трех бывших инспекторов полка ДПС ГИБДД ГУ МВД России по Челябинской области: Руслана Гарипова, Андрея Москаля и Дмитрия Пашнина, признанных виновными в совершении преступлений, предусмотренных ч.1 ст.286 УК РФ (превышение должностных полномочий), ч.3 ст.30, п.«б» ч.5 ст.290 УК РФ (покушение на вымогательство взятки).     
Следствием и судом установлено, что 20 августа 2016 года на автодороге «Аргаяш-Чебаркуль», в ходе исполнения служебных обязанностей, осужденные  остановили легковой автомобиль, за управлением которого находился местный житель. При проверке документов они установили, что у последнего истек срок действия прав на управление транспортным средством, после чего стали вымогать у хозяйки автомобиля, находившийся в салоне 30000 рублей за не привлечение к административной ответственности за совершение правонарушения, предусмотренного ст.12.32  КоАП РФ (допуск к управлению транспортным средством водителя, не имеющего права управления транспортным средством). Так как, у женщины не имелось денежных средств, осужденные потребовали передать им паспорт и золотые серьги, которые пообещали вернуть при получении взятки в виде денежных средств. 5 сентября 2016 года после передачи части вымогаемой взятки в сумме 10000 рублей осужденные были задержаны сотрудниками управления собственной безопасности ГУ МВД России по Челябинской области, которые выявили данное преступление.
Приговором суда Пашнину назначено наказание в виде 8 лет лишения свободы, Москалю и Гарипову - 7,5 лет лишения свободы каждому с  отбыванием наказания в исправительной колонии строгого режима.
 
Следственное управление
СК России по Челябинской области
11.10.2017"
/news/item/1382117/,chel,"В Челябинской области осужден бывший сотрудник ФСИН, признанный виновным в получении взяток",[],12 Февраля 2019,"Собранные следственными органами Следственного комитета Российской Федерации по Челябинской области доказательства признаны судом достаточными для вынесения приговора в отношении  бывшего сотрудника исправительной колонии (город Магнитогорск), признанного виновным в совершении преступлений, предусмотренных ч.3 ст.290 УК РФ (получение взятки).
Следствием и судом установлено, что в период с сентября 2016 года по декабрь 2018 года осужденный получил взятки от представителей заключенных в сумме 21000 рублей за передачу на территорию исправительного учреждения запрещенных предметов: сотовых телефонов и гарнитуры к ним.
Приговором суда осужденному назначено наказание в виде лишения свободы сроком на 3 года условно. В рамках расследования уголовного дела следователем СК внесено представление начальнику исправительного учреждения об устранении причин, способствовавших совершению преступления.   
  
Следственное управление
СК России по Челябинской области
15.08.2019"
/news/item/1427521/,chel,В Челябинской области директору бюджетного учреждения предъявлено обвинение в получении взятки,[],08 Февраля 2019,"Следственными органами Следственного комитета Российской Федерации по Челябинской области директору государственного бюджетного учреждения здравоохранения «Челябинский областной медицинский информационно-аналитический центр» предъявлено обвинение в совершении преступления, предусмотренного п.«в» ч.5 ст.290 УК РФ (получение взятки).
По данным следствия, обвиняемый в апреле 2019 года получил взятку в сумме 165 тысяч рублей от подчиненного сотрудника за оказание общего покровительства, включение в списки к получению поощрительных выплат и т.д.  
Преступление выявлено сотрудниками регионального управления ФСБ России, которые осуществляют оперативное сопровождение уголовного дела.
Обвиняемый признал вину в совершении преступления. Ему избрана мера пресечения в виде домашнего ареста.
Расследование уголовного дела продолжается.
  
Следственное управление
СК России по Челябинской области
10.01.2020"
/news/item/1148000/,chel,"В Челябинской области завершено расследование уголовного дела в отношении бывшей сотрудницы органов внутренних дел, обвиняемой в получении взятки",[],08 Февраля 2019,"Следственными органами Следственного комитета Российской Федерации по Челябинской области завершено расследование уголовного дела в отношении бывшего следователя ОМВД России по Коркинскому району Марины Эртман, обвиняемой в совершении преступления, предусмотренного ч.1 ст.290 УК РФ (получение взятки).
По версии следствия, обвиняемая в городе Еманжелинске в июне 2016 года получила взятку от местного жителя в виде двух планшетов стоимостью более 15 тысяч рублей за незаконное прекращение уголовного дела, находившегося в ее производстве. В ходе расследования уголовного дела следователем СК наложен арест на автомобиль стоимостью 500 тысяч рублей, принадлежащий обвиняемой.
Преступление выявлено сотрудниками управления собственной безопасности ГУ МВД РФ по Челябинской области.
Следствием собрана достаточная доказательная база, в связи с чем уголовное дело направлено для рассмотрения в суд. В ходе расследования уголовного дела следователем СК начальнику ГСУ ГУ МВД России по Челябинской области внесено представление об устранении причин, способствовавших совершению преступления.
  
Следственное управление
СК России по Челябинской области
05.07.2017"
/news/item/1501775/,chel,"В Челябинской области вынесен приговор в отношении бывшего ректора университета и его дочери, признанных виновными в совершении коррупционных преступлений",[],28 Января 2019,"Собранные следственными органами Следственного комитета Российской Федерации по Челябинской области доказательства признаны судом достаточными для вынесения приговора в отношении бывшего ректора Уральского государственного университета физической культуры и его дочери, признанных в соответствии со степенью участия, виновными в совершении преступлений, предусмотренных ч.2, п.«в» ч.5 ст.290 УК РФ (получение взятки), ч.1 ст.286 УК РФ (превышение должностных полномочий), п.п.«а,б» ч.3 ст.291.1 УК РФ (посредничество во взяточничестве).
Следствием и судом установлено, что в период 2015-2016 годов, обвиняемый, будучи ректором университета, при содействии дочери получил взятки от представителей коммерческих организаций на сумму более 4,1 млн. рублей за оказание содействия при заключении, исполнении и оплате государственных контрактов и договоров с учебным учреждением. Также, в 2015 году осужденный, незаконно, без согласования с Министерством спорта Российской Федерации и территориальным управлением Росимущества сдавал предпринимателям в аренду помещения столовых и легкоатлетического манежа, под видом договоров на предоставления услуг, причинив университету ущерб на сумму свыше 5,6 млн. рублей.
Преступления выявлены сотрудниками регионального управления ФСБ России и ГУ МВД Российской Федерации по Челябинской области, которые осуществляли оперативное сопровождение по уголовному делу.  
По ходатайству следователя СК судом наложен арест на имущество обвиняемого стоимостью более 5 млн. рублей.
Приговором суда мужчиненазначено наказание в виде 6 лет лишения свободы с отбыванием в исправительной колонии строгого режима со штрафом 3 млн. рублей с лишением права занимать должности на государственной службе и руководящие должности в образовательных учреждениях на срок 3 года, его дочери – в виде 4 лет лишения свободы с отбыванием наказания в исправительной колонии общего режима со штрафом в размере 2 млн. рублей.
  
Следственное управление
СК России по Челябинской области
23.09.2020"
/news/item/1695447/,chel,В Челябинской области сотрудник бюджетного учреждения подозревается в получении взятки,"['взятка', 'коррупция', 'следователь СК']",25 Января 2019,"Следственными органами Следственного комитета Российской Федерации по Челябинской области возбуждено уголовное дело в отношении эксперта государственного бюджетного учреждения «Особо охраняемые природные территории Челябинской области», подозреваемого в совершении преступления, предусмотренного ч.3 ст.290 УК РФ (получение взятки).
По данным следствия, в период 2019 – 2021 гг. подозреваемый получил взятку в сумме более 50 тысяч рублей от предпринимателя за непривлечение его к административной ответственности за совершение экологического правонарушения.

Преступление выявлено сотрудниками ГУ МВД России по Челябинской области, которые осуществляют оперативное сопровождение уголовного дела.
В настоящее время проводятся следственные действия по установлению обстоятельств совершенного преступления. Решается вопрос об избрании меры пресечения и предъявлении обвинения. 
Расследование уголовного дела продолжается.
 
Следственное управление
СК России по Челябинской области
07.06.2022"
/news/item/1411620/,chel,"В Челябинской области завершено расследование уголовного дела в отношении главы Чебаркульского городского округа, обвиняемого в совершении коррупционных преступлений",[],29 Декабря 2018,"Следственными органами Следственного комитета Российской Федерации по Челябинской области завершено расследование уголовного дела в отношении главы Чебаркульского городского округа Сергея Ковригина,  обвиняемого в совершении преступлений, предусмотренных ч.2 ст.285 УК РФ (злоупотребление должностными полномочиями), ч.2 ст.286 УК РФ (превышение должностных полномочий), ч.4 ст.290 УК РФ (получение взятки).
По данным следствия, в 2016 году обвиняемый получил взятку в виде услуг неимущественного характера на сумму более 52000 рублей от представителя коммерческой организации за незаконную передачу объектов муниципальной собственности. Решением  Арбитражного суда Челябинской области по иску прокурора области в 2017 году договоры аренды по передаче указанного муниципального имущества признаны недействительными (ничтожными).
Оперативное сопровождение уголовного дела осуществляется сотрудниками ГУ МВД России по Челябинской области.
Следствием собрана достаточная доказательная база, в связи с чем уголовное дело направлено прокурору для утверждения обвинительного заключения.
  
Следственное управление
СК России по Челябинской области
20.11.2019"
