Link,Topic,Card Title,Tags,Date,Card Text
/news/item/1137791/,zabaykalye,В Забайкальском крае бывший начальник отделения Главного управления собственной безопасности МВД России признан виновным в совершении ряда преступлений,[],29 Мая 2019,"Собранные следственными органами Следственного комитета Российской Федерации по Забайкальскому краю доказательства признаны судом достаточными для вынесения обвинительного приговора бывшему начальнику отделения Управления «Р» Главного управления собственной безопасности МВД России Денису Гантимурову, обвиняемому в совершении преступлений, предусмотренных ч. 6 ст. 290 УК РФ (получение взяток в особо крупном размере), ч. 4 и 5 ст. 33, п. «з» ч. 2 ст. 105 УК РФ (подстрекательство и пособничество к убийству из корыстных побуждений), ч. 4 ст. 33, ч. 2 ст. 222 УК РФ (подстрекательство к незаконному хранению и ношению огнестрельного оружия и боеприпасов), ч. 4 ст. 33, ч.3 ст. 160 УК РФ (подстрекательство к совершению растраты, совершенной с использованием служебного положения).
Следствием и судом установлено, что Гантимуров, занимая должность в МВД России, фактически исполнял обязанности по обеспечению собственной безопасности в Забайкальском линейном управлении МВД России на транспорте. Будучи лично знаком с директором фирмы «Медведь» Ярославом Топорковым, занимавшимся реализацией контрактов с ОАО «РЖД» по перегрузу на железнодорожной станции поселка Забайкальск Забайкальского края импортных товаров, поступающих из КНР, в российский подвижной состав, Гантимуров требовал от него за оказание общего покровительства и организации прикрытия от проверок контролирующих органов взятки, составляющие до трети дохода фирмы. В течение 2011-2012 годов Гантимуров получил от Топоркова взятки на общую сумму 2,6 млн. рублей, что является особо крупным размером. 
В феврале 2012 года после того, как Гантимуров узнал, что Топорков скрывает от него реальную сумму получаемого фирмой дохода, в связи с чем платит взятки меньше оговоренного размера, решил убить последнего и завладеть его бизнесом. Для этого Гантимуров, действуя из корыстных побуждений, договорился с ранее ему знакомым бывшим полицейским совершить убийство Топоркова для захвата его фирмы. Совместно они подыскали через посредника двух ранее судимых местных жителей, согласившихся за денежное вознаграждение выступить в роли исполнителей убийства предпринимателя. Гантимуров и его соучастник склонили исполнителей убийства Топоркова к приобретению, хранению, ношению и перевозке огнестрельного оружия – пистолета марки «Марголин» и боеприпасов к нему. Утром 18 июня 2012 года нанятые убийцы выследили и застрелили предпринимателя в центре города Читы.
После этого Гантимуров в течение августа – ноября 2012 года продолжил получать взятки уже от нового руководителя коммерческой фирмы «Медведь», сумма которых составила 1 млн. 440 тысяч рублей.
Кроме того, в мае 2012 года Гантимуров склонил начальника тыла Забайкальского Линейного управления МВД России на транспорте к растрате путем завладения деньгами сотрудников управления, предназначенными для выплаты материальной помощи. Начальник тыла, действуя группой лиц с Гантимуровым, заставил четырех подчиненных ему полицейских написать рапорты на оказание им материальной помощи, а после получения денег передать ему. Полученные от сотрудников денежные средства в сумме около 92 тысяч рублей были им переданы Гантимурову, который всеми денежными средствами, полученными в виде взяток и в результате растраты, распорядился по своему усмотрению.
В ходе предварительного следствия и в судебном заседании Гантимуров вину в совершении преступлений признал полностью. 
Приговором Центрального районного суда Читы 36-летний Денис Гантимуров признан виновным и ему назначено наказание в виде лишения свободы на срок 10 лет с отбыванием в исправительной колонии строго режима, со штрафом в размере 350 тыс. рублей, с ограничением свободы на срок в 1 год. Кроме того, суд удовлетворил гражданский иск в интересах потерпевших о взыскании с осужденного возмещения морального вреда в сумме 1 млн. рублей.
Уголовные дела в отношении второго организатора и пособника убийства предпринимателя, непосредственных исполнителей заказного убийства, а также начальника тыла Забайкальского линейного управления МВД России на транспорте в настоящее время рассматриваются в суде."
/news/item/1751288/,zabaykalye,Следователи СК завершили расследование уголовного дела в отношении бывшего директора муниципального предприятия,['взятка'],06 Мая 2019,"Вторым отделом по расследованию особо важных дел следственного управления Следственного комитета Российской Федерации по Забайкальскому краю завершено расследование уголовного дела в отношении бывшего директора муниципального предприятия городского округа «Город Чита» Дорожно-мостовое ремонтно-строительное управление» Алексея Котова, обвиняемого в получении взятки в особо крупном размере (ч. 6 ст. 290 УК РФ).
По данным следствия, в конце 2021 года Котов получил взятку за заключение договора поставки оборудования — так называемый откат - от руководителя коммерческой фирмы. Сумма заключенного контракта составила около 52 млн рублей. В качестве предмета взятки выступил автомобиль Lexus RX 300 стоимостью около 4,3 млн рублей.
В ходе предварительного следствия Котов признал вину, в его отношении избрана мера пресечения в виде домашнего ареста.
Следователи собрали необходимую доказательственную базу, уголовное дело направлено для утверждения обвинительного заключения и дальнейшего направления в суд.
По действующему законодательству Котову грозит до пятнадцати лет лишения свободы со штрафом в размере до семидесятикратной суммы взятки."
/news/item/1534576/,zabaykalye,Следователи СК завершили расследование уголовного дела в отношении бывшего работника прокуратуры,"['взятка', 'мошенничество', 'прокурор']",15 Апреля 2019,"Вторым отделом по расследованию особо важных дел СУ СКР по Забайкальскому краю завершено расследование уголовного дела в отношении 53-летней жительницы Читы, бывшего работника прокуратуры. Она обвиняется в совершении преступлений, предусмотренных п. «в» ч. 5 ст. 290 (получение взятки в крупном размере), ч. 3 ст. 30, п. «в» ч. 5 ст. 290 (покушение на получение взятки в крупном размере), ч. 3 ст. 30, ч. 1 ст. 159 УК РФ (покушение на мошенничество).
По версии следствия, в 2019 году обвиняемая, занимая должность прокурорского работника, получила от главы одного из сёл в Читинском районе взятку в виде земельного участка стоимостью около 0,5 млн рублей.
В этом же году обвиняемая попыталась получить взятку в виде двух земельных участков общей стоимостью около 800 тыс. рублей от другого чиновника за осуществление общего покровительства. Довести преступный умысел до конца не удалось по не зависящим от обвиняемой обстоятельствам.
Кроме того, в 2020 году обвиняемая пыталась обманным путём завладеть денежными средствами из бюджета одного из сельских поселений в сумме 180 тыс. рублей. Преступные действия обвиняемой были пресечены прокуратурой Забайкальского края и сотрудниками ФСБ и не были доведены до конца по независящим от обвиняемой обстоятельствам.
Уголовное дело возбуждено по материалам прокуратуры Забайкальского края и регионального управления ФСБ. В ходе предварительного следствия обвиняемая уволена из органов прокуратуры.
Следователи собрали необходимую доказательственную базу, уголовное дело направлено прокурору для утверждения обвинительного заключения."
/news/item/1231008/,zabaykalye,Врач наркодиспансера подозревается в получении взятки за выдачу поддельных медсправок,"['взятка', 'деньги', 'коррупция']",27 Марта 2019,"Следственным отделом по Центральному району Читы следственного управления СКР по Забайкальскому краю возбуждено уголовное дело в отношении врача-нарколога-психиатра Забайкальского краевого наркологического диспансера. Он подозревается в совершении преступления, предусмотренного ч. 3 ст. 290 УК РФ (получение взятки за незаконные действия). 

По данным следствия, подозреваемый за взятки незаконно оформлял допуск к управлению транспортными средствами лиц, которые находились на учёте нарколога. 

Так, в мае 2018 года подозреваемый за 15 тысяч рублей проставил отметку в медицинской справке жителю Читы, стоящему на учёте в Наркологическом диспансере. 

Уголовное дело возбуждено по материалам оперативной разработки сотрудников отдела экономической безопасности и противодействия коррупции городского УМВД. 

Врач был задержан при передаче денег. На первом допросе он полностью признался в совершении преступления. Следователи СКР предполагают, что выявленный случай незаконного оформления медсправок не единичный. 

В настоящее время проводятся следственные действия, направленные на установление всех обстоятельств совершенного преступления. Расследование уголовного дела продолжается. В случае, если вина подозреваемого будет доказана, ему грозит до восьми лет лишения свободы либо штраф до двух млн. рублей."
/news/item/1394217/,zabaykalye,Завотделением онкодиспансера признан виновным во взяточничестве,[],14 Марта 2019,"Собранные следственными органами Следственного комитета Российской Федерации по Забайкальскому краю доказательства признаны судом достаточными для вынесения обвинительного приговора заведующему отделением ГУЗ «Забайкальский краевой онкологический диспансер». Он признан виновным в трёх фактах получения взяток (ч. 1 ст. 290 УК РФ), в том числе двух – в значительном размере (ч. 2 ст. 290 УК РФ), в трёх фактах мелкого взяточничества (ст. 291.2 УК РФ), а также в шести фактах злоупотребления должностными полномочиями (ч. 1 ст. 285 УК РФ).
Как установлено следствием и судом, в 2012-2015 годах завотделением использовал свои должностные полномочия для получения взяток от пациентов за их внеочередную госпитализацию в онкологический диспансер и проведение операций. Сумма взяток, которые получал врач, варьировалась от 10 до 45 тысяч рублей.
Преступление выявлено сотрудниками Управления экономической безопасности и противодействия коррупции УМВД России по Забайкальскому краю.
Приговором суда фигурант осуждён к 3,5 годам лишения свободы условно со штрафом в сумме 350 тыс. рублей. Кроме того, осужденный течение 1,5 лет лишён права занимать должности, связанные с осуществлением организационно-распорядительных функций в государственных и муниципальных учреждениях."
/news/item/1550424/,zabaykalye,"Следователи завершили расследование уголовного дела в отношении бывшего главврача родильного дома, обвиняемого в получении взятки",['взятка'],02 Ноября 2018,"Следственными органами Следственного комитета Российской Федерации по Забайкальскому краю завершено расследование уголовного дела в отношении бывшего главного врача читинского родительного дома № 1. Он обвиняется в совершении преступления, предусмотренного ч. 3 ст. 290 УК РФ (получение взятки в значительном размере, за незаконные действия).
По версии следствия, главный врач родильного дома получал взятки от директора фирмы, занимающейся поставкой медицинского оборудования, за оказание содействия при заключении договоров. Так, бывший главврач давал своим подчиненным незаконные указания связываться с представителями фирмы и согласовывать с ними технические задания на поставку медоборудования перед размещением на сайте госзакупок, что позволяло фирме беспрепятственно выигрывать аукционы.
В 2020 году благодаря указанным преступным действиям были заключены два госконтракта на поставку в родильный дом инкубатора для новорождённых и аппарата ингаляционной анестезии на общую сумму более 5,5 млн рублей. Общая сумма взяток, полученных бывшим главным врачом, составила 130 тыс. рублей.
В ходе предварительного следствия обвиняемый полностью признал вину в инкриминируемом деянии.
Следствием собрана достаточная доказательственная база, уголовное дело направлено прокурору для утверждения обвинительного заключения и дальнейшего направления в суд.
Расследование уголовного дела проводили следователи второго отдела по расследованию особо важных дел регионального следственного управления."
/news/item/1137789/,zabaykalye,Срок задержания бывшего заммэра Читы Анатолия Куликова продлен на 72 часа,[],12 Сентября 2018,"15 декабря Центральным районным судом города Читы при рассмотрении ходатайства следователя об избрании в от ношении Анатолия Куликова меры пресечения в виде заключения под стражу принято решение о продлении срока задержания на 72 часа, в связи с поступившим от стороны защиты ходатайством о приобщении к материалам дела дополнительных характеристик на подозреваемого.
По версии следствия, в 2006 году заместитель мэра Читы по строительству, транспорту и связи Анатолий Куликов и заместитель мэра Читы по аппарату Любовь Клейнос получили от индивидуального предпринимателя взятку за разрешение на строительство торгово-офисного здания в центре Читы. По имеющимся данным в качестве взятки бывшие чиновники получили от предпринимателя помещение в построенном здании стоимостью около 4 миллионов рублей. Из материалов дела следует, что чиновники потребовали безвозмездно передать им помещение как условие получения разрешений на строительство здания, а также на последующий ввод здания в эксплуатацию. Предприниматель из личных средств внёс в кассу предприятия деньги в сумме 3 млн. 921 тыс. рублей и оформил приходные кассовые ордера на родственников Клейнос и Куликова.
По данному факту следственными органами Следственного комитета Российской Федерации по Забайкальскому краю возбуждено уголовное дело по признакам преступления, предусмотренного п. «а, в» ч. 5 ст. 290 УК РФ (взятка в крупном размере, совершенная группой лиц по предварительному сговору ).
13 декабря после проведенных обысков по месту жительства Куликова и Клейнос, последние были допрошены в качестве подозреваемых. Их показания в интересах следствия пока не разглашаются. После допроса следователи задержали Анатолия Куликова на 48 часов в качестве подозреваемого в совершении преступления. В отношении Любови Клейнос по медицинским показаниям избрана мера пресечения в виде подписки о невыезде."
