Link,Topic,Card Title,Tags,Date,Card Text
/news/item/619896/,kchr,Следственными органами СК России по Карачаево-Черкесской Республике возбуждено уголовное дело по факту служебного подлога,[],14 Апреля 2020,"Следственными органами Следственного комитета Российской Федерации по Карачаево-Черкесской Республике возбуждено три уголовных дела по факту совершения должностного подлога в отношении начальника архивного отдела администрации Карачаевского муниципального района Карачаево-Черкесской Республики 43-летней Луизы Хубиевой (ч. 1 ст. 292, ч. 1 ст. 292, ч. 1 ст. 292 УК РФ). По данным следствия, Хубиева Л.Н. в течении 2012 года, являясь должностным лицом, в должностные обязанности которой входит обеспечение сохранности документов делопроизводства организаций Карачаевского муниципального района, а также исполнение социально-правовых и иных запросов граждан, неоднократно вносила заведомо ложные сведения в справки установленных форм, тем самым незаконно подтверждала ложный стаж работы для последующего предоставления в Управление ГУ ОПФР по КЧР документов и последующего начисления трудовой пенсии. Все уголовные дела, возбужденные в отношении Хубиевой Л.Н. соединены в одно производство, расследованием которых занимается Карачаевский отдел МСО следственного управления по Карачаево-Черкесской Республике. Следственными органами назначены все необходимые экспертизы для установления причинённого Хубиевой Л.Н. ущерба государству. Учитывая, что на иждивении у Хубиевой Л.Н. трое несовершеннолетних детей, следственными органами в отношении неё избрана мера пресечения в виде подписки о не выезде. В настоящее время проводятся все необходимые следственные действия, направленные на закрепление собранных доказательств. Расследование уголовного дела продолжается. Следственное управление СКР по КЧР тел. 8 (878-22) 5-39-10 http://kchr.sledcom.ru//"
/news/item/1801740/,kchr,"Завершено расследование уголовного дела в отношении главы муниципального района, обвиняемого в превышении должностных полномочий","['превышение полномочий', 'СКР']",09 Апреля 2020,"Следователем первого отдела по расследованию особо важных дел следственного управления по республике завершено расследование уголовного дела в отношении главы Зеленчукского муниципального района. Он обвиняется в совершении преступления, предусмотренного ч. 3 ст. 286 УК РФ (превышение должностных полномочий).
Следствием установлено, что в 2021 году злоумышленник, зная, что земельный участок площадью 5,2 га входит в пределы туристско-рекреационной особой экономической зоны,  незаконно продал его местному жителю за 1 млн. 287 тыс. рублей.
Собранная в ходе следствия доказательственная база признана достаточной для направления уголовного дела в суд с утвержденным обвинительным заключением.
В целях обеспечения причиненного преступлением ущерба следователем приняты меры к наложению ареста на вышеуказанный земельный участок. Дальнейшую его судьбу будет решать суд."
/news/item/1854418/,kchr,Региональным следственным управлением обобщены результаты расследования преступлений коррупционной направленности за 2023 год,['СКР'],07 Апреля 2020,"Следственный комитет как государственный орган, осуществляющий в соответствии с законодательством Российской Федерации полномочия в сфере уголовного судопроизводства, занимается расследованием уголовных дел коррупционной направленности. Это одно из приоритетных направлений деятельности ведомства.
За 2023 год в производстве следователей следственного управления находилось 132 уголовных дела рассматриваемой категории, из них 87 уголовных дел являлись эпизодами преступной деятельности одних и тех же фигурантов дел, которые соединены в одно производство с ранее возбужденными делами. Из расследованных дел в суд с обвинительным   заключением направлено 40 дел о 157 преступлениях. 
Расследованные уголовные дела связаны с совершением преступлений, предусмотренных ст. 159 (мошенничество), ст. 160 (присвоение и растрата), ст. 285 (злоупотребление должностными полномочиями), ст. 286 (превышение должностных полномочий), ст. 290 (получение взятки), ст. 291 (дача взятки), ст. 292 (служебный подлог), ст. 204 УК РФ (коммерческий подкуп) и других.
В текущем году уголовные дела коррупционной направленности не приостанавливались и не прекращались. Прокурором и судом уголовные дела для производства дополнительного следствия не возвращались. Судами оправдательные приговоры не выносились. 
Напоминаем, что в следственном управлении в круглосуточном режиме работает «Телефон доверия» (номер: 8 (8782) 28-12-93), телефонная линия «Остановим коррупцию» (номера: 8 (8782) 28-11-89; 8 (938) 035-11-30), линия для приема и экстренного реагирования на сообщения о давлении на бизнес (номера: 8 (878-2) 28-01-57, 8 (938) 032-48-58).
На официальной странице управления работает «Интернет-приемная» по ссылке: https://kchr.sledcom.ru/references, приемная для обращений граждан в социальной сети «ВКонтакте» по ссылке: https://vk.com/susk09."
/news/item/1452956/,kchr,В Карачаево-Черкесской Республике возбуждено уголовное дело о даче взятки,"['взятка', 'СКР']",07 Апреля 2020,"Следственными органами следственного управления Следственного комитета Российской Федерации по Карачаево-Черкесской Республике по материалам регионального МВД возбуждено уголовное дело в отношении 64-летней жительницы республики. Уголовное дело возбуждено по факту дачи взятки (ч. 1 ст. 291 УК РФ).
По предварительным данным, женщина передала лично приставу-исполнителю Малокарачаевского районного отдела УФССП по Карачаево-Черкесской Республике в качестве взятки деньги в размере 15.000 рублей за прекращение исполнительного производства в отношении должника.
Однако проведенными сотрудниками полиции оперативно-розыскными мероприятиями факт передачи денежных средств был выявлен и задокументирован.
Следователем осмотрено место происшествия, изъяты денежные средства и иные следы преступления, допрошены свидетели, назначены экспертизы. В настоящее время решается вопрос об избрании меры пресечения.
Расследование уголовного дела продолжается."
/news/item/1454179/,kchr,В Карачаево-Черкессии завершено расследование уголовного дела о совершении мошенничества и служебного подлога.,"['должностные преступления', 'мошенничество', 'СКР', 'служебный подлог']",31 Марта 2020,"Следственными органами СУ СК России по Карачаево-Черкесской Республике завершено расследование уголовного дела в отношении жительницы республики, совершившей мошенничество в особо крупном размере (ч.4 ст.159 УК РФ) и служебный подлог (ч.2 ст.292УК РФ).
В ходе предварительного следствия установлено, что 45-летняя женщина, занимая должность заведующей филиалом Центра социальной помощи на дому Усть-Джегутинского района республиканского бюджетного учреждения «Центр социального обслуживания населения», а также обособленным подразделением по Прикубанскому муниципальному району РБУ «ЦСОН», в период с 24.09.2014 по 15.05.2018 путем обмана, выразившегося в фиктивном трудоустройстве граждан, похитила бюджетные денежные средства, размер которых превысил 1 млн 400 тысяч рублей. Полученные денежные средства заведующая потратила на личные нужды.
Преступная деятельность злоумышленницы в ходе проведения оперативно-разыскных мероприятий выявлена сотрудниками управления экономической безопасности и противодействия коррупции регионального МВД.
В рамках уголовного дела следователем изъято и осмотрено более двух тысяч объектов, проведено семь экономических и почерковедческих судебных экспертиз, более ста пятидесяти допросов. В связи с выявленными нарушениями в деятельности указанной организации, по представлению следователя три руководителя подразделений учреждения привлечены к строгой дисциплинарной ответственности.
На основании собранных следствием доказательств уголовное дело с утвержденным обвинительным заключением направлено в суд для рассмотрения по существу."
/news/item/1503327/,kchr,В Карачаево-Черкесской Республике вынесен приговор по уголовному делу о даче взятки,"['взятка', 'СКР']",27 Марта 2020,"Собранные следственными органами следственного управления Следственного комитета Российской Федерации по Карачаево-Черкесской Республике доказательства признаны судом достаточными для вынесения приговора в отношении 52-летнего жителя с.Дружба Прикубанского района.
Он признан виновным в даче взятки должностному лицу за совершение заведомо незаконных действий (ч. 3 ст. 291 УК РФ).
В ходе предварительного следствия установлено, что 21.02.2020 злоумышленник передал судебному приставу-исполнителю Прикубанского районного отдела судебных приставов регионального Управления Федеральной службы судебных приставов России в качестве взятки  12 000 рублей. Денежное вознаграждение предназначалось за совершение должностным лицом действий по принятию решения о невозможности взыскания в пользу кредитной организации денежных средств в размере свыше 486 000 рублей и прекращении исполнительного производства по данному основанию, мотивируя это отсутствием финансовой возможности погасить вышеуказанную задолженность.
Судебный пристав от получения взятки отказался, а преступная деятельность взяткодателя выявлена в ходе совместных оперативно-розыскных мероприятий проводимых сотрудниками службы безопасности УФССП и МВД республики.
Приговором суда осужденному назначено наказание в виде 2 лет лишения свободы, с отсрочкой исполнения наказания. Приговор суда вступил в законную силу."
/news/item/1488357/,kchr,В Карачаево-Черкесской Республике вынесен приговор по уголовному делу о коммерческом подкупе и подделке документов,"['коммерческий подкуп', 'СКР', 'служебный подлог']",26 Марта 2020,"Собранные следственными органами следственного управления Следственного комитета Российской Федерации по Карачаево-Черкесской Республике доказательства признаны судом достаточными для вынесения приговора в отношении 51-летнего жителя с.Джага Малокарачаевского района.
Он признан виновным в коммерческом подкупе (п. «в» ч. 7 ст. 204 УК РФ) и подделке документов (ч.1 ст. 327 УК РФ).
Следствием и судом установлено, что злоумышленник, являясь директором и единственным учредителем Карачаево-Черкесской региональной автономной некоммерческой образовательной организации «Учебный методический центр «Три А», незаконно оказывал гражданам услуги по получению документов о профессиональной подготовке водителей транспортных средств без прохождения соответствующего обучения и сдачи квалификационного экзамена, получая за это денежное вознаграждение.
Приговором суда осужденному назначено наказание в виде 5 лет лишения свободы, с отсрочкой исполнения наказания, со штрафом в размере 50.000 рублей. Приговор суда не вступил в законную силу."
/news/item/1262402/,kchr,Черкесский городской суд вынес приговор в отношении  чиновника налоговой службы,[],27 Февраля 2020,"Собранные Черкесским следственным отделом Следственного управления Следственного комитета Российской Федерации по Карачаево-Черкесской Республике доказательства признаны Черкесским городским судом достаточными для вынесения приговора 60-летнему заместителю руководителя отдела камеральных проверок межрайонной инспекции ФНС России N 3 по Черкесску,  признанному виновным в  получении взятки в крупном размере (п. «в» ч. 5 ст. 290 УК РФ).
Следствием и судом установлено, что по поступившему заявлению от директора ООО «Инженерный центр «Климатехника», о вымогательстве у него взятки со стороны  заместителя начальника отдела камеральных проверок ФНС России № 3 по КЧР за незаконные действия (бездействие) в виде прекращения проведения камеральной налоговой проверки без выполнения в полном объеме необходимых проверочных мероприятий и благоприятного исхода проверки в отношении ООО «Инженерный центр «Климатехника».
Злоумышленник предложил потерпевшему передать им денежную сумму  200 тысяч рублей за незаконные действия в виде прекращения проведения камеральной налоговой проверки. 
Чиновник лично получил от потерпевшего взятку в сумме 200 тысяч рублей за незаконные действия, после чего сразу был задержан с поличным сотрудниками УФСБ России по КЧР в ходе проведённых в отношении него оперативно-розыскных мероприятий.
Приговором Черкесского городского суда злоумышленник признан виновным в совершении инкриминируемого преступления. Учитывая обстоятельства дела, суд приговорил его к 7 годам лишения свободы условно с испытательным сроком на 3 года.
 
Следственное управление 
СКР по КЧР
полковник юстиции
Сергей Шуваев
тел. 8 (878-22) 8-11-74
http://kchr.sledcom.ru"
/news/item/1799481/,kchr,Должностное лицо признано виновным в превышении полномочий,"['превышение полномочий', 'приговор', 'СКР']",17 Декабря 2019,"Доказательства, собранные следователем первого отдела по расследованию особо важных дел следственного управления по республике, признаны судом достаточными для вынесения приговора в отношении первого заместителя главы администрации Зеленчукского муниципального района.
Он признан виновным в совершении преступления, предусмотренного п. «а» ч. 3 ст. 286 УК РФ (превышение должностных полномочий). 
Как установлено следствием и судом, в период времени с февраля 2020 по февраль 2021 года злоумышленник незаконно предоставил местному жителю в аренду, а затем в собственность земельный участок площадью 5,2 га, входящий в состав туристско-рекреационной особой экономической зоны. 
Следователем выполнен значительный объем следственных и процессуальных действий: допрошены свидетели, проведены очные ставки, изъята и осмотрена документация. Собранные доказательства признаны достаточными для направления уголовного дела в суд.
 
Приговором суда виновному назначено наказание в виде 4 лет лишения свободы условно с испытательным сроком на 3 года."
