Link,Topic,Card Title,Tags,Date,Card Text
/news/item/1540235/,osetia,"Исполняющей обязанности руководителя Россельхознадзора республики предъявлено обвинение в покушении на получение взятки, злоупотреблении должностными полномочиями, незаконной предпринимательской деятельности и растрате","['взятка', 'злоупотребление полномочиями', 'растрата']",02 Марта 2023,"Следственным управлением Следственного комитета Российской Федерации по Республике Северная Осетия – Алания исполняющей обязанностей руководителя Россельхознадзора по Республике Северная Осетия – Алания предъявлено обвинение в совершении преступлений, предусмотренных ч. 1 ст. 30, п. «а» ч. 5 ст. 290 УК РФ (покушение на получение взятки), ч. 1 ст. 285 УК РФ (злоупотребление должностными полномочиями), ст. 289 УК РФ (осуществление предпринимательской деятельности, через доверенное лицо с предоставлением организации льгот и преимуществ) ич. 3 ст. 160 УК РФ (растрата вверенного имущества с использованием своего служебного положения).
По данным следствия, с марта по август 2020 года обвиняемая вопреки запрету, установленному законом на занятие государственными служащими предпринимательской деятельностью, преследуя цель извлечения прибыли, используя свое должностное положение и возможности, участвуя в деятельности общества с ограниченной ответственностью «Алания» через своего сына, предоставляла Обществу преимущества и привилегии по прохождению ветеринарного контроля в пунктах пропуска через государственную границу Российской Федерации и местах таможенного оформления, при пропуске завозимой рыбной продукции, путем дачи соответствующих указаний своим подчиненным по скорейшей выдаче разрешительных документов на взъезд, что позволяло избежать негативных последствий в виде убытков по пропаже продукции.
В июне 2020 года обвиняемая дала указание инспекторам Россельхознадзора по РСО-Алания, осуществлявшим обязанности по ветеринарному надзору в пунктах пропуска через государственную границу Российской Федерации, получать взятки с водителей большегрузных автомашин в размере 3 тыс. рублей за каждую машину, за беспрепятственное пересечение границы и въезд на территорию Российской Федерации. Однако она не смогла довести свои преступные действия до конца по независящим от нее обстоятельствам, в связи с отказом ее подчиненных исполнить незаконные требования по получению взяток.
В период с апреля по май 2020 года обвиняемая передала служебную автомашину марки «Тойота-Камри», принадлежавшую на праве собственности Россельхознадзору по РСО-Алания, в постоянное пользование своему сыну. Используя автомобиль в личных целях, он совершил ряд административных правонарушений, по которым вынесены постановления с назначением административных штрафов на общую сумму 6,5 тыс. рублей. В июне 2020 года обвиняемая, инициировала оплату указанных штрафов за счет средств Россельхознадзора по РСО-Алания.
В результате грамотно спланированных и проведенных сотрудниками следственного управления СК России и регионального управления Федеральной службы безопасности совместных следственных действий и оперативно-розыскных мероприятий, противоправная деятельность обвиняемой была пресечена. По ходатайству следственных органов судом в отношении нее избрана мера пресечения в виде домашнего ареста.
В настоящее время проводятся следственные действия и оперативно-розыскные мероприятия, направленные на установление всех обстоятельств совершенных преступлений. Расследование уголовного дела продолжается."
/news/item/1792106/,osetia,"Во Владикавказе перед судом предстанет адвокат, обвиняемый в покушении на мошенничество","['адвокат', 'мошенничество', 'покушение']",25 Февраля 2023,"Следственным управлением Следственного комитета Российской Федерации по Республике Северная Осетия – Алания завершено расследование уголовного дела в отношении адвоката Адвокатской палаты РСО-Алания. Он обвиняется в совершении преступления, предусмотренного ч. 3 ст. 30, ч. 2 ст. 159 УК РФ (покушение на мошенничество).
По данным следствия, в середине октября 2022 года обвиняемый в рамках процессуальной проверки, проводимой следственным отделом ОМВД России по Ардонскому району, сообщил жене своего подзащитного заведомо ложные сведения о том, что за взятку в 300 тыс. рублей решит со следователем вопрос о непривлечении ее мужа к уголовной ответственности за мошенничество. По просьбе женщины сумма была снижена до 150 тыс. рублей, однако предполагая, что действия адвоката могут носить противоправный характер, она сообщила об этом в правоохранительные органы.
16 ноября 2022 года примерно в 17 часов в одном из торговых центров Владикавказа обвиняемый встретился с женой своего доверителя, которая передала ему 150 тыс. рублей. После этого обвиняемый был задержан сотрудниками регионального УФСБ и у него были изъяты переданные деньги, в связи с чем, он не смог довести преступление до конца, по не зависящим от него обстоятельствам.
Следствием собрано достаточно доказательств, в связи с чем уголовное дело с утвержденным обвинительным заключением направлено в суд для рассмотрения по существу."
/news/item/1661708/,osetia,Начальник отделения по вопросам миграции одного из районных отделов МВД республики подозревается в злоупотреблении полномочиями,['злоупотребление полномочиями'],21 Февраля 2023,"Следственным управлением Следственного комитета Российской Федерации по Республике Северная Осетия – Алания в отношении начальника отделения по вопросам миграции отдела Министерства внутренних дел Российской Федерации по Кировскому району РСО-Алания – 46-летней майора полиции возбуждено уголовное дело. Она подозревается в совершении преступления, предусмотренного ч. 1 ст. 285 УК РФ (злоупотребление должностными полномочиями).
По версии следствия, в начале октября 2021 года подозреваемая в ходе осуществления своих должностных обязанностей выявила нарушения законодательства в сфере миграции в действиях гражданина ближнего зарубежья, временно зарегистрированного в Кировском районе республики, за которые предусмотрена административная ответственность.
14 октября 2021 года под угрозой привлечения к административной ответственности, подозреваемая потребовала от мужчины выполнить безвозмездно ремонтные работы в квартире, принадлежащей на праве собственности ее родственнику. Чтобы избежать для себя наступления негативных последствий в виде привлечения к административной ответственности и возможного выдворения из Российской Федерации, потерпевший согласился и отремонтировал указанную квартиру.
В результате противоправных действий подозреваемой иностранный гражданин не был привлечен к административной ответственности, что   повлекло существенное нарушение охраняемых законом интересов общества и государства.
Противоправная деятельность подозреваемой была пресечена благодаря профессионально спланированным и проведенным следователями следственного управления СК России и оперативными сотрудниками регионального УФСБ следственным действиям и оперативно-розыскным мероприятиям, женщина была задержана. По ходатайству следственных органов судом в отношении нее избрана мера пресечения в виде запрета определенных действий.
В настоящее время проводятся следственные действия и оперативно-розыскные мероприятия, направленные на установление всех обстоятельств совершенного преступления, а также других эпизодов противоправной деятельности подозреваемой. Расследование уголовного дела продолжается."
/news/item/1662503/,osetia,"Перед судом предстанет бывший глава АМС Моздокского городского поселения по обвинению в незаконной предпринимательской деятельности, мошенничестве и злоупотреблении должностными полномочиями","['злоупотребление полномочиями', 'мошенничество', 'незаконное предпринимательство']",20 Февраля 2023,"Следственным управлением Следственного комитета Российской Федерации по Республике Северная Осетия – Алания завершено расследование уголовного дела в отношении бывшего главы Моздокского городского поселения. Он обвиняется в совершении преступлений, предусмотренных ст. 289 УК РФ (осуществление предпринимательской деятельности), ч. 4 ст. 159 УК РФ (мошенничество в особо крупном размере) и ч. 2 ст. 285 УК РФ (злоупотребление должностными полномочиями главой органа местного самоуправления).
По данным следствия, в период с апреля 2018 по август 2020 года обвиняемый, являясь главой АМС Моздокского городского поселения, вопреки установленному законом запрету на занятие государственными служащими предпринимательской деятельностью, фактически осуществляя управление открытым акционерным обществом «Моздокская передвижная механизированная колонна № 3» через доверенных лиц, предоставлял Обществу преимущества при проведении аукционов, в результате которых Обществом заключено муниципальных контрактов на общую сумму 36,9 млн рублей.
Кроме того, 28 февраля 2020 года в нарушение действующего законодательства обвиняемый подписал разрешение на ввод в эксплуатацию объекта незавершенного строительства – нежилого здания в городе Моздоке, площадью 1536 кв.м, расположенного на земельном участке, находившимся в аренде у его знакомого. После этого заключил договор купли-продажи, по которому его знакомый приобрел в собственность вышеуказанный земельный участок за 519,6 тыс. рублей, при кадастровой стоимости 5,196 млн рублей. В результате противоправных действий обвиняемого АМС Моздокского городского поселения причинен ущерб в размере 4,6 млн рублей.
Благодаря грамотно спланированным и проведенным сотрудниками следственного управления СК России и регионального управления ФСБ и МВД совместным следственным действиям и оперативно-розыскным мероприятиям, противоправная деятельность обвиняемого была пресечена.   
Следствием собрано достаточно доказательств, в связи с чем уголовное дело с утвержденным обвинительным заключением направлено в суд для рассмотрения по существу."
/news/item/1760757/,osetia,Следователю полиции предъявлено окончательное обвинение в вымогательстве взятки в крупном размере и предложении посредничества во взяточничестве,"['взятка', 'посредничество']",20 Февраля 2023,"Следственным управлением Следственного комитета Российской Федерации по Республике Северная Осетия – Алания предъявлено обвинение следователю отделения по расследованию преступлений против безопасности движения и эксплуатации транспорта СУ МВД России по городу Владикавказу в совершении преступлений, предусмотренных пп. «б», «в» ч. 5 ст. 290 УК РФ (получение взятки с вымогательством, в крупном размере) и ч. 5 ст. 291.1 УК РФ (предложение посредничества во взяточничестве).
По версии следствия, 13 августа 2022 года во Владикавказе мужчина, управляя автомашиной, сбил женщину, которая была доставлена в медицинское учреждение, где ей была оказана необходимая помощь. Проведение процессуальной проверки по данному факту поручено обвиняемому. В период с 13 августа по сентябрь 2022 года следователь в служебном кабинета в ходе разговора с виновником ДТП выдвинул требование о передаче ему взятки в размере 350 тыс. за принятие решения об отказе в возбуждении уголовного дела, из которых 100 тыс. рублей для передачи неустановленным лицам из числа сотрудников Республиканского бюро судебно-медицинской экспертизы для изменения степени причиненного потерпевшей  вреда здоровью на менее тяжкий. В противном случае сообщил, что виновник ДТП будет привлечен к уголовной ответственности.
6 октября 2022 года примерно в 13 часов 10 минут обвиняемый, находясь в салоне автомашины, припаркованной на площадке у «Парка культуры и отдыха» по улице Барбашова в городе Владикавказе получил от друга водителя, действовавшего в рамках проводимого оперативно-розыскного мероприятия 350 тыс. рублей и был задержан сотрудниками УФСБ России по РСО-Алания.
В настоящее время проводятся следственные действия, направленные на окончание расследования."
