Link,Topic,Card Title,Tags,Date,Card Text
/news/item/1557044/,mordovia,В Зубово-Полянском районе бывший начальник районной госавтоинспекции  признан виновным в  мошенничестве,['мошенничество'],09 Сентября 2021,"Собранные Зубово-Полянским межрайонным следственным отделом Следственного управления Следственного комитета России по Республике Мордовия доказательства признаны судом достаточными для вынесения приговора бывшему  начальнику ОГИБДД ОМВД России по Зубово-Полянскому муниципальному району, признанному виновным в совершении преступления, предусмотренного ч.3 ст.159 УК РФ (мошенничество).
Следствием и судом установлено, что в апреле-мае 2019 года сотрудник полиции, находясь при исполнении служебных обязанностей, в салоне патрульного автомобиля применял в отношении остановленных водителей алкотестер,  не включенный  в Государственный реестр средств измерений. Затем создал видимость обнаружения у водителей наличие алкогольного опьянения и за якобы не составление в отношении протокола об административном правонарушении  получал денежные средства от 3 до 10 тысяч рублей. Всего за указанный период времени им было оставлено четыре автотранспортных средства из разных регионов России и получены денежные средства в сумме 24 тысячи рублей.  После получения денежных средств мужчина предоставлял водителям возможность дальнейшего движения.
Уголовное дело было возбуждено следственными органами на основании материалов оперативно-разыскной деятельности сотрудников собственной безопасности МВД по региону.
В ходе следствия мужчина был уволен из органов внутренних дел в связи с совершением проступка, порочащего честь сотрудника.
Приговором суда мужчине назначено наказание в виде 2 лет лишения свободы условно с испытательным сроком 2 года, со штрафом в размере 50 тысяч рублей и лишением звания «полковник полиции». Приговор суда в законную силу не вступил."
/news/item/1543378/,mordovia,В Саранске мужчина признан виновным в получении взятки,['взятка'],08 Сентября 2021,"Собранные следственным отделом по Ленинскому району города Саранск Следственного управления Следственного комитета России по Республике Мордовия доказательства признаны судом достаточными для вынесения приговора бывшему сотруднику ФГУП «Почта России». Мужчина признан виновным в совершении преступления, предусмотренного ч.2 ст.290 УК РФ (получение взятки).
Следствием и судом установлено, что в 2019 году осужденный, работая в должности руководителя отдела розничных товаров УФПС РМ – филиала ФГУП «Почта России»,  сообщил директору коммерческой организации, что для выбора данной организации в качестве поставщика продовольственных товаров он должен передать ему так называемый откат в размере 3% от суммы приобретаемой продукции. После чего с августа 2019 по март 2020 года руководитель отдела путем безналичных банковских переводов получил взятку на общую сумму около 107,5 тысяч рублей.
В ходе следствия вину в совершении инкриминируемого деяния обвиняемый признал полностью.
Уголовное дело было возбуждено на основании материалов оперативно-разыскной деятельности сотрудников УФСБ России по Республике Мордовия при содействии Почты России.  
Приговором суда мужчине назначено наказание в виде 3 лет лишения свободы условно со штрафом в размере 537 тысяч 150 рублей. Приговор суда в законную силу не вступил."
/news/item/1140159/,mordovia,Подозреваются в превышении должностных полномочий,[],31 Августа 2021,"Рузаевским межрайонным следственным отделом совместно с отделом собственной безопасности МВД по Республике Мордовия проводилась проверка по заявлению граждан по факту превышения должностных полномочий двумя сотрудниками ОВД по Рузаевскому муниципальному району – лейтенантом и рядовым милиции. Оба сотрудника начали проходить службу с 2008 года. 
Установлено, что 23 августа 2009 года примерно в 00 часов 50 минут у клуба «Засада», расположенного в г.Рузаевка Республики Мордовия сотрудники милиции спровоцировали конфликтную ситуацию с ранее незнакомыми им гражданами – двумя молодыми людьми и девушкой. На место происшествия прибыл наряд милиции с городского отделения милиции «Южный» ОВД по Рузаевскому муниципальному району. Всех граждан доставили для разбирательства в указанное отделение милиции. Там конфликт продолжился, в результате чего одному из участников были причинены телесные повреждения.

По результатам служебной проверки, проведенной сотрудниками ОСБ,  приказом МВД по Республике Мордовия от 02.11.2009г. лейтенант милиции  уволен из органов внутренних дел.
По уголовному делу проводятся следственные действия, в отношении подозреваемых избраны меры пресечения в виде подписки о невыезде и надлежащем поведении."
/news/item/1602039/,mordovia,В Ковылкино бывшие директор и главный бухгалтер расчетного центра признаны виновным в мошенничестве,['мошенничество'],23 Августа 2021,"Собранные Ковылкинским межрайонным следственным отделом Следственного управления  Следственного комитета России по Республике Мордовия доказательства признаны судом  достаточными для вынесения приговора бывшим директору и главному  бухгалтеру-экономисту МУП «Единый расчетный центр», признанных виновными в совершении преступления, предусмотренного ч.4 ст.159 УК РФ (мошенничество).
Следствием и судом установлено, что осужденные, действуя группой лиц по предварительному сговору, используя свое служебное положение,  с апреля 2013 по июнь 2017 года  через подконтрольную фирму похитили принадлежащие муниципальному предприятию денежные средства в общей сумме более 1 миллиона 400 тысяч рублей. Причинив тем самым собственнику - Администрации Ковылкинского муниципального района Республики Мордовия имущественный вред в особо крупном размере. Так, они создали подконтрольную организацию, с которой расчетным центром по заведомо завышенной стоимости был заключен договор на приобретение и обслуживание необходимого программного обеспечения для компьютеров. При этом указанные услуги осуществляла фирма-разработчик, а подконтрольное юридическое лицо было задействовано только для вывода и хищения  денежных средств. Ежемесячная переплата по договору составляла порядка 20 тысяч рублей.
Приговором суда соучастницам назначено наказание в виде 3 лет лишения свободы со штрафом в размере 300 тысяч рублей каждой с отсрочкой исполнения приговора до достижения детьми осужденных женщин 14-летнего возраста. Приговор суда в законную силу не вступил."
/news/item/1140258/,mordovia,Индивидуальный предприниматель признан виновным в покушении на дачу взятки сотруднику прокуратуры,[],19 Августа 2021,"Собранные Пролетарским межрайонным следственным отделом Следственного управления Следственного комитета Российской Федерации по Республике Мордовия доказательства признаны судом достаточными для вынесения приговора индивидуальному предпринимателю. Он признан виновным в совершении преступления, предусмотренного ч.3 ст.30, ч.1 ст.291 УК РФ (покушение на дачу взятки). 
Следствием и судом установлено, что 26 апреля 2013 года  индивидуальный предприниматель пытался передать сотруднику прокуратуры Лямбирского района в служебном кабинете в качестве взятки дорогостоящие спиртные напитки и продукты питания за не составление административного протокола за нарушение требований Градостроительного кодекса Российской Федерации, выразившихся в незаконной эксплуатации реконструируемого здания магазина без соответствующего разрешения.  
Приговором суда мужчине назначено наказание в виде штрафа в размере 18-кратной суммы взятки. Приговор в законную силу не вступил."
/news/item/1299790/,mordovia,Бывшая заведующая кафедрой Медицинского института предстанет перед судом по обвинению в получении взяток за сдачу экзаменов,['взятка'],05 Августа 2021,"Отделом по расследованию особо важных дел Следственного управления Следственного комитета Российской Федерации по Республике Мордовия завершено расследование уголовного дела в отношении бывшей  заведующей кафедрой Медицинского института ФГБОУ ВПО «Мордовский государственный университет им. Н.П. Огарева». Женщине предъявлено обвинение в совершении 4-х эпизодов преступления, предусмотренного ч. 3 ст. 290 УК РФ (получение взятки).
В  ходе следствия установлено, что в феврале и марте 2018 года обвиняемая получила взятки на общую сумму 59 тысяч рублей за постановку оценки «удовлетворительно» четверым студентам 2 курса при пересдаче экзаменов по разным предметам без фактической проверки уровня знаний.
В рамках расследования обвиняемая была отстранена от занимаемой должности по ходатайству следственных органов. В качестве обеспечительных мер наложен арест на земельный участок, находящийся в собственности женщины.   
Уголовное дело возбуждалось по материалам оперативно-розыскной деятельности сотрудников УЭБиПК МВД по региону.
Несмотря на непризнание обвиняемой своей вины, следователем СК собраны достаточные доказательства, изобличающие ее в инкриминируемых деяниях. Уголовное дело с утвержденным обвинительным заключением направлено в суд для рассмотрения по существу."
/news/item/1140151/,mordovia,Справки от патологоанатома,[],28 Июля 2021,"В ходе следствия установлено: 45-летний Михаил П. 10 февраля 2009г. получил взятку в сумме 3 000 рублей от жителя г.Ковылкино за совершение незаконных действий. Патологоанатом выдал мужчине медицинскую справку формы № 86/у, необходимую при трудоустройстве на работу! В справке обвиняемый произвел записи о прохождении обследования от имени врачей специалистов, заверив данные записи оттиском личной печати врача, тем самым подделав документ. 
11.02.2009г. обвиняемый за совершение аналогичных действий получил еще одну взятку в сумме 2 000 рублей. 

Пресечь противоправные действия обвиняемого удалось благодаря работе сотрудников Ковылкинского межрайонного следственного отдела, УБЭП МВД по РМ и  ОБЭП по ОВД Ковылкинского района.  
В отношении обвиняемого, проработавшего в занимаемой должности с марта 2008г., избрана мера пресечения в виде подписки о невыезде.   
В настоящее время утверждено обвинительное заключение и уголовное дело направлено в Ковылкинский районный суд для рассмотрения по существу."
/news/item/1140183/,mordovia,Вынесен приговор бывшему инспектору ГИМС,[],27 Июля 2021,"Следствием и судом установлено, что Глистенков, имитируя активную деятельность по выявлению административных правонарушений, для улучшения статистических показателей своей работы и получения за это денежных премий, оформлял протоколы с внесением заведомо ложных сведений о совершении гражданами-судовладельцами административных правонарушений. Сведения о гражданах злоумышленник получал из базы данных о владельцах маломерных судов, имеющейся на Ардатовском участке Центра ГИМС, либо при задержании потерпевших фактически ничего не нарушавших. Затем от своего имени выносил постановления об административных правонарушениях на транспорте (ст.ст. 11.8, 11.8.1, 11.10 КоАП РФ).  За период преступной деятельности должностного лица 14 граждан незаконно были подвергнуты административным наказаниям в виде штрафа от 100 до 500 рублей. Эти заведомо ложные сведения были внесены в базу лиц, привлеченных к административной ответственности Центра ГИМС МЧС. При этом по итогам работы за 2009 год Глистенков получил денежную премию.  Всего доказано 28 эпизодов преступной деятельности бывшего инспектора.
  
В ходе предварительного расследования при ознакомлении с материалами уголовного дела, а затем и в судебном заседании Глистенков в связи с согласием с предъявленным обвинением заявил ходатайство о рассмотрении уголовного дела без проведения судебного разбирательства.     
  
Приговором суда Глистенкову  назначено наказание в виде 3,5 лет лишения свободы условно. Приговор в законную силу не вступил."
/news/item/1477719/,mordovia,Перед судом предстанет директор муниципального казенного учреждения по обвинению в мошенничестве и служебном подлоге,"['мошенничество', 'служебный подлог']",10 Июля 2021,"Ковылкинским межрайонным следственным отделом Следственного управления Следственного комитета России по Республике Мордовия завершено расследование  уголовное дело в отношении директора МКУ «Благоустройство Кадошкинского городского поселения», обвиняемого в совершении преступлений, предусмотренных ч.3 ст.159 УК РФ, ч.3 ст.30, ч.3 ст.159 УК РФ (мошенничество, с покушением) и двух эпизодов ч.1 ст.292  УК РФ (служебный подлог).
По данным следствия, в первом полугодии 2019 года обвиняемым с целью хищения бюджетных денежных средств был заключен фиктивный договор аренды транспортного средства «Лада Калина». При этом автомобиль фактически не предоставлялся и указанным учреждением для служебных целей не использовался. Перечисленные на основании договора в качестве арендной платы денежные средства в размере 67 тысяч 400 рублей были потрачены обвиняемым на личные нужды. Таким же образом был составлен фиктивный договор, арендная плата по которому составляла 11,5 тысяч рублей. Однако ввиду отсутствия в бюджете городского поселения денежных средств, арендная плата не была перечислена. В связи с чем обвиняемый не смог довести до конца свой преступный умысел по хищению путем обмана бюджетных денежных средств по независящим от него обстоятельствам.
Следователем СК собрана достаточная доказательственная база, в связи с чем по уголовному делу  утверждено обвинительное заключение и в ближайшее время оно будет направлено в суд для рассмотрения по существу."
