Link,Topic,Card Title,Tags,Date,Card Text
/news/item/1804860/,mordovia,Бывший следователь органов внутренних дел признан виновным  в мошенничестве,['мошенничество'],15 Января 2019,"Доказательства, собранные Октябрьским межрайонным следственным отделом Следственного управления Следственного комитета Российской Федерации по Республике Мордовия, признаны судом достаточными для вынесения приговора бывшему старшему следователю УМВД России по городскому округу Саранск. Мужчина признан виновным  в совершении преступления, предусмотренного ч.3 ст.159 УК РФ (мошенничество).
Следствием и судом установлено,  что в мае-июне 2021 года старший следователь, используя свое служебное положение,  путем обмана совершил хищение денежных средств, принадлежащих обвиняемому в краже и мошенничестве. Так, под предлогом возмещения ущерба он обещал передать деньги потерпевшим по уголовному делу, находившемуся у него в производстве. Однако перечисленными ему на банковскую карту денежными средствами в размере более  23 тысяч рублей следователь распорядился по собственному усмотрению.
В ходе следствия вину в совершении инкриминированного деяния мужчина признал полностью и возместил причиненный ущерб.
Противоправная деятельность должностного лица выявлена в ходе оперативно-розыскных мероприятий сотрудниками УФСБ России по Республике Мордовия.
Приговором суда фигуранту дела назначено наказание в виде 2,5 лет лишения свободы условно."
/news/item/1140156/,mordovia,Судебному приставу вынесен приговор,[],19 Декабря 2018,"Следствием и судом установлено, Муромцев В., являясь должностным лицом, в период с 2001 года по 2006 год действуя из корыстной и иной личной заинтересованности, использовал свои служебные полномочия вопреки интересам службы. Угрожая применением мер принудительного воздействия, принудил руководителей предприятий-должников к заключению договоров поставки светотехнической продукции по заведомо низким ценам в адрес коммерческих фирм, которые погашали задолженность предприятий-должников путем перечисления денежных средств на счет отдела судебных приставов. В результате предприятиям-должникам был причинен ущерб в размере более 78 млн. рублей.  
Приговором Верховного суда Республики Мордовия Муромцеву назначено наказание в виде лишения свободы сроком на 5 лет с отбыванием наказания в исправительной колонии общего режима."
/news/item/1140153/,mordovia,Покушение на дачу взятки,[],17 Декабря 2018,"02 апреля 2009г. следователем указанного отдела было возбуждено уголовное дело по признакам преступления, предусмотренного ч.3 ст.30 – ч.2 ст.291 УК РФ (Покушение на дачу взятки должностному лицу за совершение незаконных действий). 
Уголовное дело было возбуждено в отношении 40-летней жительницы г.Рузаевки.

В ходе расследования было установлено: 02.04.2009 около 10 часов Любовь Т., находясь в помещении служебного кабинета сотрудника ОГИБДД ОВД по Рузаевскому муниципальному району, совершила покушение на дачу взятку должностному лицу. Предлагая сотруднику милиции деньги в размере 35 000 рублей, она пыталась «приобрести» таким образом водительское удостоверение для своего сожителя, который ранее по решению суда был лишен права управления транспортным средством. 
Однако, довести преступление до конца подозреваемая не смогла и, учитывая то, что фактически она проживает в г.Москва, в отношении нее была избрана мера пресечения в виде заключения под стражу. 
В ходе следствия вину свою обвиняемая признала полностью.  
 В настоящее время утверждено обвинительное заключение и уголовное дело направлено в Рузаевский районный суд для рассмотрения по существу."
/news/item/1869713/,mordovia,Бывший главный врач больницы признан виновным в растрате денежных средств и незаконном изготовлении технического средства,['растрата'],13 Декабря 2018,"Собранные следователем второго отдела по расследованию особо важных дел Следственного управления Следственного комитета Российской Федерации по Республике Мордовия доказательства признаны судом достаточными для вынесения приговора бывшему главному  врачу ГБУЗ Республики Мордовия «Республиканская клиническая больница им.С.В.Каткова». Мужчина признан виновным в совершении преступлений, предусмотренных  ч. 4 ст. 160 УК РФ (растрата, совершенная лицом с использованием своего служебного положения, в особо крупном размере) и ст. 138.1 УК РФ (незаконное производство специальных технических средств, предназначенных для негласного получения информации).
Следствием и судом установлено, что в 2020 году осужденный, занимая должность главного врача,  совершил растрату вверенных ему бюджетных денежных средств в пользу коммерческой организации. Так, были заключены два государственных контракта на поставку в медицинское учреждение аппаратов искусственной вентиляции легких по умышленно завышенной стоимости и без применения обязательного метода сопоставимых рыночных цен (анализа рынка).   В одном случае при закупке двух аппаратов стоимость каждого была завышена более, чем на 700 тысяч рублей,  во втором  - при закупке четырех стоимость каждого аппарата завышена более, чем на 2 миллиона рублей. Всего таким образом было растрачено более 9  миллионов рублей.
Следствием также установлено, что в 2022 году  фигурант самостоятельно изготовил специальное техническое средство, закамуфлировал его под папку-скоросшиватель и установил  в своем рабочем кабинете для негласного сбора информации без ведома посторонних лиц.  
Уголовное дело следствием возбуждалось на основании материалов оперативно-розыскной деятельности сотрудников УФСБ России по Республике Мордовия.
По уголовному делу следователем СК проделан значительный объем работы. В качестве свидетелей допрошено более 50 человек, проведены товароведческая, комплексные финансово-экономическая и психолого-лингвистическая судебные экспертизы. В результате собранные доказательства  легли в основу обвинения.
Приговором суда мужчине назначено наказание в виде 4 лет 6 месяцев лишения свободы с отбыванием в исправительной колонии общего режима со штрафом в размере 300 тысяч рублей. Кроме того, он должен полностью возместить  причиненный ущерб. Приговор суда в законную силу не вступил."
/news/item/1220394/,mordovia,В Саранске перед судом предстанет бывший директор частного образовательного учреждения,['коррупция'],13 Декабря 2018,"Следственным отделом по Ленинскому району города Саранска Следственного управления СК России по Республике Мордовия завершено расследование уголовного дела в отношении бывшего директора частного учреждения дополнительного профессионального образования «Энергетик», обвиняемого в совершении двух эпизодов преступления, предусмотренного п.«в» ч.7 ст.204 УК РФ (коммерческий подкуп) и одиннадцати эпизодов преступления, предусмотренного ч.3 ст.160 УК РФ (присвоение).
По данным следствия, обвиняемый, занимая вышеуказанную должность, в апреле и ноябре 2016 года получил денежные средства от двоих мужчин в размере 27 и 12 тысяч рублей соответственно за  фиктивное обучение в возглавляемом учреждении и успешную сдачу экзамена без посещения учебных занятий и должной процедуры сдачи экзамена. Кроме того, с апреля по декабрь 2016 года обвиняемый присвоил около 180 тысяч  рублей за якобы проведенные преподавателями занятия, которые фактически не проводились. Следствием также установлено, что обвиняемый похитил денежные средства в сумме 122,5 тысяч рублей, полученные им от детского тренера за аренду спортивного зала, принадлежащего учреждению.
Уголовное дело было возбуждено по материалам оперативно-розыскной деятельности сотрудников ОЭБиПК  УМВД России по го Саранск.
В ходе расследования уголовного дела в целях обеспечения исполнения приговора наложен арест на два транспортных средства, принадлежащих обвиняемому.  
Следователями проведена значительная работа по сбору доказательств, свидетельствующих о  причастности обвиняемого к инкриминируемым деяниям. В настоящее время уголовное дело с утвержденным обвинительным заключением направлено в суд для рассмотрения по существу."
/news/item/1864932/,mordovia,В Чамзинском районе бывший сотрудник организации признан виновным в получении коммерческого подкупа в сумме более 3 миллионов рублей,['коммерческий подкуп'],09 Декабря 2018,"Собранные Чамзинским межрайонным следственным отделом Следственного управления Следственного комитета Российской Федерации по Республике Мордовия доказательства признаны судом достаточными для вынесения приговора бывшему ведущему менеджеру по маркетингу и сбыту продукции коммерческой организации. Мужчина признан виновным в совершении пяти эпизодов преступления, предусмотренного чч.2,7 ст.204 УК РФ (коммерческий подкуп).
Следствием и судом установлено, что  на протяжении нескольких лет с 2018 по 2021 годы фигурант уголовного дела получал незаконные денежные вознаграждения от представителей разных коммерческих организаций за лоббирование их интересов в виде обеспечения необходимых и своевременных поставок продукции.  Стоит отметить, что основным видом деятельности организации, в которой работал осужденный, является производство изделий из хризотилцемента и волокнистого цемента.  Всего таким образом мужчина получил более 3,2 млн рублей, которые перечислялись на банковские карты, находящиеся в его пользовании.   
В ходе следствия в целях обеспечения исполнения приговора наложен арест на три автомобиля фигуранта.
Уголовное дело следственными органами  возбуждалось на основании материалов оперативно-розыскной деятельности сотрудников УЭБиПК МВД по Республике Мордовия.
Приговором суда ему назначено наказание в виде 5 лет 6 месяцев лишения свободы с отбыванием в исправительной колонии строгого режима со штрафом в размере 2 миллиона 600 тысяч рублей. Приговор в законную силу не вступил."
/news/item/1656511/,mordovia,Сотрудник полиции заключен под стражу по подозрению в получении взятки,['взятка'],05 Декабря 2018,"Судом удовлетворено ходатайство следователя второго отдела по расследованию особо важных дел Следственного управления Следственного комитета России по Республике Мордовия об избрании меры пресечения в виде заключения под стражу сотруднику УНК МВД по Республике Мордовия. Старший оперуполномоченный подозревается в совершении преступления, предусмотренного ч.3 ст.290 УК РФ (получение взятки).
По данным следствия, в феврале текущего года майор полиции получил мобильный телефон стоимостью 85 тысяч рублей в виде взятки. За указанное вознаграждение он обещал двум  потребителям наркотических средств не проводить в отношении них оперативно-розыскные мероприятия с целью дальнейшего  привлечения к уголовной ответственности за незаконное приобретение и хранение наркотических средств. Подозреваемый был задержан с поличным сотрудниками УФСБ России по Республике Мордовия.
По уголовному делу проводится комплекс следственных действий, направленный на выяснение всех обстоятельств совершенного преступления,  закрепление доказательственной базы. В ближайшее время фигуранту будет предъявлено обвинение. Расследование уголовного дела продолжается."
/news/item/1438923/,mordovia,В рамках расследования уголовного дела о мошенничестве в особо  крупном размере задержан бывший региональный министр,['мошенничество'],27 Ноября 2018,"Отделом по расследованию особо важных дел Следственного управления Следственного комитета России по Республике Мордовия продолжается расследование уголовного дела, возбужденного по признакам преступления, предусмотренного ч.4 ст.159 УК РФ (мошенничество, совершенное в особо крупном размере).
По данным следствия, в 2018 году министерством культуры, национальной политики, туризма и архивного дела Республики Мордовия были выделены республиканские бюджетные денежные средства на ремонтные работы на нескольких объектах в городе Саранске. В дальнейшем, по версии следствия, при содействии 55–летнего мужчины,  возглавлявшего в тот период времени указанное министерство, под видом выполнения и оплаты ремонтных работ на двух объектах было совершено хищение бюджетных денежных средств в сумме 3,5 миллионов рублей. В результате республиканскому бюджету был причинен материальный ущерб в особо крупном размере.
Подозреваемый задержан, в ближайшее время следствие намерено обратиться в суд с ходатайством об избрании задержанному меры пресечения в виде заключения под стражу. Стоит отметить, что ранее одному из соучастников подозреваемого была избрана мера пресечения в виде заключения под стражу.   
Уголовное дело возбуждено на основании материалов оперативно-разыскной деятельности сотрудников УФСБ России по Республике Мордовия.
Проводится комплекс  следственных действий и оперативно-разыскных мероприятий, направленный на установление всех обстоятельств совершенного преступления и  закрепление доказательственной базы Расследование уголовного дела продолжается."
/news/item/1873262/,mordovia,Начальник цеха организации обвиняется в получении коммерческого подкупа,['коммерческий подкуп'],27 Ноября 2018,"Пролетарским межрайонным следственным отделом Следственного управления Следственного комитета Российской Федерации по Республике Мордовия завершено расследование уголовного дела в отношении 32-летнего начальника цеха коммерческого предприятия, занимающегося разведением сельскохозяйственной птицы. Мужчине предъявлено обвинение в совершении преступления, предусмотренного п. «г» ч. 7 ст. 204  УК РФ (коммерческий подкуп, совершенный в крупном размере).
По данным следствия, с мая 2018 по март 2021 года фигурант уголовного дела получил в качестве коммерческого подкупа от представителя  организации, занимающейся производством гидравлического и пневматического оборудования, денежные средства в размере 417 тысяч рублей. Незаконное вознаграждение передавалось за способствование приоритетному выбору в качестве заказчика моек высокого давления и запасных частей.   Денежные средства обвиняемый потратил на личные нужды.
В ходе следствия вину в совершении инкриминируемого деяния мужчина признал полностью. В рамках обеспечения исполнения приговора наложен арест на легковой автомобиль обвиняемого.  
Следователем СК собрана достаточная доказательственная база, в связи с чем уголовное дело с утвержденным прокурором обвинительным заключением направлено в суд для рассмотрения по существу."
