Link,Topic,Card Title,Tags,Date,Card Text
/news/item/1667151/,nnovgorod,"В Нижегородской области директор акционерного общества признан виновным  во взяточничестве и злоупотреблении должностными полномочиями (Оперативное видео, фотографии)",['СКР'],24 Марта 2022,"Собранные следователем второго отдела по расследованию особо важных дел СУ СК России по Нижегородской области доказательства признаны судом достаточными для вынесения приговора директору Акционерное общество ""Специализированный застройщик Нижегородской области ""Дирекция по строительству"" в совершении преступлений, предусмотренных ч. 6 ст. 290 УК РФ (получение взятки в особо крупном размере) и ч. 1 ст. 285 УК РФ (злоупотребление должностными полномочиями).
Следствием и судом установлено, что с  мая по декабрь 2019 года подсудимый получил от генерального директора строительной компании, выполняющей работы по строительству жилого дома с инженерными сетями в Ленинском районе г. Нижнего Новгорода, в качестве взятки имущество в виде строительных материалов на сумму свыше 1 миллиона 190 тысяч рублей и денежные средства на сумму более 1 миллиона 760 тысяч рублей за совершение действий, связанных с обеспечением приемки выполненных компанией работ по заключенному договору, а также за общее покровительство по службе при исполнении данного договора, которые фигурант использовал в личных целях по своему усмотрению.
Кроме того, в 2020 г. подсудимый, злоупотребляя своими должностными полномочиями, подписал фиктивный договор подряда со строительной организацией на сумму свыше 2 миллионов 100 тысяч рублей, работы по которому фактически не выполнялись, а полученные подрядчиком денежные средства были направлены на ремонт помещения некоммерческой организации.
В ходе предварительного расследования фигурант был заключен под стражу. Вину в совершении преступлений подсудимый признал в полном объеме.
Противоправные действий подсудимого выявлены оперативными сотрудниками УФСБ по региону.
Приговором суда подсудимому назначено наказание в виде 5 лет лишения свободы с отбыванием в колонии строгого режима,  штрафа в размере 2,5 миллиона рублей, конфискации имущества в размере однократной суммы взятки (более 2 миллионов 950 тысяч рублей). Приговор не вступил в законную силу."
/news/item/1674021/,nnovgorod,"В г. Н.Новгороде перед судом предстанет бывший глава администрации Советского района г. Н.Новгорода, обвиняемый взяточничестве",['СКР'],22 Марта 2022,"Следователем 2 отдела по расследованию особо важных дел СУ СК России по Нижегородской области завершено расследование уголовного дела в отношении бывшего главы администрации Советского района г. Н.Новгорода, обвиняемого в совершении преступлений, предусмотренных п. «в» ч. 5 ст. 290 УК РФ (получение взятки в крупном размере – 3 эпизода), ч. 3 ст. 290 УК РФ (получение взятки – 4 эпизода).
По версии следствия, в период с 2018 по 2020 года обвиняемый через посредников получил взятки на общую сумму более 1 миллиона рублей (1 072 000 рублей) за обеспечение беспрепятственного функционирования самовольных нестационарных торговых объектов на территории Советского  района, а также за неисполнение должностными лицами процедур демонтажа или перемещения данных самовольных нестационарных торговых объектов.
Вину в совершении инкриминируемых деяний обвиняемый не признал.
С занимаемой должности он уволен.
Его противоправные действия выявлены оперативными сотрудниками полиции.
В настоящее время уголовное дело направлено в суд для рассмотрения по существу."
/news/item/1247409/,nnovgorod,"В Автозаводском  районе г. Н.Новгород задержан полицейский, подозреваемый во взяточничестве",[],18 Марта 2022,"Следователи СО по Автозаводскому району г. Н.Новгород СУ СК России по Нижегородской области возбуждено уголовное дело в отношении заместителя начальника отдела по вопросам миграции ОП № 1 УМВД России по г. Н.Новгород, подозреваемого в совершении преступления, предусмотренного ч. 3 ст. 290 УК РФ (получение взятки должностным лицом за незаконные действия (бездействия)).
По версии следствия, с 19 марта по 9 апреля 2018 года подозреваемый получил взятку в сумме 93 тысячи 200 рублей от лиц, предоставляющих услуги по оказанию помощи иностранным гражданам в регистрации на территории Автозаводского района г. Н.Новгород.
За взятку полицейский, достоверно осведомленный о том, что в жилых помещениях Автозаводского района производится фиктивная постановка на учет иностранных граждан, утаивал указные факты, т.е. не регистрировал  сообщения в установленном законом порядке.
Противоправные действия горе-полицейского выявлены оперативными сотрудниками УФСБ по региону.
8 августа 2018 года подозреваемый задержан в порядке ст.ст. 91-92 УПК РФ.
По сообщению ГУ МВД России по Нижегородской области сотрудник полиции отстранен от исполнения должностных обязанностей. Решается вопрос об увольнении его из органов внутренних дел за совершение проступка, порочащего честь сотрудника.
Подозреваемому предъявлено обвинение. Вину в инкриминируемом деянии он признал.
В настоящее время в суде рассматривается ходатайство следователя об избрании обвиняемому меры пресечения. Расследование продолжается."
/news/item/1869354/,nnovgorod,В городе Нижнем Новгороде мужчина подозревается в даче взятки должностному лицу,['СКР'],15 Марта 2022,"Следователем следственного отдела по Ленинскому району города Нижнего Новгорода следственного управления Следственного комитета России по Нижегородской области возбуждено уголовное дело в отношении мужчины, подозреваемого в даче взятки должностному лицу (ч. 3 ст. 291 УК РФ).
По версии следствия, в марте 2024 года подозреваемый с целью непривлечения к ответственности знакомого руководителя транспортной компании за совершение административных правонарушений при перевозке пассажиров передал заместителю начальника Межрегионального территориального управления Федеральной службы по надзору в сфере транспорта по ПФО взятку в виде денег в сумме 30 тысяч рублей. От получения незаконного денежного вознаграждения должностное лицо отказалось.Противоправные действия мужчины выявлены и пресечены следователями СК России во взаимодействии с сотрудниками УФСБ России по региону.
Вину в совершении инкриминируемого деяния он признал в полном объеме. В ближайшее время ему будет предъявлено обвинение и избрана мера пресечения."
/news/item/1161559/,nnovgorod,В Канавинском районе г. Н. Новгород сотрудник полиции подозревается во взяточничестве (Видео-комментарии),[],14 Марта 2022,"Следователями следственного отдела по Канавинскому району г. Н. Новгород СУ СК России по Нижегородской области возбуждено уголовное дело в отношении 44-летнего мужчины, подозреваемого в совершении преступления, предусмотренного ч. 3 ст. 290 УК РФ (получение должностным лицом взятки за незаконные действия).
По версии следствия, 5 сентября 2017 года в вечернее время в УПП № 15 ОП № 2 УМВД России по г. Н. Новгороду (по обслуживанию Канавинского района) участковый уполномоченный полиции ОУУП и ПНД ОП № 2 УМВД России по г. Н. Новгороду получил от гражданина взятку в сумме 10 тысяч рублей за совершение заведомо незаконных действий, а именно – вынесение постановления об отказе в возбуждении уголовного дела по факту нанесения телесных повреждений, причиненных данным гражданином своей жене.
Противоправная деятельность полицейского была пресечена сотрудниками ОРЧ (СБ) ГУ МВД России по Нижегородской области совместно с сотрудниками УФСБ России по Нижегородской области.
Подозреваемый допрошен следователями СК, он подтвердил свою причастность к совершению преступления. В ближайшее время ему будет предъявлено обвинение, а также избрана мера пресечения.
Следователи осуществляют комплекс следственных действий, направленных на закрепление доказательств по уголовному делу. Расследование уголовного дела продолжается.
Комментарии: и.о. старшего помощника руководителя (по взаимодействию со СМИ) СУ СК России по Нижегородской области Юрия Соршнева."
/news/item/1702182/,nnovgorod,"В Балахнинском районе Нижегородской области перед судом предстанет учредитель организации, занимающейся бытовыми отходами, обвиняемый в коммерческом подкупе (Фотографии)","['коммерческий подкуп', 'СКР', 'следователь СК', 'суд']",05 Марта 2022,"Следователем Балахнинского межрайонного следственного отдела СУ СК России по Нижегородской области завершено расследование уголовного дела в отношении учредителя ООО «ЛУК Регионы» обвиняемого в совершении преступления, предусмотренного п.п. «а, б, в» ч. 3 ст. 204 УК РФ (коммерческий подкуп, совершенный группой лиц по предварительному сговору за заведомо незаконные действия, в крупном размере).
По версии следствия, с 2016 года по 2019 год обвиняемый совместно с  сотрудником этой же компании вступили в преступный сговор с целью незаконного захоронения отходов, отсутствующих в лицензии полигона, расположенного в Балахнинском районе. А именно, обвиняемый выделял денежные средства, которые сотрудник систематически передавал работникам полигона в виде коммерческого подкупа. Всего сумма коммерческого подкупа превысила 588 тысяч рублей.
Обвиняемый вину в совершении инкриминируемого деяния признал.
В настоящее время уголовно дело с утвержденным обвинительным заключением направлено в суд для рассмотрения по существу. Уголовное дело в отношении сотрудника ООО ""ЛУК Регионы"", обвиняемого в коммерческом подкупе, уже находится на рассмотрении в суде. 
Кроме того следователи СК продолжают расследование уголовного дела в отношении работников Балахнинского полигона, получавших денежные средства в качестве коммерческого подкупа."
/news/item/1145653/,nnovgorod,"В Приокском районе г. Н.Новгород перед судом предстанут две бывшие сотрудницы Росреестра по Нижегородской области, обвиняемые во взяточничестве",[],03 Марта 2022,"Следователями СО по Приокскому району СУ СК России по Нижегородской области завершено расследование уголовных дел в отношении бывших главного и ведущего специалистов-экспертов отдела регистрации прав Управления Федеральной службы государственной регистрации, кадастра и картографии по Нижегородской области, обвиняемых в зависимости от роли каждой в совершении преступлений, предусмотренных п. «а» ч. 5 ст. 290 УК РФ (получение взятки должностным лицом группой лиц по предварительному сговору), ч. 1 ст. 291.2 УК РФ (мелкое взяточничество).
По версии следствия, в апреле 2016 года в отделе регистрации прав Управления Федеральной службы государственной регистрации, кадастра и картографии по Нижегородской области, расположенном на ул. Крылова г. Н. Новгород, обвиняемые получили от гражданина взятку в виде денег в размере 30 тысяч рублей за ускорение сроков регистрации сделки  купли-продажи АЗС и земельного участка под ней, расположенных в Лысковском районе Нижегородской области.
Кроме того, в ходе расследования следователями СК собраны доказательства, изобличающие главного специалиста в совершении 3-х эпизодов мелкого взяточничества: с августа по ноябрь 2015 года обвиняемая получала от граждан взятки в размере от 1 до 2 тысяч рублей также за ускорение сроков выдачи документов.
Главный специалист признала вину в инкриминируемых деяниях в полном объеме, ее бывшая коллега отрицает свою причастность к совершению преступления.
Из управления Росреестра они уволены.
В настоящее время уголовные дела направлены в суд, где рассматриваются по существу."
/news/item/1072054/,nnovgorod,"В Нижегородской области перед судом предстанет бывший адвокат, обвиняемый в покушении на мошенничество, совершенном в крупном размере",[],28 Февраля 2022,"Следователями второго отдела по расследованию особо важных дел следственного управления Следственного комитета Российской Федерации по Нижегородской области завершено расследование уголовного дела по обвинению 27-летнего бывшего адвоката адвокатской конторы Канавинского района НОКА (Нижегородская областная коллегия адвокатов), в совершении преступления, предусмотренного ч. 3 ст. 30, ч. 3 ст. 159 УК РФ (покушение на мошенничество, совершенное в крупном размере).
По версии следствия, 20 июля 2016 в дневное время в одном из кафе, расположенном на проспекте Молодежный г. Н.Новгорода обвиняемый получил от супруги лица, интересы которого он представлял в суде, 950 тысяч рублей. При этом, адвокат сообщил женщине, что деньги предназначены в качестве взятки судье Автозаводского районного суда г. Н.Новгород, рассматривающего уголовное дело по обвинению ее супруга. Вместе с тем, обвиняемый  не имел возможности воздействовать на принятие решения судьи по назначению наказания за совершение подсудимым ряда хищений имущества граждан.
Противоправные действия адвоката пресечены оперативными сотрудниками УФСБ России по Нижегородской области и УМВД России по г. Н.Новгород.
         Вину в инкриминируемом деянии обвиняемый признал в полном объеме. Он заключен под стражу, его статус адвоката прекращен.
         В настоящее время уголовное дело после утверждения прокурором обвинительного заключения направлено в суд для рассмотрения по существу."
/news/item/1018411/,nnovgorod,В Приокском районе бывший сотрудник полиции признан виновным в присвоении горюче-смазочных материалов,[],25 Февраля 2022,"Собранные СО по Приокскому району Следственного комитета доказательства признаны судом достаточными для вынесения приговора бывшему начальнику технической части  гаража Нижегородской академии МВД России по ч. 3 ст. 160 УК РФ (присвоение чужого имущества, совершенное лицом с использованием своего служебного положения).
Следствием и судом установлено, что с января по март 2015 года подсудимый, имея в распоряжение топливные карты АЗС «Терминал», принадлежащей Нижегородской академии МВД России,  заправлял свой личный автомобиль  топливом, предназначенным для служебного транспорта. Его противоправными действиями академии был причинен ущерб  на общую сумму свыше 15 тысяч рублей.
Вину в содеянном он признал в полном объеме. Из органов внутренних дел – уволен. 
Приговором суда подсудимому назначено наказание в виде штрафа в размере 150 тысяч рублей. Приговор в законную силу не вступил."
