Link,Topic,Card Title,Tags,Date,Card Text
/news/item/1029163/,nnovgorod,В ЗАТО г. Саров бывший сотрудник противопожарной службы МЧС признан виновным по взяточничестве,[],05 Сентября 2022,"Собранные СО ЗАТО г. Саров Следственного комитета доказательства признаны судом достаточными для вынесения приговора бывшему начальнику отдела ФГПН ФГКУ «Специальное управление ФПС № 4 МЧС России» в совершении преступления, предусмотренного  ч. 3 ст. 290 УК РФ (получение должностным лицом взятки за незаконные действия).
Следствием и судом установлено, что в 2015 году подсудимый имел задолженность по оплате услуг питания перед МУП «Комбинат школьное питание».
В декабре 2015 года, рассматривая поручение о проведении проверки возможности выполнения соискателем лицензии одной из частных охранных организаций, подсудимый получил от директора этой организации взятку в виде оплаты его задолженности по питанию за незаконное решение о соответствии фирмы лицензионным требованиям.
Противоправные действия начальника отдела были пресечены оперативными сотрудниками УФСБ по Нижегородской области.
В ходе предварительного расследования в отношении обвиняемого была избрана мера пресечения в виде домашнего ареста.  Из органов МЧС он уволен.
Приговором суда подсудимому назначено наказание в виде штрафа в размере 1 миллион рублей. Приговор в законную силу не вступил."
/news/item/1715957/,nnovgorod,В Сормовском районе г. Н.Новгорода бывший сотрудник полиции признан виновным в мошенничестве (Фотографии),"['взятка', 'приговор', 'СКР', 'следователь СК']",02 Сентября 2022,"Собранные следователем СО по Сормовскому району г.Н.Новгорода СУ СК России по Нижегородской области доказательства признаны судом достаточными для вынесения приговора бывшему начальнику отделения ОЭБиПК УМВД России по г. Н. Новгороду в совершении преступления, предусмотренного ч. 3 ст. 159 УК РФ (мошенничество, совершенное с причинением значительного ущерба гражданину, лицом с использованием своего служебного положения).
Следствием и судом установлено, что в апреле 2017 года обвиняемый, введя в заблуждение своего знакомого, который был осведомлен, что ранее мужчина занимал должность начальника одного из отделений ОЭБиПК УМВД России по г. Н. Новгороду,  получил у него денежные средства в сумме 500 тысяч рублей для якобы передачи в качестве незаконного денежного вознаграждения старшему оперуполномоченному полиции за прекращение в отношении мужчины проверочных мероприятий и непривлечение его к уголовной ответственности. При этом, обвиняемый, обладая опытом уголовно-процессуальной и оперативно-розыскной деятельности, понимал, что его знакомый не будет привлечен к уголовной ответственности, так как проверяемые обстоятельства должны являться предметом судебного разбирательства в порядке гражданского судопроизводства и намерений передавать денежные средства старшему оперуполномоченному полиции не имел.  
Впоследствии подсудимый похищенными денежными средствами распорядился по своему усмотрению, при этом продолжая вводить в заблуждение знакомого, сообщив ему о передаче полученной суммы старшему оперуполномоченному полиции, что не соответствовало действительности.
Противоправные действия бывшего полицейского пресечены в ходе совместных мероприятий УФСБ России и ГУ МВД России по региону.
Приговором суда подсудимому назначено наказание в виде лишения свободы условно сроком на 3 года 6 месяцев. Приговор не вступил в законную силу."
/news/item/1701630/,nnovgorod,"В Вадском районе Нижегородской области бывший директор муниципального предприятия предстала перед судом за мошенничество, совершенное с использованием своего служебного положения","['мошенничество', 'СКР', 'следователь СК']",02 Сентября 2022,"Следователем следственного отдела по г. Арзамас следственного управления Следственного комитета Российской Федерации по Нижегородской области завершено расследование уголовного дела в отношении бывшего директора муниципального предприятия Вадского муниципального округа Нижегородской области «Вадресурс», обвиняемой в совершении преступления, предусмотренного ч. 3 ст. 159 УК РФ (мошенничество, то есть хищение чужого имущества путем обмана и злоупотребления доверием, совершенное лицом с использованием своего служебного положения).
По версии следствия, в июле 2021 года, обвиняемая, являясь директором муниципального предприятия Вадского муниципального округа Нижегородской области «Вадресурс», дала указание экономисту-бухгалтеру о начислении и выплате ей дополнительных ежемесячных премий по постановлениям «О премировании руководителя муниципального предприятия», заведомо зная, что премии по данным постановлениям ранее ей уже были выплачены.
В результате противоправных действий обвиняемой муниципальному предприятию причинен ущерб на сумму более 50 тысяч рублей.
В настоящее время уголовное дело с утвержденным обвинительным заключением передано в суд для рассмотрения по существу."
/news/item/1672875/,nnovgorod,В Арзамасском районе Нижегородской области индивидуальный предприниматель подозревается в покушении на дачу взятки (Фотографии),['СКР'],29 Августа 2022,"Следователем СО по г. Арзамас СУ СК России по Нижегородской области возбуждено уголовное дело в отношении индивидуального предпринимателя, подозреваемого в совершении преступления, предусмотренного по ч. 3 ст. 30 ч. 3 ст. 291 УК РФ (покушение на дачу взятки).
По версии следствия, 11 апреля 2022 года в дневное время, в здании по ул. Кирова г. Арзамаса Нижегородской области подозреваемый, желая избежать конфискации товаров, не имеющих соответствующей маркировки (одежда и обувь), лично передал денежные средства в сумме 20 тысяч рублей в качестве взятки старшему оперуполномоченному ОЭБиПК ОМВД России по г. Арзамасу.
Полицейский отказался принять взятку, и пресек противоправные действия подозреваемого.
При допросе он дал признательные показания. В ближайшее время ему будет предъявлено обвинение. Расследование продолжается."
/news/item/1276686/,nnovgorod,В г. Дзержинск Нижегородской области мужчина обвиняется в даче взятки сотруднику полиции,['взятка'],25 Августа 2022,"Следователями СО по г. Дзержинск следственного управления СКР по Нижегородской области возбуждено уголовное дело в отношении 56-летнего мужчины, подозреваемого в совершении преступления, предусмотренного ч.3 ст.291 УК РФ (дача взятки должностному лицу за совершение заведомо незаконных действий (бездействие).
По версии следствия, 27 ноября 2018 года подозреваемый, находясь в кабинете начальника ОЭБиПК УМВД России по г. Дзержинску, совершил дачу взятки в сумме 20 тысяч рублей, за совершение заведомо незаконных действий в виде покровительства, а также бездействия при совершении последним противоправных действий - незаконного вывоза песка.
Преступные действия подозреваемого пресечены сотрудниками ОЭБиПК УМВД России по г. Дзержинску совместно со следователями СК. Вину в совершенном преступлении он признал, в содеянном раскаялся. Ранее судим за совершение имущественных преступлений. Ему избрана мера пресечения в виде подписки о невыезде и надлежащем поведении.
Расследование уголовного дела продолжается."
/news/item/1867997/,nnovgorod,"В Советском районе города Нижнего Новгорода должностные лица и индивидуальный предприниматель, обвиняемые во взяточничестве, предстали перед судом",['СКР'],25 Августа 2022,"Следственными органами СК России по Нижегородской области завершено расследование уголовных дел в отношении бывшего заместителя командира ОБ ДПС ГИБДД УМВД России по городу Нижнему Новгороду и заместителя начальника отдела выездных и налоговых проверок МРИ ФНС России по региону, обвиняемых в посредничестве во взяточничестве, совершенное группой лиц по предварительному сговору в крупном размере  (п. «а», «б» ч. 3 ст. 291.1 УК) а также индивидуального предпринимателя, обвиняемого в даче взятки должностному лицу через посредника в крупном размере (п. «б» ч. 4 ст. 291 УК РФ).
По версии следствия, в мае 2023 года бывший сотрудник полиции получил от индивидуального предпринимателя, в отношении которого межрайонной инспекцией ФНС России по Нижегородской области организована камеральная налоговая проверка, 3 телефона и 3 пары часов Apple на общую сумму более 500 тысяч рублей, которые в дальнейшем через посредников передал должностным лицам данной инспекции ФНС в качестве взятки за назначение наиболее благоприятного наказания и уменьшения суммы налога, подлежащего уплате.
Противоправные действия обвиняемых выявлены и пресечены следователями СК России во взаимодействии с сотрудниками УФСБ России по Нижегородской области и ОРЧ СБ ГУ МВД России по Нижегородской области.
Следствием собрана достаточная доказательственная база, в связи с чем уголовные дела с утвержденными обвинительными заключениями направлены в суд для рассмотрения по существу.
Уголовное дело в отношении взяткополучателя (бывшего начальника отдела камеральных проверок МРИ ФНС России по Нижегородской области) для утверждения обвинительного заключения направлено прокурору."
/news/item/1143649/,nnovgorod,В Городецком районе врач-хирург признан виновным во взяточничестве,[],23 Августа 2022,"Собранные Городецким межрайонным следственным отделом СК России доказательства признаны судом достаточными для вынесения приговора врачу-хирургу одной из больниц Городецкого района, обвиняемому в совершении преступления, предусмотренного ч. 3 ст. 290 УК РФ (получение должностным лицом взятки за незаконные действия).
     Следствием и судом установлено, что в декабре 2015 года в дневное время подсудимый получил от гражданина взятку в размере 5 тысяч рублей за незаконные действия,  выразившиеся в выдаче листа временной нетрудоспособности.
     Приговором суда подсудимому назначено наказание в виде штрафа в размере 210000 рублей в доход государства с лишением права заниматься деятельностью, связанной с проведением экспертизы временной нетрудоспособности и выдачей листков временной нетрудоспособности, сроком на 6 месяцев."
/news/item/1679121/,nnovgorod,"В г. Дзержинске Нижегородской области перед судом предстанет сотрудник городской администрации, обвиняемый во взяточничестве (Оперативное видео)","['взятка', 'СКР', 'следователь СК', 'суд']",18 Августа 2022,"Следователями следственного отдела по городу Дзержинск следственного управления Следственного комитета Российской Федерации по Нижегородской области завершено расследование уголовного дела в отношении заместителя начальника управления муниципального контроля администрации г. Дзержинска, обвиняемой в совершении преступления, предусмотренного п. «в» ч. 5 ст. 290 УК РФ (получение взятки в крупном размере).
По версии следствия, в период с апреля по май 2021 года обвиняемая получила от представителя организации, которой требовалось проведение земляных работ, взятку в виде сотового телефона марки Samsung, а также в виде денег за выдачу разрешения на производство указанных работ. Общая сумма взятки составила свыше 170 тысяч рублей.
Противоправные действия обвиняемой выявлены и пресечены в результате совместных мероприятий, проводимых следователями СК и оперативными сотрудниками полиции УМВД России по г. Дзержинску.
В настоящее время уголовное дело с утвержденным обвинительным заключением направлено в суд для рассмотрения по существу."
/news/item/1762701/,nnovgorod,В Пильнинском районе Нижегородской области бывший главный бухгалтер школы подозревается в присвоении денежных средств,['присвоение'],18 Августа 2022,"Следователем Сергачского межрайонного следственного отдела СУ СК России по Нижегородской области возбуждено уголовное дело в отношении бывшего главного бухгалтера образовательного учреждения, подозреваемой в совершении преступления, предусмотренного ч. 3 ст. 160 УК РФ (присвоение чужого имущества, вверенного виновному с использованием своего служебного положения).
По версии следствия, с июня 2019 года по июль 2020 года подозреваемая из корыстных побуждений, не вносила на расчетный счет средней школы, расположенной в Пильнинском районе Нижегородской области переданные ей денежные средства, внесенные родителями учеников школы в виде родительской платы за питание учеников. Присвоив указанные денежные средства, она распоряжалась ими по своему усмотрению.
В результате противоправных ее действий учебному учреждению причинен имущественный вред на общую сумму свыше 700 тысяч рублей."
/news/item/1715762/,nnovgorod,"В Богородском районе Нижегородской области глава местного самоуправления Богородского муниципального округа, обвиняемый в  превышении должностных полномочий, помещен под домашний арест","['превышение полномочий', 'СКР', 'следователь СК']",17 Августа 2022,"16 августа 2022 года судом удовлетворено ходатайство следователя следственного отдела по Приокскому району г.Н.Новгород СУ СК России по Нижегородской области об избрании 51-летнему главе местного самоуправления Богородского муниципального округа Нижегородской области, обвиняемому в совершении преступления, предусмотренного п. «е» ч. 3 ст. 286 УК РФ (превышение должностных полномочий), меры пресечения в виде домашнего ареста.
Напоминаем, что по версии следствия обвиняемый, являясь должностным лицом органа местного самоуправления, в декабре 2021 года подписал постановление о прекращении права аренды с обществом с ограниченной ответственностью и заключении договоров купли-продажи на земельные участки, для ведения сельскохозяйственного производства, при этом достоверно зная, что указанные земли в соответствии с Земельным кодексом Российской Федерации не могут быть переданы в собственность за 10% от их кадастровой стоимости, в связи с неиспользованием их для сельскохозяйственного производства в период аренды.
В результате преступных действий обвиняемого муниципальному образованию причинен ущерб на сумму свыше 900 тысяч рублей.
Противоправные действия фигуранта выявлены сотрудниками СК при содействии оперативных сотрудников УФСБ и ГУ МВД России по Нижегородской области.
Расследование уголовного дела продолжается."
