Link,Topic,Card Title,Tags,Date,Card Text
/news/item/1722396/,nnovgorod,В Нижегородской области трое мужчин признаны виновными в совершении в составе группы лиц мошеннических действий на сумму 5 миллионов рублей,"['мошенничество', 'приговор', 'СКР', 'следователь СК']",27 Марта 2018,"Собранные следователем 1 отдела по расследованию особо важных дел следственного управления СК России по Нижегородской области доказательства признаны судом достаточными для вынесения приговора трем участникам организованной группы в совершении преступлений, предусмотренных ч. 4 ст. 159 УК РФ (мошенничество, совершенное организованной группой, в особо крупном размере, повлекшее лишение права гражданина на жилое помещение), п. «а» ч. 4 ст. 174.1 УК РФ (легализация имущества, приобретенного лицом в результате совершения им преступления).
Следствием и судом установлено, что в 2015 году трое подсудимых стали участниками устойчивой преступной группы, в состав которой входили участковый уполномоченный полиции и риелтор. На протяжении длительного времени участники организованной группы совершали тяжкие преступления, а именно, путем обмана они приобретали права на квартиры одиноких и умерших граждан для дальнейшей их перепродажи. Используя одну и ту же схему с использованием поддельных документов, нотариальных доверенностей, договоров купли-продажи и решений судов в 2017-2019 годах они незаконно приобрели права на 3 квартиры, расположенные на территории г.Н.Новгорода. Ущерб от указных действий составил 5 миллионов рублей.
Приговором суда подсудимым назначено наказание в виде лишения свободы на сроки от 4 до 7,5 лет с отбыванием в исправительной колонии строгого режима со штрафом от 100 до 300 тыс. руб. Приговор в законную силу не вступил.
Ранее приговором суда риелтору назначено наказание в виде 4 лет лишения свободы с отбыванием в колонии общего режима, а бывшему участковому назначено наказание в виде 6 лет лишения свободы с отбыванием в колонии общего режима."
/news/item/1666519/,nnovgorod,"В Нижегородском районе г. Н.Новгорода возбуждено уголовное дело по факту мошеннических действий представителями агентства по развитию системы гарантий для субъектов малого и среднего предпринимательства  (Фото, видео-комментарий)",['СКР'],23 Марта 2018,"Следователем СО по Нижегородскому району г. Н.Новгорода по материалу прокурорской проверки возбуждено уголовное дело по признакам преступления, предусмотренного ч. 4 ст. 159 УК РФ (мошенничество, совершенное в особо крупном размере). 
По версии следствия, в мае 2018 года Агентством по развитию системы гарантий и Микрокредитной компанией для субъектов малого и среднего предпринимательства Нижегородской области» (АНО «АРСГ МКК НО») заключен договор займа с фирмой, которая не вела коммерческой деятельности. До сегодняшнего дня обязательство по возврату займа не исполнено, чем причинен ущерб АНО на сумму свыше 1,5 миллиона рублей.
В настоящее время следователи СК совместно с оперативными сотрудниками УФСБ проводятся обыски с целью изъятия необходимой документации. Устанавливаются обстоятельства, имеющие отношение в предмету доказывания.
 Комментарий: старший помощник руководителя СУ СК России по Нижегородской области Ю. Ю. Склярова"
/news/item/1728845/,nnovgorod,В Дивеевском районе Нижегородской области водитель признан виновным в покушении на дачу взятки полицейскому,"['взятка', 'воспрепятствование следствию', 'приговор', 'СКР']",22 Марта 2018,"Собранные следователем следственного отдела ЗАТО г. Саров СУ СК России по Нижегородской области доказательства признаны судом достаточными для вынесения приговора 39-летнему водителю. Он признан виновным в совершении преступлений, предусмотренных ч. 3 ст. 30, ч. 3 ст. 291 УК РФ (покушение на дачу взятки), ч. 1 ст. 264.1 УК РФ (управление транспортным средством в состоянии опьянения лицом, подвергнутым административному наказанию).
По версии следствия, 29 мая 2022 года в дневное время, в с. Дивеево Нижегородской области, мужчина, находясь за рулем автомобиля в состоянии опьянения и будучи уже лишенным права управления транспортными средствами за управление автомобилем в состоянии опьянения, был остановлен сотрудником полиции. Желая избежать привлечения к административной ответственности за невыполнение требования уполномоченного должностного лица о прохождении медицинского освидетельствования на состояние опьянения (ч. 1 ст. 12.26 КоАП РФ), он лично покушался на дачу взятки начальнику ОГИБДД МО МВД России «Дивеевский» в сумме 47 тысяч рублей. Довести свой преступный умысел до конца подсудимый не смог, полицейский отказался принять взятку и пресек противоправные действия нарушителя.
Вину в совершении инкриминируемых деяний мужчина признал.
Приговором суда подсудимому назначено наказание в виде 3 лет 6 месяцев лишения свободы условно со штрафом в размере 1 миллион рублей и лишением права управления транспортными средствами сроком на 2 года."
/news/item/1166672/,nnovgorod,"В г. Кстово Нижегородской области следователи СК завершили расследование уголовного дела в отношении врача, обвиняемого во взяточничестве",[],01 Марта 2018,"Следователями СО по г. Кстово СУ СК России по Нижегородской области завершено расследование уголовного дела в отношении 54-летнего врача-терапевта ГБУЗ НО «Кстовская центральная районная больница», обвиняемого в совершении преступления, предусмотренного ч. 1 ст. 290 УК РФ (получение должностным лицом взятки в виде денег за совершение действий в пользу взяткодателя,  входящие в служебные полномочия должностного лица).
По версии следствия, 11 апреля 2017 врач-терапевт Кстовской ЦРБ, находясь в служебном кабинете больницы, расположенной по адресу г. Кстово, ул. Талалушкина, д.14, получил от гражданина взятку в виде денег в сумме 15 тысяч рублей за выдачу справки – листа освобождения от выполнения служебных обязанностей по временной нетрудоспособности.
Противоправные действия обвиняемого пресечены оперативными сотрудниками ГУ МВД России по Нижегородской области.
Вину в инкриминируемом ему деянии обвиняемый не признал.
В настоящее время на основании совокупности собранных по делу доказательств после утверждения прокурором обвинительного заключения оно направлено в суд для рассмотрения по существу."
/news/item/1143636/,nnovgorod,В Нижегородской области бывший  руководитель Территориального управления Росимущества региона признан виновным во взяточничестве,[],13 Февраля 2018,"Собранные следователем второго отдела по расследованию особо важных дел следственного управления доказательства признаны судом достаточными для вынесения приговора бывшему руководителю Территориального управления Росимущества в Нижегородской области в совершении преступления, предусмотренного ч. 3 ст. 30, ч. 6 ст. 290 УК РФ (покушение на получение через посредника взятки в виде денег в особо крупном размере).
         Следствием и судом установлено, что в феврале 2014 года обвиняемый, являясь должностным лицом – представителем власти, решил использовать свои должностные полномочия и получить от представителя коммерческой организации через посредника взятку в виде денег в сумме  5,5 миллионов рублей за принятие решений, подписание распоряжений о согласовании разделения и льготной приватизации земельного участка, расположенного в центральном районе г. Н. Новгорода. В целях конспирации подсудимый привлек к получению взятки в качестве посредника своего знакомого, которому поручил непосредственную передачу ему от взяткодателя денег.
10 апреля 2014 на территории Нижегородского района г. Н.Новгорода посредник получил от взяткодателя для непосредственной передачи подсудимому часть взятки в сумме 5 миллионов рублей. Противоправные действия обвиняемого были пресечены сотрудниками УФСБ России по Нижегородской области.
         Вину в совершении инкриминируемого ему преступления обвиняемый в ходе предварительного следствия  не признал.
         В августе 2014 года судом удовлетворено ходатайство следователя СК о временном отстранении обвиняемого от занимаемой должности, а в декабре того же года по ходатайству следователя суд избрал в отношении ему меру пресечения в виде заключения под стражу.
         Приговором суда 20 января 2016 года подсудимому назначено в виде 10 лет лишения свободы с отбыванием в колонии строго режима со штрафом 385 миллионов рублей."
/news/item/1250378/,nnovgorod,"В Советском районе г. Н.Новгород задержан участковый уполномоченный полиции, подозреваемый во взяточничестве",[],30 Января 2018,"Следователями СО по Советскому району г. Н.Новгород СУ СК РФ по Нижегородской области возбуждено уголовное дело в отношении участкового уполномоченного отдела полиции № 5 УМВД России по г.Н.Новгород, подозреваемого в совершении преступления, предусмотренного  ч. 3 ст. 290 УК РФ (получение должностным лицом взятки за незаконные действия).
По версии следствия, с июля по август 2018 года полицейский, имея в производстве материал проверки по сообщению о преступлении по факту причинению заявителю телесных повреждений, неоднократно высказывал требования гражданину, который якобы избил заявителя, о передаче ему денежных средств в размере 50 тысяч рублей  за принятие решения об отказе в возбуждении уголовного дела.
22 августа 2018 участковый вынес постановление об отказе в возбуждении уголовного дела по указанному заявлению. В тот же день в вечернее время у дома по ул. Богородского Советского района г.Н.Новгорода при получении от гражданина взятки в виде денег в сумме 50 тысяч рублей участковый задержан.  
Противоправные действия горе-полицейского пресечены в ходе совместно проводимых мероприятий следователями СК, сотрудниками УСБ ГУ МВД РФ по Нижегородской области и УФСБ РФ по региону.
Он задержан в порядке ст.ст. 91-92 УПК РФ.
В содеянном он признался.
В ближайшее время подозреваемому будет предъявлено обвинение и избрана мера пресечения. Расследование по уголовному делу продолжается."
/news/item/1024457/,nnovgorod,В Дзержинске заместитель начальника районного отдела УФССП подозревается во взяточничестве,[],24 Января 2018,"Дзержинским ГСО Следственного комитета возбуждено уголовное дело в отношении заместителя начальника Дзержинского районного отдела УФССП России по Нижегородской области по признакам преступления, предусмотренного  ч. 1 ст. 290 УК РФ (получение взятки).
По версии следствия, с 11 по 14 марта 2016 года подозреваемый получил через посредника взятку в сумме 2,5 тысячи рублей за способствование в снятии в ГИБДД г. Дзержинск запрета на совершение регистрационных действий с автомобилем  «KIA RIO».
Данные денежные средства, полученные ранее от владельца автомобиля, были перечислены посредником на банковскую карту подозреваемого. На момент получения взятки исполнительное производство в отношении должника было уже окончено, в связи с чем снятие запрета на регистрационные действия с автомобилем входило в обязанности судебных приставов.
В настоящее время следователи СК осуществляют комплекс следственных действий направленные на сбор и закрепление доказательств по уголовному делу."
/news/item/1314420/,nnovgorod,В г. Дзержинск Нижегородской области предприниматель признан виновным в даче взятки полицейскому (Видео-комментарий),"['взятка', 'приговор']",22 Января 2018,"Собранные следователем СО по г. Дзержинск следственного управления СКР по Нижегородской области доказательства признаны судом достаточными для вынесения приговора 56-летнему предпринимателю в совершении преступления, предусмотренного ч. 3 ст. 291 УК РФ (дача взятки должностному лицу за совершение заведомо незаконных действий (бездействие).
          Следствием и судом установлено, что 27 ноября 2018 года подсудимый, находясь в помещении УМВД России по г. Дзержинск, передал начальнику ОЭБиПК УМВД России по г. Дзержинску в качестве взятки 20 тысяч рублей за общее покровительство, а также бездействие по выявленным противоправным действиям - незаконному вывозу песка. (Накануне правоохранители пресекли работу работников его организации по вывозу песка без лицензии).
         Преступные действия обвиняемого пресечены сотрудниками ОЭБиПК УМВД России по г. Дзержинску совместно со следователями СК.  
         В ходе предварительного расследования обвиняемый вину в совершении  инкриминируемого деяния признал в полном объеме.
        Приговором суда подсудимому назначено наказание в виде 3 лет лишения свободы с отбыванием в колонии общего режима и штрафа в размере 200 тысяч рублей. Мужчина взят под стражу в зале суда.
       Приговор не вступил в законную силу. 
Комментарий: старший помощник руководителя (по взаимодействию со СМИ) СУ СК России по Нижегородской области Юлия Склярова."
