Link,Topic,Card Title,Tags,Date,Card Text
/news/item/1257916/,kamchatka,Министр здравоохранения Камчатского края отстранена от занимаемой должности,['растрата'],04 Июня 2020,"По ходатайству следователя отдела по расследованию особо важных дел следственного управления СК России по Камчатскому краю Министр  здравоохранения Камчатского края Татьяны Лемешко судом отстранена от занимаемой должности.
Напомним, что ранее в отношении Татьяны Лемешко, адвоката и учредителя коммерческой организации, возбуждено уголовное дело по признакам преступления, предусмотренного ч. 4 ст. 160 УК РФ (растрата, то есть хищение денежных средств в особо крупном размере).
Следователями регионального СК России совместно с сотрудниками УФСБ России по Камчатскому краю продолжается производство следственных действий и оперативных мероприятий, направленных на закрепление доказательственной базы. Расследование уголовного дела продолжается."
/news/item/1823973/,kamchatka,"Заведующая детского сада подозревается в хищении денежных средств, сопряженном со служебным подлогом","['мошенничество', 'служебный подлог']",23 Апреля 2020,"Следственным отделом по Тигильскому районуСУ СК России по Камчатскому краю, по результатам проверки, проводимой по материалам, поступившим из органов прокуратуры в порядке п. 2 ч. 2 ст. 37 УПК РФ и УФСБ России по Камчатскому краю, возбуждено уголовное дело в отношении бывшей заведующей бюджетного дошкольного образовательного учреждения по факту хищения ею денежных средств путем обмана в особо крупном размере, с использованием своего служебного положения, сопряженном со служебным подлогом (ч. 4 ст. 159 УК РФ, ч. 1 ст. 292 УК РФ).
По данным следствия, женщина, являясь заведующей детского сада, в период с 2018 по 2022 год вносила заведомо ложные сведения в приказы, на основании которых производились начисления и выплаты стимулирующего характера работникам учреждения, в завышенных размерах.
В результате противоправных действий фигурантки работникам детского сада неправомерно начислены и выплачены стимулирующие выплаты в сумме не менее 1,5 млн. руб., которые ими переведены заведующей, распорядившейся данными денежными средствами по своему усмотрению.
В настоящее время органом следствия устанавливаются детали произошедшего, проводятся следственные и иные процессуальные действия.
Расследование уголовного дела продолжается."
/news/item/1287781/,kamchatka,Возбуждено уголовное дело по факту хищения бюджетных средств в крупном размере,[],16 Апреля 2020,"Усть-Большерецким межрайонным следственным отделом следственного управления СК России по Камчатскому краю возбуждено уголовное дело по факту совершения преступления, предусмотренного ч. 4 ст. 159 УК РФ (мошенничество в крупном размере).
По версии следствия, неустановленные лица из числа руководства ООО «Альбатрос-Сервис» в период с июня 2016 года по декабрь 2017 года путем обмана и злоупотребления доверием представителей администрации Соболевского сельского поселения осуществили хищение денежных средств, путем невыполнения части работ, предусмотренных муниципальным контрактом, заключенным с Соболевским сельским поселением, на выполнение капитального ремонта дорог общего пользования в с. Соболево Соболевского района Камчатского края в рамках государственной программы в сфере развития инфраструктуры и благоустройства территорий населённых пунктов края, на сумму не менее 11 000 000 рублей. В частности, не выполнены  работы по укладке асфальтобетонного покрытия на дорогах общего пользования в Соболевском поселении.
Поводом для возбуждения уголовного дела послужили материалы, поступившие из прокуратуры Соболевского района и Управления ФСБ по Камчатскому краю.
В настоящее время проводятся следственные действия, направленные на установление всех обстоятельств произошедшего, назначены судебные экспертизы."
/news/item/1506487/,kamchatka,В Камчатском крае высокопоставленные сотрудники полиции подозреваются в получении взятки в особо крупном размере,['взятка'],03 Апреля 2020,"Отделом по расследованию особо важных дел следственного управления СК России по Камчатскому краю на основании результатов оперативно-розыскной деятельности сотрудников УФСБ России по Камчатскому краю и ОСБ УМВД России по Камчатскому краю возбуждено уголовное дело в отношении заместителя начальника – начальника полиции ОМВД России по Елизовскому району и начальника отдела ГИБДД ОМВД России по Елизовскому району. Они подозреваются в совершении преступления, предусмотренного  ч. 6 ст. 290 УК РФ (получение взятки в особо крупном размере).
По версии следствия, в июле 2020 года заместитель начальника – начальник полиции ОМВД России по Елизовскому району и начальник отдела ГИБДД ОМВД России по Елизовскому району за подмену рыбопродукции из нерки на рыбопродукцию из гольца и сельди в меньшем объеме и последующее отражение рыбопродукции в процессуальных документах об изъятии и помещении на ответственное хранение, получили от коммерческого директора рыбодобывающего предприятия взятку в сумме 2 миллионов рублей.
Заместитель начальника – начальник полиции ОМВД России по Елизовскому району уже является фигурантом по уголовному делу о получении взятки в крупном размере. Ему предъявлено обвинение. Злоумышленник содержится под стражей.
Начальник отдела ГИБДД ОМВД России по Елизовскому району задержан, следствием решается вопрос об избрании ему меры пресечения в виде заключения под стражу.
В настоящее время по уголовному делу проводятся следственные действия, направленные на установление всех обстоятельств совершенного преступления. Расследование уголовного дела продолжается."
/news/item/1661563/,kamchatka,Завершено расследование уголовного дела о присвоении денежных средств работником почтового отделения,['присвоение'],23 Марта 2020,"Следственным отделом по г. Петропавловск-Камчатский СУ СК России по Камчатскому краю завершено расследование уголовного дела, возбужденного по факту присвоения денежных средств граждан, совершенных с использованием служебного положения (ч.3 ст. 160 УК РФ).
В совершении преступления против собственности обвиняется заместитель начальника одного из почтовых отделений краевого центра.
По версии следствия, 40-летняя женщина в период с августа по ноябрь 2021 года из корыстных побуждений не вносила в кассу денежные средства, передаваемые гражданами для оплаты услуг по доставке почтовых отправлений, присваивала их себе, после чего распорядилась ими по своему усмотрению.
В результате противоправных действий должностного лица ущерб АО «Почта России» составил свыше 85 тысяч рублей.
В ходе следствия злоумышленница дала признательные показания и раскаялась в содеянном.
В настоящее время по уголовному делу собрана достаточная доказательственная база, в связи с чем оно передано прокурору для решения вопроса об утверждении обвинительного заключения."
/news/item/1520788/,kamchatka,Бывший сотрудник полиции подозревается в получении взятки и превышении должностных полномочий,"['взятка', 'превышение полномочий']",23 Марта 2020,"Отделом по расследованию особо важных дел следственного управления СК России по Камчатскому краю на основании результатов оперативно-розыскной деятельности сотрудников УФСБ России по Камчатскому краю и ОСБ УМВД России по Камчатскому краю возбуждено уголовное дело в отношении бывшего сотрудника полиции, занимавшего должность руководителя одного из подразделений УМВД России по Камчатскому краю. Он подозревается в совершении преступлений, предусмотренных ч. 6 ст. 290 УК РФ (получение взятки в особо крупном размере) и ч.1 ст. 286 УК РФ (превышение должностных полномочий). 
По версии следствия, в июле 2020 года подозреваемый, являющийся руководителем одного из подразделений УМВД России по Камчатскому краю, совместно заместителем начальника – начальником полиции ОМВД России по Елизовскому району и начальником отдела ГИБДД ОМВД России по Елизовскому району за подмену рыбопродукции из нерки на рыбопродукцию из гольца и сельди в меньшем объеме и последующее отражение рыбопродукции в процессуальных документах об изъятии и помещении на ответственное хранение, получили от коммерческого директора рыбодобывающего предприятия взятку в сумме 2 миллионов рублей.
Кроме того, подозреваемый при получении взятки совершил преступление против интересов государственной службы в части сокрытия информации о задержании транспортного средства с незаконной продукцией, а также совершил действия по сокрытию факта подмены рыбопродукции.
Он задержан, решается вопрос об избрании ему меры пресечения в виде заключения под стражу.
Заместителю начальника – начальнику полиции ОМВД России по Елизовскому району и руководителю отдела ГИБДД ОМВД России по Елизовскому району по ранее возбужденному уголовному делу уже предъявлено обвинение. Они содержатся под стражей.
Расследование продолжается."
/news/item/1501732/,kamchatka,Сельчанин обвиняется в даче взятки сотруднику полиции,['взятка'],20 Марта 2020,"Усть-Большерецким межрайонным следственным отделом следственного управления СК России по Камчатскому краю завершено расследование уголовного дела в отношении 61-летнего жителя села Усть-Большерецк. Он обвиняется в совершении преступления, предусмотренного ч.3 ст. 291 УК РФ (дача взятки).
По данным следствия, в июле 2020 года обвиняемый находясь в помещении комнаты приема граждан в здании Усть - Большерецкого МО МВД России за уничтожение его объяснения и прекращение проверочных мероприятий по материалу проверки, проводимой заместителем начальника полиции по преступлению предусмотренному ст. 322.3 УК РФ (фиктивная постановка на учет иностранных граждан по месту пребывания в РФ), передал сотруднику полиции деньги в сумме 40 тысяч рублей, выложив деньги из своего кармана на рабочий стол, за которым находился заместитель начальника полиции.
После передачи денежных средств заместителю начальника полиции, обвиняемый был задержан на месте совершения преступления сотрудниками полиции. Передача денежных средств фиксировалась сотрудниками МО МВД России «Усть-Большерецкий» в рамках ОРМ «наблюдение».
Примечательно, что перед совершением преступления обвиняемый предлагал заместителю начальника полиции денежные средства, на что получил  отказ, и был предупрежден об уголовной ответственности за дачу взятки должностному лицу.
Следствием собрана достаточная доказательственная база, в связи с чем, уголовное дело направлено прокурору для решения вопроса об утверждении обвинительного заключения и направления в суд для рассмотрения по существу."
/news/item/1142503/,kamchatka,Бывший начальник отдела экономической безопасности и противодействия коррупции УМВД России по городу Петропавловску-Камчатскому обвиняется в покушении на получение через посредника взятки в особо крупном размере,[],18 Марта 2020,"Отделом по расследованию особо важных дел следственного управления СКР по  Камчатскому краю завершено расследование уголовного дела в отношении бывшего начальника отдела экономической безопасности и противодействия коррупции УМВД России по городу Петропавловску-Камчатскому. Он обвиняется в совершении преступления, предусмотренного ч.3 ст.30, ч.6 ст. 290 УК РФ (покушение на получение должностным лицом через посредника взятки в виде денег в особо крупном размере).
По версии следствия, 5 сентября 2016 года начальник отдела экономической безопасности и противодействия коррупции УМВД России по городу Петропавловску-Камчатскому, пообещав главному бухгалтеру  коммерческого предприятия, в отношении которой осуществлялись проверочные мероприятия за мошенничество в особо крупном размере, поспособствовать максимальному затягиванию сроков возбуждения уголовного дела для предоставления возможности скрыть принадлежащее ей имущество, а также обеспечить ей беспрепятственный выезд за пределы Камчатского края, потребовал от последней взятку в размере 2,5 миллионов рублей.
12 сентября 2016 года женщина передала указанные денежные средства в качестве взятки для начальника через его посредника, после чего последний, являющийся знакомым высокопоставленного сотрудника полиции, взят с поличным сотрудниками УФСБ России по Камчатскому краю, что помешало начальнику отдела экономической безопасности и противодействия коррупции УМВД России по городу Петропавловску-Камчатскому по не зависящим от него обстоятельствам получить предназначавшуюся ему взятку.
Посредник обвиняется в совершении преступления, предусмотренного ч.2 ст. 291.1 УК РФ (посредничество во взяточничестве).
 Следствием собрана достаточная доказательственная база, в связи с чем, уголовное дело направлено прокурору для утверждения обвинительного заключения и последующего направления в суд для рассмотрения по существу."
/news/item/1142502/,kamchatka,В Камчатском крае завершено расследование уголовного дела по обвинению главного редактора информационного агентства в вымогательстве денежных средств,[],03 Марта 2020,"Следственным отделом по городу Петропавловск – Камчатский следственного управления Следственного комитета Российской Федерации по Камчатскому краю завершено расследование уголовного дела в отношении 24-летнего главного редактора информационного агентства «Камчатский регион». Он обвиняется в совершении преступления, предусмотренного ч. 1 ст. 163 УК РФ (вымогательство).
По версии следствия, в августе 2016 года обвиняемый, достоверно зная, что на используемом информационным агентством «Камчатский регион» интернет-портале размещена публикация, порочащая честь, достоинство, а также подрывающая репутацию зарегистрированного кандидата в депутаты Государственной Думы Российской Федерации,  отправил со своего мобильного телефона на мобильный телефон этого кандидата текстовые сообщения с требованиями передать ему денежные средства в размере 200 тысяч рублей за удаление ранее размещенной публикации и не размещение на указанном интернет-портале второй части публикации.  5 сентября 2016 года при передаче денежных средств в сумме 100 тысяч рублей обвиняемый взят с поличным сотрудниками УМВД России по Камчатскому краю.
Следствием собрана достаточная доказательственная база, в связи с чем уголовное дело с утвержденным обвинительным заключением направлено в суд для рассмотрения по существу."
