Link,Topic,Card Title,Tags,Date,Card Text
/news/item/1822245/,Белгородская область,Бывший начальник управления районной администрации подозревается в получении взятки в значительном размере,['взятка'],30 Ноября 2020,"Вторым отделом по расследованию особо важных дел (о преступлениях против государственной власти и в сфере экономики) следственного управления Следственного комитета Российской Федерации по Белгородской области возбуждено уголовное дело в отношении бывшего начальника Управления капитального строительства администрации Корочанского района, подозреваемой в совершении преступления, предусмотренного ч. 2 ст. 290 УК РФ (получение должностным лицом взятки в значительном размере).
По версии следствия, в период с 28.06.2021 по 06.08.2021 между УКС Корочанского района и одной из организаций Белгородской области заключены муниципальные контракты по организации ремонта ряда зданий, расположенных в Корочанском районе. В рамках исполнения данных контрактов подрядной организацией выполнена необходимая часть работ с составлением соответствующих актов, переданных представителю муниципального заказчика.Подозреваемая, наделенная соответствующими полномочиями, за ускорение процедуры подписания указанных актов, действуя из корыстной заинтересованности, получила взятку в виде мобильного телефона и электронных часов общей стоимостью свыше 140 тысяч рублей от фактического руководителя подрядной организации.Преступление выявлено в результате совместной работы следователей следственного управления СК России по Белгородской области и сотрудников УФСБ России Белгородской области, осуществляющих оперативное сопровождение.В рамках расследования также будет дана надлежащая правовая оценка действиям взяткодателя.В настоящее время проводится комплекс следственных действий, направленных на установление всех обстоятельств совершенного преступления."
/news/item/1719178/,Белгородская область,Житель Борисовского района осужден за покушение на дачу взятки сотруднику ДПС,"['взятка', 'приговор']",28 Октября 2020,"Собранные Борисовским межрайонным следственным отделом следственного управления Следственного комитета Российской Федерации по Белгородской области доказательства признаны судом достаточными для вынесения приговора 62-летнему жителю Борисовского района. Он признан виновным в совершении преступления, предусмотренного ч.3 ст.30 ч.3 ст.291 УК РФ (покушение на дачу взятки за совершение заведомо незаконных действий).
 
Следствием и судом установлено, что вечером 8 июля 2022 года подсудимый, находясь за рулем автомобиля, был остановлен сотрудниками ГИБДД. В ходе проверки сотрудник полиции установил, что водитель находится в состоянии алкогольного опьянения. Находясь в служебном автомобиле сотрудников ДПС, подсудимый передал полицейскому взятку в сумме 30 тысяч рублей за несоставление протокола об административном правонарушении. О действиях злоумышленника сотрудник полиции сообщил в дежурную часть ОМВД России по Борисовскому району, они были пресечены, деньги изъяты.
 
Приговором суда осужденному назначено наказание в виде штрафа 50 тысяч рублей в доход государства."
/news/item/1857902/,Белгородская область,В Белгородской области следователями СК завершено расследование уголовного дела по обвинению директора предприятия и руководителя филиала бюджетного учреждения во взяточничестве,"['взятка', 'коррупция', 'посредничество', 'собранные доказательства', 'суд']",20 Октября 2020,"ФОТО: СУ СК России по Белгородской области            

Вторым отделом по расследованию особо важных дел (о преступлениях против государственной власти и в сфере экономики) следственного управления Следственного комитета Российской Федерации по Белгородской области завершено расследование уголовного дела в отношении генерального директора ЗАО «Белгородский цемент», обвиняемого в совершении преступления, предусмотренного п. «б» ч. 4 ст. 291 УК РФ (дача взятки в крупном размере) и руководителя филиала ФГБУ «Центра лабораторных анализов и технических измерений по Белгородской области», обвиняемой в совершении преступления, предусмотренного п. «б» ч. 3 ст. 291.1 УК РФ (посредничество во взяточничестве, совершенное в крупном размере).
В октябре 2023 года на основании решения руководителя Центрально-Черноземного МУ Росприроднадзора сотрудниками указанного управления проведена внеплановая выездная проверка в отношении ЗАО «Белгородский цемент» на предмет соблюдения требований в области охраны окружающей среды, по результатам которой составлен акт о допущенных 29 нарушениях экологического законодательства РФ и вынесено предписание об их устранении, которые вручены лично генеральному директору предприятия.
Следствием установлено, что обвиняемая, зная о намерении генерального директора ЗАО «Белгородский цемент» передать взятку должностным лицам Центрально-Черноземного межрегионального управления Росприроднадзора и МУ Росприроднадзора в целях решения вопроса о непривлечении возглавляемого им предприятия к административной ответственности, а также за общее покровительство и попустительство по службе, выражающиеся в лояльном отношении при проведении будущих проверок в отношении ЗАО «Белгородский цемент», принимала активные меры к организации встреч должностных лиц.
8 ноября 2023 обвиняемая организовала встречу генерального директора завода и представителя межрегионального управления Росприроднадзора, в ходе которой ими была достигнута договоренность о размере взятки и условиях ее передачи при непосредственном участии женщины.
Во исполнение достигнутой договоренности обвиняемый 30 ноября 2023 года передал должностному лицу взятку в виде денег в сумме 500 тыс. рублей.
Преступление выявлено и пресечено сотрудниками УФСБ России по Белгородской области, осуществлявшими оперативное сопровождение по уголовному делу. Собранная следственными органами доказательственная база признана достаточной для направления уголовного дела с утвержденным обвинительным заключением в суд для рассмотрения по существу.
 
При использовани ссылка на СУ СК России по Белгородской области обязательна."
/news/item/1741469/,Белгородская область,Иностранный гражданин подозревается в даче взятки сотруднику дорожно-патрульной службы,"['взятка', 'коррупция', 'полицейский', 'противодействие', 'сотрудник']",11 Сентября 2020,"Следственным отделом по Белгородскому району следственного управления Следственного комитета Российской Федерации по Белгородской области возбуждено уголовное дело в отношении 40-летнего гражданина другого государства, временно проживающего в Белгородской области, подозреваемого в совершении преступления, предусмотренного ч. 3 ст. 291 УК РФ (дача взятки должностному лицу лично за совершение заведомо незаконного бездействия).


По версии следствия, 16 ноября 2022 года 40-летний мужчина двигался на автомобиле по территории населенного пункта, где был остановлен для проверки документов сотрудниками ГИБДД ОМВД России по Белгородскому району. Сотрудниками полиции установлено, что водитель управлял транспортным средством в состоянии алкогольного опьянения. В связи с чем, было принято решение о составлении материалов об административном правонарушении. 


Во время составления административного материала, правонарушитель предложил инспектору дорожно-патрульной службы решить вопрос «на месте» о непривлечении его к установленной ответственности и неэвакуации транспортного средства на специализированную стоянку, за денежное вознаграждение. Несмотря на полученный категорический отказ от сотрудника полиции, злоумышленник положил денежные средства в размере 20 000 рублей в личный паспорт и передал инспектору. После указанных действий подозреваемого, сотрудник полиции попросил лицо покинуть машину, вышел сам и сделал сообщение о даче взятки в ОМВД России по Белгородскому району. 


В настоящее время проводится комплекс следственных действий, направленный на установление всех обстоятельств совершенного преступления.  


При использовании ссылка на следственное управление СК России по Белгородской области обязательна."
/news/item/1484312/,Белгородская область,Обвиняемый в получении взятки чиновник Гострудинспекции взят под стражу,"['взятка', 'должностное лицо']",24 Августа 2020,"Следственным отделом по городу Белгород следственного управления Следственного комитета Российской Федерации по Белгородской области предъявлено обвинение государственному инспектору труда (по правовым вопросам) Государственной инспекции труда в Белгородской области в совершении преступления, предусмотренного ч.3 ст.290 УК РФ (получение должностным лицом взятки за незаконные действия).
 
Напомним, что в июне 2020 года руководителем коммерческой организации с нарушением трудового законодательства был уволен работник. Уволенный обратился в Гострудинспекцию с жалобой на нарушение его прав. Обращение рассматривал обвиняемый. Обладая полномочиями по рассмотрению дел об административных правонарушениях в области трудового законодательства, он обратился к коммерсанту с предложением уменьшить сумму штрафа за правонарушение за взятку в сумме 50 тысяч рублей. 20 июля 2020 года, находясь в рабочем кабинете обвиняемого, предприниматель передал ему всю сумму взятки. После получения денежных средств чиновник был задержан сотрудниками УФСБ России по Белгородской области.
 
Обвиняемый допрошен в указанном статусе, вину в совершении преступления не признает. Судом поддержано ходатайство следствия об избрании обвиняемому меры пресечения в виде заключения под стражу. Ближайшие два месяца он проведет в изоляции от общества. Расследование уголовного дела продолжается."
/news/item/1326248/,Белгородская область,Бывший сотрудник исправительного учреждения подозревается в получении взятки и превышении полномочий,"['взятка', 'превышение полномочий']",17 Августа 2020,"Валуйским межрайонным следственным отделом следственного управления Следственного комитета Российской Федерации по Белгородской области возбуждено два уголовных дела в отношении бывшего начальника отряда отдела по воспитательной работе с осужденными ИК-7 УФСИН по Белгородской области, подозреваемого в совершении преступлений, предусмотренных ч.1 ст.291.1, ч.1 ст.286 УК РФ (мелкое взяточничество, превышение должностных полномочий).
 
По версии следствия, в мае 2018 года подозреваемый договорился с осужденным, что за денежное вознаграждение доставит на территорию колонии два мобильных телефона для личного пользования осужденного.  25 мая 2018 года он передал осужденному телефоны и получил за это 10 тысяч рублей.
 
В настоящее время проводятся следственные действия, направленные на установления всех обстоятельств совершенных преступлений. Уголовные дела соединены в одно производство. Расследование продолжается."
/news/item/1864558/,Белгородская область,"Завершено расследование уголовного дела в отношении жительницы области, пытавшейся дать взятку полицейскому за непривлечение супруга к уголовной ответственности","['взятка', 'коррупция', 'покушение', 'собранные доказательства', 'суд']",14 Августа 2020,"ФОТО: СУ СК России по Белгородской области            

Следственным отделом по Шебекинскому району следственного управления Следственного комитета Российской Федерации по Белгородской области завершено расследование уголовного дела в отношении 39-летней жительницы региона, обвиняемой в совершении преступления, предусмотренного ч.3 ст. 30 ч. 3 ст. 291 УК РФ (покушение на дачу взятки должностному лицу лично за совершение заведомо незаконного бездействия).
Следствием установлено, что 13 декабря 2023 года супруг обвиняемой был остановлен сотрудниками ГИБДД, которые стали формировать материал о совершенном административном правонарушении, предусмотренном ч.1 ст. 12.8 КоАП РФ за управление транспортным средством в состоянии опьянения.  Во время составления административного материала на место прибыла обвиняемая,  которая, находясь в служебном автомобиле сотрудников ДПС, хотела решить вопрос о несоставлении в отношении супруга протокола об административно правонарушении и предложила сотруднику полиции незаконное денежное вознаграждение в размере 30 000 рублей.  От предложенного незаконного вознаграждения полицейский отказался и сделал сообщение о даче взятки в территориальный орган внутренних дел.  
Собранная следственными органами доказательственная база признана достаточной для направления уголовного дела с утвержденным обвинительным заключением в суд для рассмотрения по существу.
 
При использовании ссылка на СУ СК России по Белгородской области обязательна."
