Link,Topic,Card Title,Tags,Date,Card Text
/news/item/1326545/,Белгородская область,Житель Ровеньского района предстанет перед судом за попытку подкупа сотрудника полиции,['взятка'],30 Марта 2023,"Валуйским межрайонным следственным отделом следственного управления Следственного комитета Российской Федерации по Белгородской области завершено расследование уголовного дела по обвинению 25-летнему жителю Ровеньского района в совершении преступления, предусмотренного ч.3 ст.30 ч.3 ст.291 (покушение на дачу взятки за совершение заведомо незаконных действий).
 
По версии следствия, вечером 18 марта 2019 года обвиняемый, управляющий автомобилем в состоянии опьянения,  был остановлен нарядом ГИБДД  ОМВД России по Ровеньскому району. Для составления протокола об административном правонарушении водитель был приглашен в служебный автомобиль, где пытался передать сотруднику полиции взятку в сумме 22 тысячи 400 рублей за несоставление протокола. От взятки сотрудник полиции отказался и сообщил о противоправных действиях в дежурную часть ОМВД.
 
Следствием собрана достаточная доказательственная база, в связи с чем уголовное дело с утвержденным обвинительным заключением направлено в суд для рассмотрения по существу."
/news/item/1509117/,Белгородская область,Бывший директор лесхоза осужден за получение взятки,"['взятка', 'приговор', 'собранные доказательства']",30 Марта 2023,"Собранные вторым отделом по расследованию особо важных дел следственного управления Следственного комитета Российской Федерации по Белгородской области доказательства признаны судом достаточными для вынесения приговора бывшему директору «Валуйского лесхоза». Он признан виновным в совершении преступления, предусмотренного ч. 3 ст. 290 УК РФ (получение должностным лицом лично взятки в виде денег за совершение незаконных действий в пользу взяткодателя, в значительном размере).
 
Следствием и судом установлено, что в мае 2019 года к подсудимому обратился гражданин для приобретения 50 кубометров древесины первого сорта. Директор предложил ему оформить покупку, как древесину третьего сорта за денежное вознаграждение в сумме 60 тысяч рублей. Для передачи денежных средств подсудимый указал банковскую карту своего знакомого, который не был осведомлен о его преступных намерениях. После совершения преступления он был задержан сотрудниками УФСБ России по Белгородской области.
 
Приговором суда бывшему директору назначено наказание в виде штрафа в сумме 500 тысяч рублей. В качестве дополнительного наказания осужденный лишен права замещать ряд должностей с госорганах на 3 года."
/news/item/1268250/,Белгородская область,По факту получения взятки чиновником администрации города Белгород возбуждено уголовное дело,"['взятка', 'посредничество', 'чиновник']",29 Марта 2023,"Следственным отделом по городу Белгород следственного управления Следственного комитета Российской Федерации по Белгородской области возбуждено уголовное дело в отношении заместителя начальника комитета земельных и имущественных отношений администрации города Белгорода, подозреваемого в совершении преступления, предусмотренного  п.п «а, в» ч.5 ст.290 УК РФ (получение взятки через посредника, совершенное группой лиц в крупном размере).
 
По версии следствия, белгородский коммерсант, арендующий участок земли в городе Белгород, обратился к знакомому лицу с просьбой оказать содействие в решении вопроса о приобретении данного участка в собственность с рассрочкой платежа на 3 года. 29 октября 2018 года коммерсант передал знакомому для передачи другому посреднику  более 600 тысяч рублей, 400 тысяч из которых 30 октября 2018 года в рабочем кабинете  были переданы заместителю начальника комитета земельных и имущественных отношений администрации Белгорода. После передачи денег подозреваемый был задержан на месте происшествия сотрудниками УФСБ России по Белгородской области.
 
В ходе осмотра места происшествия в рабочем кабинете чиновника изъяты денежные средства, документация, касающаяся предстоящей сделки, компьютерная техника. Следствие намерено ходатайствовать перед судом об избрании подозреваемому меры пресечения в виде заключения под стражу.
 
Посредники взяткополучателя также были задержаны сотрудниками УФСБ России по Белгородской области на территории Белгорода, у них изъяты денежные средства. В отношении них возбуждено уголовное дело по  п.п. «а, б» ч.3 ст.291.1 УК РФ (посредничество в получении взятки, совершенное группой лиц по предварительному сговору в крупном размере)."
/news/item/1792361/,Белгородская область,Завершено расследование уголовного дела по обвинению бывших сотрудников Белгородского регионального отделения Фонда социального страхования в совершении коррупционного преступления,"['взятка', 'коррупция', 'обвинение']",22 Марта 2023,"ФОТО: СУ СК России по Белгородской области            

Вторым отделом по расследованию особо важных дел (о преступлениях против государственной власти и в сфере экономики) следственного управления Следственного комитета Российской Федерации по Белгородской области завершено расследование уголовного дела в отношении бывших сотрудников государственного учреждения-Белгородское региональное отделение Фонда социального страхования Российской Федерации, обвиняемых в совершении преступления, предусмотренного п. «а» ч. 5  ст. 290 УК РФ (получение должностным лицом лично взятки в виде денег за совершение незаконных действий и попустительство по службе в пользу представляемого взяткодателями лица, в значительном размере, совершенное группой лиц по предварительному сговору).
Расследованием установлено, что обвиняемые состояли в должности главных специалистов-ревизоров отдела проверок государственного учреждения-Белгородское региональное отделение Фонда социального страхования Российской Федерации. На основании ежегодного плана-графика выездных проверок страхователей проводились выездные проверки полноты и достоверности представляемых страхователем сведений и документов. В состав группы проверяющих для проверок на одном из предприятий региона были включены и обвиняемые по уголовному делу.
В ходе проверки ими были выявлены нарушения, за которые предусмотрены большие штрафные санкции. Для решения вопроса о прекращении дальнейшей проверки один из обвиняемых предложил представителю юридического лица передать ему денежное вознаграждение.
Договоренность о получении незаконного денежного вознаграждения была достигнута 15 марта 2022, а 16 мартиа 2022 второй обвиняемый, согласно ранее достигнутой договоренности, составил справки о результатах выездной проверки без  всесторонней и объективной проверки общества с ограниченной ответственностью.
18 марта 2022 года, находясь в кафе в Белгороде, один из обвиняемых  получил взятку в сумме 100 тысяч рублей.
После передачи денег противоправные действия должностных лиц были пресечены сотрудниками УФСБ России по Белгородской области.
Следствием собрана достаточная доказательственная база, обвинительное заключение утверждено прокуратурой, уголовное дело направлено в суд для рассмотрения по существу.
 При использовании ссылка на СУ СК России по Белгородской области обязательна."
/news/item/1779467/,Белгородская область,Следователями СК России продолжают устанавливаться эпизоды преступной деятельности бывшего главы администрации Старооскольского городского округа,"['взятка', 'коррупция', 'СКР']",21 Марта 2023,"Первым отделом по расследованию особо важных дел следственного управления Следственного комитета Российской Федерации по Белгородской области расследуется уголовное дело в отношении бывшего главы администрации Старооскольского городского округа, обвиняемого в совершении трех преступлений, предусмотренных ч. 6 ст. 290 УК РФ (получение  взятки за совершение действий в пользу взяткодателя и за общее покровительство, совершенное главой органа местного самоуправления, в особо крупном размере).
Кроме того, следователями регионального следственного управления возбуждены уголовные дела еще по двум фактам совершенных Александром Сергиенко преступлений, предусмотренных ч. 6 ст. 290 УК РФ (получение взятки за совершение действий в пользу взяткодателя и за общее покровительство, совершенное главой органа местного самоуправления, в особо крупном размере).
По версии следствия, не позднее февраля 2019 года директор одной из коммерческих организаций сообщил Сергиенко А.Н. о том, что желает выиграть крупный тендер на строительство школы в городе Старый Оскол, заказчиком которого выступал Департамент строительства и транспорта Белгородской области в лице ОГБУ «Управление капительного строительства Белгородской области», и в последующем ему необходимо получить разрешение администрации на строительство и ввод в эксплуатацию указанного объекта.
В марте 2019 года после проведения электронных торгов на строительство школы, победителем которых стала указанная  коммерческая организация, Сергиенко А.Н. обязал департамент строительства и архитектуры администрации Старооскольского городского округа Белгородской области выдать данной организации  разрешение на строительство школы.
За ускоренное и беспрепятственное предоставление администрацией Старооскольского городского округа Белгородской области разрешения на строительство и последующее разрешение на ввод в эксплуатацию школы и выполнение иных действий в пользу коммерческой организации Сергиенко А.Н. получил взятку в размере 8 000 000 рублей.
Кроме того, в начале 2020 года глава администрации Старооскольского городского округа Сергиенко А.Н. предложил директору общества с ограниченной ответственностью произвести работы по капитальному ремонту одной из общеобразовательных школ города Старого Оскола. При этом за денежное вознаграждение директору фирмы была обещана необходимая помощь при принятии выполненных работ. Во исполнение достигнутой договоренности в июне 2020 года Сергеенко А.Н. получил взятку размере 850 000 рублей.
Преступления выявлены в ходе проведения оперативно-розыскных мероприятий сотрудниками УФСБ России по Белгородской области и УМВД России по Белгородской области, осуществляющими оперативное сопровождение по уголовному делу.
В настоящее время проводится комплекс следственных действий, направленный на установление всех обстоятельств совершенных преступлений.
 
При использовании ссылка на СУ СК России по Белгородской области обязательна."
/news/item/1577179/,Белгородская область,Жительница Губкина подозревается в даче взятки сотруднику полиции,"['взятка', 'коррупция']",20 Марта 2023,"Следственным отделом по городу Губкин следственного управления Следственного комитета Российской Федерации по Белгородской области возбуждено уголовное дело в отношении 37-летней жительницы Губкина, подозреваемой в совершении преступления, предусмотренного ч.3 ст.291 УК РФ (дача взятки должностному лицу за совершение заведомо незаконных действий).
 
По версии следствия, в конце мая 2021 года подозреваемая, находясь в служебном кабинете отдела полиции в Губкине передала старшему оперуполномоченному отдела по контролю за оборотом наркотиков взятку в сумме 12000 рублей, за непроведение в отношении нее освидетельствования на состояние опьянения и последующее освобождение от административной ответственности за употребление наркотических средств без назначения врача. После передачи  взятки ее действия задокументированы сотрудниками ОЭП и ПК ОМВД России по городу Губкин.  
 
В настоящее время проводятся следственные действия, направленные на установления всех обстоятельств совершенного преступления. Расследование уголовного дела продолжается.
 
При полном или частичном использовании информации ссылка на СУ СК России по Белгородской области обязательна."
/news/item/1833535/,Белгородская область,Житель региона подозревается в покушении на дачу взятки сотруднику дорожно-патрульной службы,"['взятка', 'коррупция', 'покушение']",17 Марта 2023,"Валуйским межрайонным следственным отделом следственного управления Следственного комитета Российской Федерации по Белгородской области возбуждено уголовное дело в отношении 38-летнего жителя Ровеньского района, подозреваемого в совершении преступления, предусмотренного ч.3 ст. 30 ч. 3 ст. 291 УК РФ (покушение на дачу взятки должностному лицу за совершение заведомо незаконного бездействия).
По версии следствия, 19 октября 2023 года в вечернее время подозреваемый двигался на автомобиле по селу Калениченково Ровеньского района Белгородской области, где был остановлен для проверки документов сотрудниками дорожно-патрульной службы. В ходе проверки сотрудниками полиции было установлено, что водитель находился в состоянии опьянения.
Мужчина с целью решения вопроса о непривлечении его к административной ответственности за допущенные нарушения в области безопасности дорожного движения по ч.1 ст. 12.8 КоАП РФ, находясь в салоне служебного автомобиля дорожно-патрульной службы, попытался дать взятку сотруднику полиции в размере 36 000 рублей, положив деньги между передними сиденьями автомобиля.  
Сотрудник полиции от незаконного вознаграждения отказался и о произошедшем сообщил в дежурную часть территориального органа внутренних дел.
В настоящее время проводится комплекс следственных действий, направленный на установление всех обстоятельств совершенного преступления. Расследование уголовного дела продолжается.
 
При использовании ссылка на СУ СК России по Белгородской области обязательна."
