Link,Topic,Card Title,Tags,Date,Card Text
/news/item/1300272/,murmansk,НАЧАЛЬНИК ОДНОГО ИЗ ОТДЕЛОВ ФКУ ИК-18 УФСИН РОССИИ ПО МУРМАНСКОЙ ОБЛАСТИ ПОДОЗРЕВАЕТСЯ В ПОЛУЧЕНИИ ВЗЯТКИ,"['взятка', 'должностное лицо']",25 Января 2021,"Фото из открытых источников            

Следственными органами Следственного комитета Российской Федерации  по Мурманской области возбуждено уголовное дело в отношении начальника одного из отделов ФКУ ИК-18 УФСИН России по Мурманской области, подозреваемого в совершении преступления, предусмотренного ч. 3 ст. 290 УК РФ (получение должностным лицом лично взятки в виде денег за незаконные действия).
По версии следствия, в период с марта по май 2018 года должностное лицо колонии получило от осужденного исправительного учреждения взятку суммой 20 000 рублей за незаконные действия, а именно за пронос на режимную территорию средств связи, что запрещено действующим законодательством.
Преступление выявлено в ходе мероприятий, проведенных сотрудниками регионального ФСБ России совместно с оперативными сотрудниками отдела собственной безопасности УФСИН России по Мурманской области.
В настоящее время злоумышленнику предъявлено обвинение, проводится комплекс следственных действий, направленных на установление обстоятельств совершенного преступления. Расследование уголовного дела продолжается. 
 
Старший помощник руководителя Следственного управления Следственного комитета РФ по Мурманской области по взаимодействию со СМИ Алина Александрович"
/news/item/1532920/,murmansk,Житель Кандалакши подозревается в покушении на дачу взятки сотруднику ГИБДД,['взятка'],13 Января 2021,"Фото из открытых источников            

Следственным отделом по городу Кандалакша следственного управления Следственного комитета Российской Федерации возбуждено уголовное дело в отношении 37-летнего жителя Кандалакши. Он подозревается в совершении преступления, предусмотренного ч. 3 ст. 30, ч. 3 ст. 291 УК РФ (покушение на дачу взятки должностному лицу за совершение заведомо незаконных действий).
По версии следствия, в ночь с 6 на 7 января 2021 года подозреваемый управлял транспортным средством в состоянии алкогольного опьянения. На улице Энергетиков в городе Полярные Зори мужчина остановлен нарядом ДПС. После установления факта опьянения водителя, его автомобиль был изъят.
На следующий день в рамках административного разбирательства мужчина прибыл в отдел ГИБДД. Находясь в служебном кабинете, подозреваемый передал инспектору ДПС денежные средства в размере 30 000 рублей, положив их между страниц Кодекса Российской Федерации об административных правонарушениях, находившегося на  письменном столе. Он рассчитывал на то, что приняв указанную взятку, сотрудник полиции не будет составлять документы об административном правонарушении, и подозреваемый сможет избежать ответственности за управление автомобилем в состоянии опьянения.
Однако инспектор ДПС незаконное вознаграждение не принял. Преступные действия взяткодателя пресечены и надлежащим образом зафиксированы.
В настоящее время проводятся следственные действия, направленные на сбор и закрепление доказательств. Подозреваемый дает признательные показания, поясняя, что боялся лишиться права управления транспортным средством.
Расследование уголовного дела продолжается.
 
Старший помощник руководителя Следственного управления Следственного комитета РФ по Мурманской области по взаимодействию со СМИ Алина Александрович"
/news/item/1851917/,murmansk,Бывший председатель Комитета по строительству администрации города Мурманска предстанет перед судом по обвинению в совершении коррупционных преступлений,"['мошенничество', 'присвоение']",12 Января 2021,"Фото СУ СК России по Мурманской области            

Следственным отделом по городу Мурманск регионального СУ СК России окончено уголовное дело в отношении бывшего председателя Комитета по строительству администрации города Мурманска, обвиняемой в совершении трех преступлений, предусмотренных ч. 3 ст. 160 УК РФ (присвоение имущества с использованием служебного положения), двух преступлений, предусмотренных ч. 1 ст. 292 УК РФ (служебный подлог), и одного преступления, предусмотренного ч. 3 ст. 159 УК РФ (мошенничество с использованием служебного положения).
По версии следствия, с декабря 2020 года по декабрь 2022 года обвиняемая, 1977 года рождения, неоднократно издавала приказы о выплате премий за высокие показатели в работе, а также материальной помощи подчиненным ей сотрудникам в связи с их якобы тяжелым материальным положением.
При этом законные основания для выплаты премий и материальной помощи отсутствовали, а денежные средства сотрудники переводили на расчетный счет должностного лица.
В результате преступных действий обвиняемой городскому бюджету администрации города Мурманска причинен ущерб на сумму 87 тыс. рублей, а сотрудникам комитета на сумму 33 тыс. рублей.
По уголовному делу выполнен значительный объем следственных и процессуальных действий, получены результаты судебных экспертиз и исследований, допрошены специалисты и свидетели. В целях возмещения причиненного преступлением ущерба судом по ходатайству следователя на счета обвиняемой в банковских учреждениях наложен арест.
В настоящее время следствием собрана достаточная доказательственная база, в связи с чем уголовное дело с утвержденным обвинительным заключением направлено в суд для рассмотрения по существу."
/news/item/1227922/,murmansk,В попытке дать взятку должностному лицу подозревается житель города Мурманска,"['взятка', 'покушение']",16 Ноября 2020,"Фото из открытых источников            

Следственным отделом по городу Мурманск Следственного управления Следственного комитета Российской Федерации по Мурманской области возбуждено уголовное дело в отношении 30-летнего жителя города Мурманска. Он подозревается в совершении преступления, предусмотренного частью 3 статьи 30 частью 3 статьи 291 УК РФ (покушение на дачу взятки должностному лицу за совершение заведомо незаконных действий (бездействие)).
По данным следствия, 24 апреля 2018 года мужчина в состоянии алкогольного опьянения управлял автомобилем и был остановлен сотрудником ОБ ДПС ГИБДД УМВД России по Мурманской области. В момент составления инспектором ДПС административного протокола по ч. 1 ст. 12.8 Кодекса об административных правонарушениях Российской Федерации «Управление транспортным средством в состоянии опьянения» злоумышленник, не желая быть привлеченным к ответственности, совершил действия, направленные на передачу сотруднику правоохранительных органов в качестве взятки денежных средств в сумме 11 тысяч 200 рублей. Однако довести преступный замысел он до конца не смог, так как его действия были пресечены сотрудниками полиции.
В настоящее время проводятся следственные действия, направленные на установление всех обстоятельств произошедшего. Расследование уголовного дела продолжается."
/news/item/1285689/,murmansk,В МУРМАНСКОЙ ОБЛАСТИ ЗАМЕСТИТЕЛЬ РУКОВОДИТЕЛЯ ГОСУДАРСТВЕННОГО АВТОНОМНОГО УЧРЕЖДЕНИЯ «ЦЕНТР СПОРТИВНОЙ ПОДГОТОВКИ» ПОДОЗРЕВАЕТСЯ В ПОЛУЧЕНИИ ВЗЯТКИ (ВИДЕО),['взятка'],15 Октября 2020,"Фото из открытых источников            

Отделом по расследованию особо важных дел следственного управления Следственного комитета Российской Федерации по Мурманской области, с учетом результатов оперативно-разыскной деятельности УФСБ России по Мурманской области, возбуждено уголовное дело в отношении заместителя руководителя государственного автономного учреждения Мурманской области «Центр спортивной подготовки», подозреваемого в совершении преступления, предусмотренного ч. 3 ст. 290 УК РФ (получение должностным лицом взятки за незаконные действия).
По версии следствия, подозреваемый, являясь должностным лицом, лично получил взятку в виде денег в общей сумме 150 000 рублей за совершение незаконных действий, входящих в его служебные полномочия, связанных с обеспечением победы в конкурсной процедуре государственной закупки на проведение областного мероприятия по организации церемонии награждения спортсменов, тренеров и ветеранов спорта. Общая сумма контракта составила более 800 тысяч рублей.
В настоящее время следствием назначены необходимые экспертизы, проводятся иные следственные действия, направленные на установление истины по уголовному делу, решается вопрос о предъявлении злоумышленнику обвинения и избрании меры пресечения в виде заключения под стражу. Расследование уголовного дела продолжается.
Уголовным законом данное преступление отнесено к категории тяжких, за совершение которого предусмотрено максимальное наказание в виде лишения свободы на срок до 8 лет.
 
Старший помощник руководителя Следственного управления Следственного комитета РФ по Мурманской области по взаимодействию со СМИ Ксения Кошелюк
(Оперативное видео УФСБ по Мурманской области)"
/news/item/1515152/,murmansk,В Мурманске вынесен обвинительный приговор в отношении бывшего начальника регионального отдела Росстандарта,"['взятка', 'приговор']",31 Августа 2020,"Фото СУ СК России по Мурманской области            

Собранные следственными органами Следственного комитета Российской Федерации по Мурманской области доказательства признаны судом достаточными для вынесения обвинительного приговора в отношении бывшего начальника отдела государственного контроля и надзора в Мурманской области Северо-Западного Межрегионального территориального управления Федерального агентства по техническому регулированию и метрологии (Росстандарт). Он признан виновным в совершении преступления, предусмотренного п. «в» ч. 5 ст. 290 УК РФ (получение должностным лицом взятки в крупном размере за незаконные действия).
Следствием и судом установлено, что в 2018 году по результатам проведенной региональным отделом Росстандарта проверки одного из областных энергетических предприятий выявлены нарушения, в том числе в части несоблюдения обязательных требований безопасности, а также использования оборудования неутвержденного типа. предприятию предписано устранить выявленные нарушения в срок до февраля 2020 года.
28 февраля 2020 года в адрес отдела Росстандарта от руководства предприятия поступило обращение о продлении срока устранения нарушений на несколько месяцев. начальник указанного отдела, являясь должностным лицом, предложил представителю энергетической организации за взятку совершить незаконные действия, выражающиеся в попустительстве неисполнению выданного ранее предписания, а также за игнорирование им при последующих контрольно-надзорных мероприятиях фактически не устраненных нарушений.
За совершение незаконных действий подсудимый 12 марта 2020 года под контролем оперативных сотрудников УФСБ России по Мурманской области и следователей получил незаконное вознаграждение в размере 200 тысяч рублей. После получения денежных средств злоумышленник был задержан.
В ходе расследования следователями проведен комплекс следственных действий, направленный на сбор доказательств. Вину в инкриминируемых преступлениях подсудимый признал в полном объеме.
Приговором суда виновному назначено наказание в виде штрафа в размере 1 600 000 рублей с лишением права занимать должности на государственной службе и в органах местного самоуправления, а также связанные с организационно-распорядительными и административно-хозяйственными функциями в государственном органе на срок 5 лет. Приговор в законную силу не вступил.
 
Старший помощник руководителя Следственного управления Следственного комитета РФ по Мурманской области по взаимодействию со СМИ Алина Александрович"
/news/item/1261224/,murmansk,Житель города Мурманска подозревается в попытке дать взятку полицейскому золотой цепочкой с кулоном  (ВИДЕО),"['взятка', 'покушение']",25 Августа 2020,"фото СУ СК РФ по Мурманской области            

Следственным отделом по городу Мурманск Следственного управления Следственного комитета Российской Федерации по Мурманской области возбуждено уголовное дело в отношении 41-летнего жителя города Мурманска. Он подозревается в совершении преступления, предусмотренного частью 3 статьи 30 частью 3 статьи 291 УК РФ (покушение на дачу взятки должностному лицу за совершение заведомо незаконных действий (бездействие)).
По данным следствия, подозреваемый, управляя транспортным средством с признаками алкогольного опьянения, был остановлен сотрудниками дорожно-патрульной службы ГИБДД УМВД России по Мурманской области у одного из домов по проспекту Ленина в городе Мурманске. В момент составления инспектором ДПС административного протокола по ч. 1 ст. 12.8 Кодекса об административных правонарушениях Российской Федерации «Управление транспортным средством в состоянии опьянения» злоумышленник, не желая быть привлеченным к ответственности, передал сотруднику правоохранительных органов в качестве взятки золотую цепочку и золотую подвеску стоимостью более 27 тысяч рублей.
Однако довести преступный замысел он до конца не смог, так как его действия были пресечены сотрудниками полиции.
В настоящее время проводятся следственные действия, направленные на установление всех обстоятельств произошедшего и сбор доказательственной базы. Расследование уголовного дела продолжается.
 
Старший помощник руководителя Следственного управления Следственного комитета РФ по Мурманской области по взаимодействию со СМИ Ксения Кошелюк"
