Link,Topic,Card Title,Tags,Date,Card Text
/news/item/1332846/,Белгородская область,Двое белгородцев подозреваются в посредничестве во взяточничестве,"['взятка', 'посредничество']",01 Февраля 2022,"Вторым отделом по расследованию особо важных дел следственного управления Следственного комитета Российской Федерации по Белгородской области возбуждено уголовное дело в отношении двух белгородцев, подозреваемых в совершении преступления, предусмотренного ч.4 ст.291.1 УК РФ (посредничество во взяточничестве в особо крупном размере).
 
По версии следствия, 8 апреля 2019 года сотрудник департамента агропромышленного комплекса и воспроизводства окружающей среды Белгородской области, находясь на рабочем месте, вместе со другим подозреваемым,  получили от своего знакомого деньги в сумме 3 миллиона рублей, которые по договоренности должны были передать должностному лицу в органах внутренних дел за принятие решения о прекращении уголовного дела. После получения денег подозреваемые были задержаны сотрудниками УМВД России по Белгородской области.
 
В настоящее время проводится комплекс следственных действий, направленные на установление всех обстоятельств совершенного преступления, закрепления полученных доказательств. Расследование уголовного дела продолжается."
/news/item/1846204/,Белгородская область,"Судом вынесен приговор в отношении жителя региона, пытавшегося дать взятку сотруднику полиции","['взятка', 'коррупция', 'покушение', 'приговор', 'собранные доказательства', 'суд']",31 Января 2022,"ФОТО: СУ СК России по Белгородской области            

Собранные следственным отделом по городу Белгород следственного управления Следственного комитета Российской Федерации по Белгородской области доказательства признаны судом достаточными для вынесения приговора 36-летнему жителю региона, признанному виновным в совершении преступления, предусмотренного ч.3 ст. 30 ч. 3 ст. 291 УК РФ (покушение на дачу взятки должностному лицу за совершение заведомо незаконного бездействия).
Следствием и судом установлено, что 29 августа 2023 года в вечернее время подсудимый двигался на автомобиле по территории областного центра, где был остановлен для проверки документов сотрудниками ГИБДД УМВД России по городу Белгороду. В ходе проверки сотрудниками полиции было установлено, что водитель находился в состоянии опьянения.
Фигурант с целью решения вопроса о непривлечении его к административной ответственности за допущенные нарушения в области безопасности дорожного движения по ч.1 ст. 12.8 КоАП РФ, находясь в салоне служебного автомобиля дорожно-патрульной службы, попытался дать взятку сотруднику полиции в размере 30 000 рублей, положив деньги в перчаточный ящик служебного автомобиля.
Сотрудник полиции от незаконного вознаграждения отказался и о произошедшем сообщил в дежурную часть территориального органа внутренних дел.
Собранная следственными органами доказательственная база признана достаточной для направления уголовного дела с утвержденным обвинительным заключением в суд для рассмотрения по существу.
Приговором суда виновному назначено наказание в виде штрафа в доход государства в размере 250 000 рублей.
 
При использовании ссылка на СУ СК России по Белгородской области обязательна."
/news/item/1759200/,Белгородская область,Житель региона подозревается в даче взятки сотруднику ГИБДД,"['взятка', 'коррупция', 'противодействие']",28 Января 2022,"Следственным отделом по городу Белгороду следственного управления Следственного комитета Российской Федерации по Белгородской области возбуждено уголовное дело в отношении 37-летнего жителя области,  подозреваемого в совершении преступления, предусмотренного ч. 3 ст. 291 УК РФ (дача взятки должностному лицу лично за совершение заведомо незаконного бездействия).
По версии следствия, 15 января 2023 года подозреваемый двигался на автомобиле по территории населенного пункта, где был остановлен для проверки документов сотрудниками ДПС ГИБДД УМВД России по городу Белгороду. В отношении него сотрудниками полиции за уклонение от прохождения освидетельствования на состояние опьянения составлен протокол об административном правонарушении, предусмотренном ч. 1 ст. 12.26 КоАП РФ.
В это время на место происшествия прибыл командир взвода ДПС ГИБДД УМВД России по городу Белгороду, с целью проверки несения службы подчинёнными ему сотрудниками.
Подозреваемый решил обратиться к вышестоящему сотруднику полиции с предложением о решении вопроса о непривлечении его  к административной ответственности за совершенное правонарушение. С этой целью он сел в служебную автомашину и предложил командиру взвода незаконное денежное вознаграждение. Получив категорический отказ от сотрудника полиции, злоумышленник положил денежные средства в размере 15 000 рублей в перчаточный ящик служебного автомобиля. После указанных действий подозреваемого сотрудник полиции попросил лицо покинуть машину, вышел сам и сделал сообщение о даче взятки в УМВД России по городу Белгороду.
В настоящее время проводится комплекс следственных действий, направленный на установление всех обстоятельств совершенного преступления. Расследование уголовного дела продолжается.
При использовании ссылка на СУ СК России по Белгородской области обязательна."
/news/item/1712939/,Белгородская область,Житель Белгорода подозревается в покушении на дачу взятки сотруднику полиции,['взятка'],14 Января 2022,"Следственным отделом по городу Белгород следственного управления Следственного комитета Российской Федерации по Белгородской области возбуждено уголовное дело в отношении 34-летнего жителя Белгорода, подозреваемого в совершении преступления, предусмотренного ч.3 ст.30 ч. 3 ст.291 УК РФ (покушение на дачу взятки за незаконное бездействие).
 
По версии следствия, 3 августа 2022 года подозреваемый, находясь в служебном кабинете сотрудника УМВД России по городу Белгороду, передал незаконное денежное вознаграждение  в сумме 30 тысяч рублей оперуполномоченному за непривлечение его к уголовной и административной ответственности несоставление в связи с осуществлением незаконной предпринимательской деятельности, связанной с реализацией алкогольной продукции без соответствующего разрешения (лицензии). Однако, довести свой умысел до конца подозреваемый не смог по независящим от него причинам, потому что о склонении к совершению коррупционного преступления сотрудник полиции сообщил в дежурную часть. Действия подозреваемого были пресечены, деньги изъяты.
 
Следствием проводится комплекс следственных и процессуальных действий, направленный установление всех обстоятельств совершенного преступления. Расследование уголовного дела продолжается."
/news/item/1492811/,Белгородская область,Бывший сотрудник полиции осужден за покушение на получение взятки,"['взятка', 'покушение', 'приговор', 'собранные доказательства']",11 Января 2022,"Собранные вторым отделом по расследованию особо важных дел следственного управления Следственного комитета Российской Федерации по Белгородской области доказательства признаны судом достаточными для вынесения приговора старшему оперуполномоченному УЭБ и ПК УМВД России по Белгородской области. Он признан виновным в совершении преступления, предусмотренного ч.3 ст.30  ч.6 ст.290 УК РФ (покушение на получение взятки в особо крупном размере).
 
Следствием и судом установлено, что в сентябре 2019 года подсудимый через посредника пытался получить от одного из руководителей коммерческой структуры взятку в сумме 1 миллион 300 тысяч рублей за непроведение проверки в этой коммерческой организации. Получить деньги  бывший оперуполномоченный не смог, т.к.  был задержан сотрудниками УФСБ России по Белгородской области совместно с сотрудниками собственной безопасности УМВД России по Белгородской области был задержан посредник во взяточничестве.
 
Приговором суда бывшему правоохранителю назначено наказание в виде 8 лет лишения свободы с отбыванием в колонии строгого режима со штрафом в сумме 2,6 миллиона рублей, также в течение 8 лет он лишен права замещать должности в государственных и муниципальных структурах."
/news/item/1772151/,Белгородская область,"В отношении бывшего генерального директора АО ""Белгородская ипотечная корпорация"" избрана мера пресечения в виде заключения под стражу","['взятка', 'обвинение', 'СКР']",11 Января 2022,"Вторым отделом по расследованию особо важных дел (о преступлениях против государственной власти и в сфере экономики) следственного управления Следственного комитета Российской Федерации по Белгородской области возбуждено уголовное дело в отношении бывшего генерального директора акционерного общества «Белгородская ипотечная корпорация» подозреваемого в совершении преступления, предусмотренного ч. 6 ст. 290 УК РФ (получение должностным лицом взятки, совершенное группой лиц по предварительному сговору, в особо крупном размере). 
По версии следствия, в период с августа 2019 по июль 2021 года  подозреваемый, являясь генеральным директором АО «БИК» дал указания исполнительному директору АО «БИК», находившемуся в его непосредственном подчинении, на заключение договоров займа между обществом и несколькими коммерческими организациями, которым из средств АО «БИК» были предоставлены денежные средства по договору займа под установленный процент. После заключения указанных договоров займа генеральным директором АО «БИК» даны указания исполнительному директору общества на заключение дополнительных соглашений к договорам займа с выгодными для коммерческих организаций условиями, касающимися продления сроков действия договоров, увеличения сумм займов, а также неприменения тарифных санкций за просрочку их возврата. Впоследствии погашение задолженности по вышеуказанным договорам займа на общую сумму свыше 50 000 000 рублей не произведено. При этом, в период получения указанных займов через третью коммерческую организацию в собственность генерального директора АО «БИК» был передан автомобиль стоимостью свыше 2 500 000 рублей за совершение действий в пользу коммерческих организаций, заключивших договора займов с Обществом, а также за непринятие мер к возвращению данными организациями полученных в АО «БИК» заемных денежных средств.
Преступление выявлено в ходе проведения оперативно-розыскных мероприятий  сотрудниками УФСБ России Белгородской области осуществляющими оперативное сопровождение по уголовному делу.
В настоящее время проводится комплекс следственных действий, направленный на установление всех обстоятельств совершенного преступления. Подозреваемый задержан следователями СК России в порядке ст. 91 УПК РФ, ему предъявлено обвинение. Свердловским районным судом города Белгорода по ходатайству следователя избрана мера пресечения в виде заключения под стражу. Расследование уголовного дела продолжается.При использовании ссылка на СУ СК России по Белгородской области обязательна."
/news/item/1402646/,Белгородская область,Сотрудник полиции предстанет перед судом по обвинению в получении взятки в крупном размере,"['взятка', 'должностное лицо']",30 Декабря 2021,"Вторым отделом по расследованию особо важных дел следственного управления Следственного комитета Российской Федерации по Белгородской области завершено расследование уголовного дела по обвинению начальника отдела по вопросам миграции ОМВД России по городу Валуйки и Валуйскому району в совершении преступления, предусмотренного п. «б», «в» ч. 5 ст. 290 УК РФ (получение должностным лицом лично взятки в виде денег за незаконное бездействие в пользу взяткодателя, если бездействие входит в служебные полномочия должностного лица, совершенное с вымогательством взятки в крупном размере).
 
По версии следствия, в 2013 году на гражданина Республики Азербайджан был наложен запрет на въезд в Российскую Федерацию до февраля 2016 года. Находясь в Азербайджане, он оформил паспорт на чужое имя, пребывал по нему в России в течение месяца. В 2017 году он вновь въехал в Россию по первоначальным документам и получил вид на жительство. В августе 2018 обвиняемый по дактилоскопическим картам установил, что оба паспорта граждан Азербайджана принадлежат одному и тому же лицу.
 
Из корыстных побуждений, он стал склонять гражданина Азербайджана к передаче ему денежных средств в сумме 200 тысяч рублей за несоставление материалов по статье Уголовного кодекса за незаконное пересечение Государственной границы Российской Федерации и передаче этих материалов в пограничное управление ФСБ России по Белгородской и Воронежской областям.
 
В марте 2019 года при получении через посредника взятки обвиняемый был задержан сотрудниками УФСБ России по Белгородской области совместно со службой собственной безопасности УМВД России по Белгородской области.
 
Следствием собрана достаточная доказательственная база, в связи с чем уголовное дело с утвержденным обвинительным заключением направлено в суд для рассмотрения по существу."
