Link,Topic,Card Title,Tags,Date,Card Text
/news/item/1558695/,osetia,"Бывшему руководителю Россельхознадзора республики предъявлено окончательное обвинение в незаконной предпринимательской деятельности, злоупотреблении должностными полномочиями и растрате","['злоупотребление полномочиями', 'незаконное предпринимательство', 'растрата']",20 Мая 2022,"Следственным управлением Следственного комитета Российской Федерации по Республике Северная Осетия – Алания бывшему руководителю Россельхознадзора по Республике Северная Осетия – Алания предъявлено обвинение в совершении преступлений, предусмотренных ст. 289 УК РФ (осуществление предпринимательской деятельности, через доверенное лицо с предоставлением организации льгот и преимуществ), ч. 1 ст. 285 УК РФ (злоупотребление должностными полномочиями – 2 эпизода) и ч. 3 ст. 160 УК РФ (растрата вверенного имущества с использованием своего служебного положения).
По данным следствия, с сентября 2019 по август 2020 года обвиняемая вопреки запрету, установленному законом на занятие государственными служащими предпринимательской деятельностью, преследуя цель извлечения прибыли, используя свое должностное положение и возможности, участвуя в деятельности общества с ограниченной ответственностью «Алания» через своего сына, предоставляла Обществу преимущества и привилегии по прохождению ветеринарного контроля в пунктах пропуска через государственную границу Российской Федерации и местах таможенного оформления, при пропуске завозимой рыбной продукции, путем дачи соответствующих указаний своим подчиненным по скорейшей выдаче разрешительных документов на взъезд, что позволяло избежать негативных последствий в виде убытков по пропаже продукции.  
Кроме того, 8 июня 2020 года обвиняемая дала указание инспекторам Россельхознадзора по РСО-Алания, осуществлявшим обязанности по ветеринарному надзору в пунктах пропуска через государственную границу Российской Федерации, получать взятки с водителей большегрузных автомашин в размере 3 тыс. рублей за каждую машину, за беспрепятственное пересечение границы и въезд на территорию Российской Федерации. Однако   требования обвиняемой подчиненные исполнять отказались.
В период с февраля 2020 по январь 2021 года обвиняемая передала служебную автомашину марки «Тойота Камри», принадлежавшую на праве собственности Россельхознадзору по РСО-Алания, в постоянное пользование своему сыну. Используя автомобиль в личных целях, он повредил две передние фары и совершил ряд административных правонарушений. Осознавая персональную ответственность за сохранность вверенного ей имущества, обвиняемая дала указание подчиненным за счет средств управления осуществить замену двух передних фар на служебной автомашине и провести ее техническое обслуживание на общую сумму 60 тыс. рублей.
В результате грамотно спланированных и проведенных сотрудниками следственного управления СК России и регионального управления ФСБ совместных следственных действий и оперативно-розыскных мероприятий, противоправная деятельность обвиняемой была пресечена. По ходатайству следственных органов судом в отношении нее избрана мера пресечения в виде домашнего ареста.
В настоящее время проводятся следственные действия, направленные на окончание расследования. В ближайшее время уголовное дело будет передано прокурору для утверждения обвинительного заключения."
/news/item/1781065/,osetia,Во Владикавказе чиновнику предъявлено обвинение в коррупционных преступлениях,"['взятка', 'чиновник']",18 Мая 2022,"Иристонским межрайонным следственным отделом по городу Владикавказу следственного управления Следственного комитета Российской Федерации по Республике Северная Осетия – Алания 43-летнему начальнику отдела по обеспечению работы государственных информационных систем Государственного учреждения – Отделения пенсионного фонда России по РСО-Алания двум жителям города Владикавказа предъявлено обвинение в совершении преступления, предусмотренного ч. 3 ст. 290 УК РФ (получение взятки за незаконное бездействие в пользу взяткодателя).
По данным следствия, в период с 23 августа по 16 ноября 2022 года обвиняемый через посредников получил денежное вознаграждение в размере 194,7 тыс. рублей за принятие незаконных решений о назначении мер социальной поддержки в виде ежемесячной денежной выплаты на шестерых детей в возрасте от 8 до 17 лет по 12,4 тыс. рублей на каждого ребенка.
Благодаря грамотно спланированным и проведенным следственным действиям и оперативно-розыскным мероприятиям обвиняемый был задержан. По ходатайству следственных органов судом в отношении него избрана мера пресечения в виде домашнего ареста.  
В настоящее время проводятся следственные действия, направленные на закрепление доказательственной базы. Расследование уголовного дела продолжается."
/news/item/1605227/,osetia,Сотруднику ДПС предъявлено обвинение в вымогательстве взятки,[],17 Мая 2022,"Следственным отделом по Пригородному району следственного управления Следственного комитета Российской Федерации по Республике Северная Осетия – Алания 40-летнему инспектору дорожно-патрульной службы ГИБДД МВД по РСО-Алания предъявлено обвинение в совершении преступления, предусмотренного п. «б» ч. 5 ст. 290 УК РФ (вымогательство взятки).

По версии следствия, 11 августа 2021 года примерно в 9 часов 50 минут обвиняемый, находясь при исполнении служебных обязанностей на участке автодороги «Владикавказ-Алагир», остановил автомобиль ВАЗ-2106 под управлением местного жителя. Водителю было предложено пройти освидетельствование на состояние алкогольного опьянения. После освидетельствования, не продемонстрировав результаты, обвиняемый сообщил мужчине, что у него установлено наличие опьянения и потребовал от него 70 тыс. рублей за не привлечение к административной ответственности. В тот же день, после получения взятки в указанном размере, обвиняемый был задержан сотрудниками регионального УФСБ. 

По ходатайству следственных органов судом в отношении него избрана мера пресечения в виде домашнего ареста. 

В настоящее время проводятся следственные действия, направленные на закрепление доказательственной базы. Расследование уголовного дела продолжается."
/news/item/1602586/,osetia,Перед судом предстанут работники психиатрической больницы обвиняемые в получении взятки в крупном размере,[],12 Мая 2022,"Следственным управлением Следственного комитета Российской Федерации по Республике Северная Осетия – Алания завершено расследование уголовного дела в отношении врача-психиатра кабинета активного диспансерного наблюдения диспансерного отделения и специалиста по социальной работе ГБУЗ «Республиканская психиатрическая больница» Министерства здравоохранения РСО-Алания. Они обвиняются в совершении преступления, предусмотренного п.п. «а», «в» ч. 5 ст. 290 УК РФ (получение взятки группой лиц по предварительному сговору в крупном размере).По версии следствия, в начале февраля 2021 года местная жительница обратилась к обвиняемым, чтобы получить инвалидность по состоянию здоровья. На что сотрудницы медучреждения сообщили, что они могут оказать ей содействие в формировании документов для постановки на учет у врача-психиатра и направлении на медико-социальную экспертизу, за денежное вознаграждение в размере 270 тыс. рублей. В апреле женщина передала обвиняемым часть требуемой суммы в размере 70 тыс. рублей. Затем осознав противоправность требований медицинских работников, она обратилась в правоохранительные органы. 28 мая 2021 года при передаче оставшейся части взятки в размере 200 тыс. рублей обвиняемые были задержаны. В ходе следствия  обвиняемые полностью признали свою вину и активно способствовали раскрытию преступления.
Следствием собрано достаточно доказательств, в связи с чем уголовное дело с утвержденным обвинительным заключением направлено в суд для рассмотрения по существу."
/news/item/1658275/,osetia,В Пригородном районе перед судом предстанет бывший сотрудник ДПС по обвинению в вымогательстве взятки,"['взятка', 'вымогательство']",09 Марта 2022,"Следственным отделом по Пригородному району следственного управления Следственного комитета Российской Федерации по Республике Северная Осетия – Алания завершено расследование уголовного дела в отношении бывшего инспектора ДПС ГИБДД МВД по РСО-Алания. Он обвиняется в совершении преступления, предусмотренного п. «б» ч. 5 ст. 290 УК РФ (вымогательство взятки).
По данным следствия, 11 августа 2021 года примерно в 9 часов 50 минут обвиняемый, находясь при исполнении служебных обязанностей на участке автодороги «Владикавказ-Алагир», остановил автомобиль ВАЗ-2106 под управлением местного жителя. Водителю было предложено пройти освидетельствование на состояние алкогольного опьянения. После освидетельствования, не продемонстрировав результаты, обвиняемый сообщил мужчине, что у него установлено наличие опьянения и потребовал от него 70 тыс. рублей за непривлечение к административной ответственности. В тот же день, после получения взятки в указанном размере, обвиняемый был задержан сотрудниками регионального УФСБ. 
По ходатайству следственных органов судом в отношении него избрана мера пресечения в виде домашнего ареста. 
Следствием собрано достаточно доказательств, в связи с чем уголовное дело с утвержденным обвинительным заключением направлено в суд для рассмотрения по существу."
/news/item/1468086/,osetia,Во Владикавказе командир взвода ДПС подозревается в получении взятки,[],09 Марта 2022,"Северо-Западным межрайонным следственным отделом по городу Владикавказу следственного управления Следственного комитета Российской Федерации по Республике Северная Осетия – Алания в отношении 31-летнего командира 4 взвода 1 роты отдельного батальона дорожно-патрульной службы ГИБДД УМВД России по городу Владикавказу возбуждено уголовное дело. Он подозревается в совершении преступления, предусмотренного ч. 3 ст. 290 УК РФ (получение взятки за незаконные действия).
По версии следствия, 26 марта 2020 года примерно в 20 часов 30 минут местный житель, следуя на автомашине «Nissan Fuga» по улице Гвардейская в городе Владикавказе, был остановлен инспекторами ДПС. При проверке документов оказалось, что у мужчины нет водительского удостоверения, в связи с чем, за совершение административного правонарушения инспектора доставили его в отдел полиции для разбирательства. Через некоторое время полицейские повезли водителя на освидетельствование, на алкогольное опьянение. По пути к ним подъехали товарищ водителя вместе с подозреваемым. В ходе разговора подозреваемый предложил водителю за 70 тыс. рублей помочь избежать наказание за совершенное правонарушение. Мужчина согласился и отказался от прохождения медицинского освидетельствования на состояние опьянения. В ночь на 27 марта 2020 года в районе Архонского шоссе во Владикавказе водитель через своего знакомого передал подозреваемому взятку в размере 70 тыс. рублей. После этого, сотрудники полиции вернули ему автомашину и не составили в отношении него административный материал.
В настоящее время проводятся следственные действия и оперативно-розыскные мероприятия, направленные на установление всех обстоятельств совершенного преступления. Кроме того, в ходе расследования будет дана принципиальная правовая оценка действиям сотрудников ДПС, не принявших никаких мер к привлечению виновного к административной ответственности, а также лица, передавшего взятку подозреваемому. Расследование уголовного дела продолжается."
/news/item/1799394/,osetia,В Ардонском районе врач-невролог подозревается в получении взятки,['взятка'],05 Марта 2022,"Правобережным межрайонным следственным отделом следственного управления Следственного комитета Российской Федерации по Республике Северная Осетия – Алания в отношении врача-невролога Ардонской центральной республиканской больницы возбуждено уголовное дело. Она подозревается в совершении преступления, предусмотренного ч. 3 ст. 290 УК РФ (получение должностным лицом взятки за незаконные действия).
По версии следствия, 4 июля 2022 года подозреваемая, находясь в служебном кабинете, получила взятку в размере 30 тыс. рублей от медсестры за совершение незаконных действий в пользу ее родной сестры по ускорению оформления медицинской документации и направление ее на медико-социальную экспертизу для признания инвалидом.
Противоправная деятельность подозреваемой пресечена благодаря грамотно спланированным и проведенным следственным действиям и оперативно-розыскным мероприятиям.
В настоящее время проводятся следственные действия, направленные на установление всех обстоятельств совершенного преступления."
/news/item/1443770/,osetia,Во Владикавказе директору одного из предприятий предъявлено окончательное обвинение в даче взятки в крупном размере,['взятка'],22 Февраля 2022,"Следственным управлением Следственного комитета Российской Федерации по Республике Северная Осетия – Алания 56-летнему генеральному директору акционерного общества «Автоколонна 1210» предъявлено обвинение в совершении преступления, предусмотренного п. «б» ч. 4 ст. 291 УК РФ (дача взятки в крупном размере).
По данным следствия, 21 января 2020 года в АО «Автоколонна 1210» в городе Владикавказе сотрудником УФСБ России по РСО-Алания были проведены оперативно-розыскные мероприятия, по окончанию которых обвиняемый предложил сотруднику взятку в размере 500 тыс. рублей за прекращение проверочных мероприятий. О поступившем предложении было доложено руководству УФСБ и принято решение о проведении в отношении генерального директора необходимых мероприятий. 27 января 2020 года при передаче взятки в сумме 500 тыс. рублей обвиняемый был задержан.  
В настоящее время проводятся следственные действия, направленные на окончание расследования."
