Link,Topic,Card Title,Tags,Date,Card Text
/news/item/1336223/,kchr,"В Карачаево-Черкесии по обвинению в превышение должностных полномочий, взятках и служебном подлоге перед судом предстанет бывший чиновник регионального управления МЧС России",[],13 Апреля 2024,"Следственными органами Следственного комитета Российской Федерации по Карачаево-Черкесской Республике окончено следствие в отношении 48-летнего заместителя начальника ГУ МЧС России по КЧР. Чиновник обвиняется по ч. 1 ст. 286 УК РФ (превышение должностных полномочий), ч. 2 ст. 292 УК РФ (служебный подлог), ч. 1 ст. 290 УК РФ (получение взятки).
По версии следствия, злоумышленник, занимая должность заместителя начальника ГУ МЧС России по КЧР, в декабре 2016 года при осуществлении обязанностей по исполнению контракта о производстве проектно-изыскательских работ по строительству объекта внес заведомо ложные сведения в официальные документы, подтверждающие выполнение контрактных обязательств подрядчиком. Фактически работы, предусмотренные государственным контрактом, не проводились. Вследствие чего были необоснованно израсходованы бюджетные денежные средства в сумме 5 млн. рублей, предназначенные на оплату исполненных работ по договору.
Он же, в декабре 2017 года получил взятку от гражданина в виде денег в размере 20 тыс. рублей за действия, связанные с получением статуса ветерана боевых действий, дающих право на ежемесячное денежное пособие и установленные законодательством льготы.
Уголовное дело направлено в Черкесский городской суд Карачаево-Черкесской Республики для рассмотрения по существу.
Следственное управление 
СКР по КЧР
тел. 8 (878-22) 8-11-74
http://kchr.sledcom.ru//"
/news/item/1500972/,kchr,В Карачаево-Черкесской Республике сотрудниками СКР завершено расследование уголовного дела о покушении на дачу взятки,"['взятка', 'коррупция', 'СКР']",11 Апреля 2024,"Следственными органами СУ СК России по Карачаево-Черкесской Республике завершено расследование уголовного дела в отношении 34-летнего местного жителя, обвиняемого в покушении на дачу взятки лично должностному лицу (ч.3 ст.30 и ч.1 ст.291 УК РФ).
В ходе предварительного следствия установлено, что 21.08.2020 злоумышленник передал лично должностному лицу Усть-Джегутинского районного отдела судебных приставов регионального Управления Федеральной службы судебных приставов России в качестве взятки  11 000 рублей.
Денежное вознаграждение предназначалось за совершение представителем власти действий по принятию решения о невозможности взыскания в пользу одного из подразделений регионального Управления ФНС России денежных средств в размере свыше 217 000 рублей и прекращении исполнительного производства по данному основанию, мотивируя это отсутствием финансовой возможности погасить вышеуказанную задолженность.
Судебный пристав от получения взятки отказался, а преступная деятельность взяткодателя пресечена в ходе совместных оперативно-розыскных мероприятий проводимых сотрудниками службы безопасности УФССП и МВД республики.
На основании собранных следствием доказательств уголовное дело с утвержденным обвинительным заключением направлено в суд для рассмотрения по существу."
/news/item/1695374/,kchr,Заведующая детского сада села Терезе предстанет перед судом за мошенничество и служебный подлог,"['коррупция', 'мошенничество', 'служебный подлог']",10 Апреля 2024,"Следственным отделом по Малокарачаевскому району следственного управления Следственного комитета Российской Федерации по Карачаево-Черкесской Республике завершено расследование уголовного дела в отношении заведующей муниципального казенного дошкольного образовательного учреждения «Детский сад №5 «Къуанч» села Терезе. Она обвиняется в совершении четырех эпизодов преступлений, предусмотренных ч. 3 ст. 159 УК РФ (мошенничество, то есть хищение чужого имущества путем обмана, совершенное с использованием своего служебного положения) и ч. 1 ст. 292 УК РФ (служебный подлог, то есть внесение должностным лицом в официальные документы заведомо ложных сведений, если эти деяния совершены из корыстной или иной личной заинтересованности).
Следствием установлено, в период с сентября 2008 года по декабрь 2021 года обвиняемая, являясь заведующей детским учреждением, из корыстных побуждений, желая улучшить свое материальное положение, пользуясь своим полномочиями, фиктивно трудоустроила свою родственницу и  ежемесячно утверждала табели учета рабочего времени, содержащие заведомо ложные сведения о ее работе. В действительности, последняя на работу не ходила и возложенный функционал не выполняла, в то время как заработная плата начислялась на банковскую карту, которая находилась в распоряжении заведующей детским садом, которая снимала денежные средства и использовала в личных целях.
В ходе следствия обвиняемая полностью признала свою вину, активно сотрудничала со следствием, а также возместила причиненный  материальный ущерб в размере 392 тысячи рублей.
В целях установления истины следователем допрошен ряд свидетелей, проведены выемки и осмотры служебной документации, необходимые экспертизы, а также следственные и процессуальные действия, изобличающие заведующую в совершении указанного преступления. В настоящее время собрана исчерпывающая доказательственная база, в связи с чем уголовное дело с утвержденным обвинительным заключением направлено в суд для рассмотрения по существу.
                                                                     
При полном или частичном использовании материалов сайта ссылка на следственное управление Следственного комитета Российской Федерации по Карачаево-Черкесской Республике обязательна."
/news/item/1418547/,kchr,Адвокат Карачаево-Черкеской республиканской коллегии адвокатов признан виновным в покушении на мошенничество,"['адвокат', 'мошенничество', 'приговор', 'суд']",05 Апреля 2024,"Собранные отделом по расследованию особо важных дел следственного управления Следственного комитета Российской Федерации по Карачаево-Черкесской Республике доказательства признаны судом достаточными для вынесения приговора адвокату Карачаево-Черкеской республиканской коллегии адвокатов Рашиду Лайпанову. Он признан виновным в совершении преступления, предусмотренного ч.3 ст.30 и ч.2 ст.159 УК РФ (покушение на мошенничество).
Уголовное дело рассмотрено по существу в Черкесском городском суде Карачаево-Черкесской Республики.
Следствием и судом установлено, что Лайпанов, осуществляя защиту в рамках уголовного дела по обвинению лица в совершении особо тяжких преступлений - убийства и покушении на убийство двух и более лиц, мошенническим путем требовал от родственников обвиняемого передачи ему одного миллиона ста тысяч рублей, якобы за решение им вопроса об освобождении обвиняемого из-под стражи и переквалификации его действий на более мягкое преступление.
Однако реализовать задуманное Лайпанову не удалось, в апреле 2018 года в ходе проводимых оперативно-розыскных мероприятий сотрудниками УФСБ России по Карачаево-Черкесской Республике он был задержан с переданными ему в качестве аванса денежными средствами и муляжом денежных средств на сумму 100.000 рублей.
В ходе предварительного и судебного следствия Лайпанов не признавал свою вину в содеянном. Приговор суда обжаловался стороной защиты, однако вышестоящей инстанцией признан законным.
На основании собранных следствием доказательств, судом Рашиду Лайпанову назначено наказание в виде штрафа.
Старший помощник руководителя следственного управления Следственного комитета РФ по Карачаево-Черкесской Республике Роман Цыганков."
/news/item/1571529/,kchr,"В отношении инспектора ДПС ОГИБДД МО МВД России «Зеленчукский», подозреваемого в мелком взяточничестве, возбуждено уголовное дело",['коррупция'],28 Марта 2024,"Первым отделом по расследованию особо важных дел следственного управления Следственного комитета Российской Федерации по Карачаево-Черкесской Республике по материалам УФСБ России по Карачаево-Черкесской Республике возбуждено уголовное дело в отношении инспектора ДПС ОГИБДД МО МВД России «Зеленчукский», подозреваемого в совершении преступления, предусмотренного ч. 1 ст. 291.2 УК РФ (мелкое взяточничество).
По данным следствия, ночью 23 февраля 2021 года подозреваемый,  осуществляя патрулирование автодороги Майкоп-Зеленчукская, остановил автомобиль под управлением местной жительницы, находящейся в состоянии алкогольного опьянения. Желая обогатиться, преследуя корыстный интерес, инспектор предложил женщине передать ему денежное вознаграждение в размере 10 тысяч рублей, гарантировав ей освобождение от административной ответственности и наказания, на что последняя согласилась. В связи с отсутствием в тот момент с собой денежных средств, они договорились, что она передаст указанную сумму в ближайшие дни,  после чего  была отпущена. В последующем, в период с 24 по 26 февраля 2021 года подозреваемый неоднократно высказывал женщине требования о необходимости передачи ему взятки в размере 10 тысяч рублей. Вечером 26 февраля 2021 года женщина, находясь около одного из заведений общепита Урупского района, передала злоумышленнику требуемые им денежные средства.
Указанные преступные действия подозреваемого нанесли урон авторитету органов внутренних дел как органу государственной власти и правопорядка.
В настоящее время по уголовному делу выполняется комплекс необходимых следственных и процессуальных действий, направленных на установление всех обстоятельств совершенного преступления, сбор и закрепление доказательственной базы.
 
При полном или частичном использовании материалов сайта ссылка на следственное управление Следственного комитета Российской Федерации по Карачаево-Черкесской Республике обязательна."
/news/item/1454697/,kchr,В Карачаево-Черкесской Республике возбуждено уголовное дело о превышении должностных полномочий.,"['должностное лицо', 'полицейский', 'превышение полномочий', 'СКР']",18 Марта 2024,"Следственными органами следственного управления Следственного комитета Российской Федерации по Карачаево-Черкесской Республике по материалам регионального УФСБ возбуждено два уголовных дела в отношении государственного инспектора безопасности дорожного движения одного из подразделений ГИБДД МВД России в республике. Уголовные дела возбуждены  по ч. 1 ст. 286 УК РФ (превышение должностных полномочий).
По предварительным данным, представитель власти из личной заинтересованности  оформил подложные документы жителям из соседнего региона о профессиональной подготовке водителей транспортных средств без прохождения соответствующего обучения и сдачи квалификационного экзамена.
На основании выданных злоумышленником документов два 24-летних автовладельца, не имеющие соответствующих навыков, получили водительские удостоверения.
Проведенными сотрудниками УФСБ оперативно-розыскными мероприятиями преступная деятельность должностного лица выявлена и задокументирована.
Следователем обнаружены и изъяты водительские удостоверения и иные выданные водителям документы, допрошены свидетели, назначены экспертизы. В настоящее время решается вопрос об избрании меры пресечения.
Уголовные дела соединены в одно производство. Расследование уголовного дела продолжается."
/news/item/1299210/,kchr,Пятеро бывших сотрудников ГИБДД города Кисловодска признаны виновными в вымогательстве взяток,[],12 Марта 2024,"Собранные Главным следственным управлением по Северо-Кавказскому федеральному округу Следственного комитета Российской Федерации доказательства признаны судом достаточными для вынесения приговора  бывшим сотрудникам взвода в составе отдельной роты ДПС ОГИБДД ОМВД России по городу Кисловодску Арману Геворгяну, Александру Макарову, Виктору Тимановскому, Рудольфу Чилингаряну и Михаилу Феневу. Они признаны виновными  в  совершении ряда эпизодов преступления, предусмотренного пп. «а, б» ч. 5 ст. 290 УК РФ (получение взяток в виде денег за совершение незаконных действий (бездействие), группой лиц по предварительному сговору, с вымогательством).
Следствием и судом установлено, что соучастники преступной группы в форменном обмундировании и при исполнении должностных обязанностей, заранее договорившись, в период с 30 июня по 23 декабря 2013 года под предлогом проверки документов водителя автомобиля останавливали въезжающий в город Кисловодск и выезжающий автотранспорт, отдавая предпочтение автомобилям с регистрационными знаками других субъектов. В ходе проверки документов водителей они высказывали свои подозрения о наличии у них признаков опьянения, после чего предлагали пройти в помещение, расположенное на маршруте патрулирования. Под действием угроз и психологического давления водители вынужденно передавали участникам преступной группы требуемую сумму денег в виде взятки в размере от 12 до 50 тысяч рублей, за непроведение административных процедур. Общая сумма незаконных вознаграждений составила более 450 тысяч рублей. 
Фигуранты вину в инкриминируемых им деяниях не признали. Однако следствие предоставило все необходимые доказательства, изобличающие соучастников в коррупционных преступлениях, в числе которых неопровержимые оперативные данные, предоставленные УФСБ России по Ставропольскому краю.
Приговором суда всем соучастникам назначено наказание  в виде лишения свободы с отбыванием в исправительной колонии строгого режима сроком от 6 до 8 лет, так  же им запрещено занимать должности в государственных и правоохранительных органах сроком от 2 до 5 лет.
Видео: https://twitter.com/sledcom_rf/status/1095565401658920960"
