Link,Topic,Card Title,Tags,Date,Card Text
/news/item/1146121/,chel,"В Челябинской области завершено расследование уголовного дела в отношении бывшего заместителя главы администрации Чебаркульского городского округа, обвиняемого в получении взяток и злоупотреблении должностными полномочиями",[],24 Декабря 2021,"Следственными органами Следственного комитета Российской Федерации по Челябинской области завершено расследование уголовного дела в отношении в бывшего заместителя главы  администрации Чебаркульского городского округа Олега Соловьева, обвиняемого в совершении преступлений, предусмотренных ч.ч.2,3 ст.290 УК РФ (получение взятки), ч.1 ст.285 УК РФ (злоупотребление должностными полномочиями).
По версии следствия, обвиняемый, в 2016 году получил взятку в виде услуг имущественного характера от местного предпринимателя в сумме более 100 тысяч рублей, который предоставил чиновнику квартиру в Чебаркуле для проживания. За это чиновник содействовал последнему в заключении муниципальных контрактов по благоустройству, создавая препятствия для участия в конкурсах других предпринимателей. Также, в 2016 году другой предприниматель оплатил за чиновника административный штраф в сумме 15 тысяч рублей за нарушения им финансовой дисциплины, за что Соловьев способствовал ему в заключении муниципальных контрактов без проведения конкурсов.
Преступления выявлены совместно сотрудниками регионального управления ФСБ России и ГУ МВД России по Челябинской области, которые осуществляют оперативное сопровождение по уголовному делу.
Следствием собрана достаточная доказательная база, в связи с чем уголовное дело направлено прокурору для утверждения обвинительного заключения. В ходе предварительного расследования следователем СК главе администрации Чебаркульского городского округа внесено представление о принятии мер по устранению обстоятельств, способствовавших совершению преступления.
 
Следственное управление
СК России по Челябинской области
27.06.2017"
/news/item/1643696/,chel,В Челябинской области заместитель главы района подозревается в получение взятки,[],20 Декабря 2021,"Следственными органами Следственного комитета Российской Федерации по Челябинской области возбуждено уголовное дело в отношении заместителя главы Ашинского городской администрации, подозреваемого в совершении преступления, предусмотренного ч.3 ст. 290 УК РФ (получение взятки), а так же и в отношении местного жителя подозреваемого в совершении преступления, предусмотренного ч.3 ст.291 УК РФ (дача взятки).
         По данным следствия, заместитель главы администрации района получил взятку в сумме 50 тысяч рублей от заинтересованного лица за совершение действий по заключению муниципального контракта на приобретение жилья для граждан, из числа детей сирот.
         Преступление выявлено сотрудниками Управления ФСБ России по Челябинской области, которые осуществляют оперативное сопровождение  уголовного дела.
В настоящее время проводятся следственные действия, направленные на сбор и закрепление доказательственной базы. Решается вопрос о предъявлении обвинения и избрании меры пресечения.
  
Следственное управление
СК России по Челябинской области
29.12.2021"
/news/item/1480284/,chel,В Челябинской области сотрудница Ростехнадзора подозревается в получении  взятки,[],09 Декабря 2021,"Следственными органами Следственного комитета Российской Федерации по Челябинской области возбуждено уголовное дело в отношении сотрудницы регионального управления Ростехнадзора, подозреваемой в совершении преступления, предусмотренного ч.3 ст.290 УК РФ (получение взятки).
По версии следствия, в 2019 году в городе Троицк подозреваемая получила взятку в сумме более 17 тысяч рублей от представителя коммерческой организации за выполнение незаконных действий в интересах данной организации.
Преступление выявлено сотрудниками ГУ МВД России по Челябинской области, которые осуществляют оперативное сопровождение по уголовному делу.
В настоящее время проводятся следственные действия, направленные на сбор и закрепление доказательственной базы. Решается вопрос об избрании меры пресечения и предъявлении обвинения. Расследование уголовного дела продолжается.
 
Следственное управление
СК России по Челябинской области
08.07.2020"
/news/item/1170104/,chel,"В Челябинской области осуждены бывшие руководящие сотрудники театра, признанные виновными в получении взяток",[],08 Декабря 2021,"Собранные следственными органами Следственного комитета Российской Федерации по Челябинской области доказательства признаны судом достаточными для вынесения обвинительного приговора в отношении бывшего заместителя директора областного государственного бюджетного учреждения культуры «Челябинский государственный академический театр оперы и балета имени М.И. Глинки» Юрия Резепина   и бывшего главного инженера театра Виктора Квасова, признанных виновными в совершении преступлений, предусмотренных п.п.«а,в» ч.5 ст.290 УК РФ, п.«в» ч.5 ст.290 УК РФ (получение взятки).
Следствием и судом установлено, что осужденные в период 2015-2016 годов получили взятки на общую сумму не менее 254 тысяч рублей от представителей коммерческих организаций, за приемку выполненных ремонтных работ.  В ходе расследования уголовного дела по ходатайству следователя СК судом был наложен арест на земельный участок и автомобили обвиняемых.
Преступления выявлены сотрудниками регионального управления ФСБ России и ГУ МВД России по Челябинской области, осуществлявшими оперативное сопровождение уголовного дела.
Приговором суда осужденным назначено наказание в виде 5 лет лишения свободы условно.
  
Следственное управление
СК России по Челябинской области
10.10.2017"
/news/item/1287316/,chel,"В Челябинской области осуждена бывший руководитель Магнитогорского управления Пенсионного фонда, признанная виновной в совершении коррупционных преступлений",[],02 Декабря 2021,"Собранные следственными органами Следственного комитета Российской Федерации по Челябинской области доказательства признаны судом достаточными для вынесения приговора в отношении бывшего руководителя управления Пенсионного Фонда Российской Федерации в г. Магнитогорске Любови Штейн, признанной виновной в совершении преступлений, предусмотренных ч.3 ст.290 УК РФ (получение взятки в значительном размере за незаконные действия), ч.1 ст.285 УК РФ (злоупотребление должностными полномочиями)
Следствием и судом установлено, что в период с период с января 2016 по июнь 2018 года обвиняемая, занимая должность начальника управления Пенсионного Фонда Российской Федерации в г. Магнитогорске, освободила от выполнения рабочих обязанностей уборщицу служебных помещений, которая фактически за получаемую заработную плату осуществляла уход за несовершеннолетним внуком обвиняемой. Кроме того, в 2017 году обвиняемая за незаконную перечу персональных данных граждан сотруднику банка получила взятку в сумме более 61 тысячи рублей, которые в виде материальной помощи были перечислены на банковский счет ее дочери.
Преступления выявлены сотрудниками регионального управления ФСБ России.
Приговором суда осужденной назначено наказание в виде 3 лет 4 месяцев лишения свободы условно с лишением права занимать должности на государственной и муниципальной на срок 2 года.
 
Следственное управление
СК России по Челябинской области
29.12.2018"
/news/item/1650876/,chel,В Челябинской области заведующий кафедры филиала ВУЗа подозревается в получении взяток,[],01 Декабря 2021,"Следственными органами Следственного комитета Российской Федерации по Челябинской области возбуждено уголовное дело в отношении заведующего кафедры филиала высшего учебного заведения (г. Миасс),  подозреваемого в совершении преступлений, предусмотренных ч.3 ст.290 УК РФ (получение взятки).
По данным следствия, в 2019 году подозреваемый получил взятку в сумме более 62 тысячи рублей от студента за сдачу экзаменов по различным учебным дисциплинам  без фактической проверки знаний.
Преступление выявлено сотрудниками ГУ МВД России по Челябинской области, которые осуществляют оперативное сопровождение уголовного дела.
В настоящее время проводятся следственные действия по установлению обстоятельств совершенного преступления. Решается вопрос об избрании меры пресечения и предъявлении обвинения. Расследование уголовного дела продолжается.
  
Следственное управление
СК России по Челябинской области
27.01.2022"
/news/item/1195841/,chel,"В Челябинской области завершено расследование уголовного дела в отношении главы Баландинского сельского поселения, обвиняемой в  получении взяток, превышении должностных полномочий и растрате",[],01 Декабря 2021,"Следственными органами Следственного комитета Российской Федерации по Челябинской области завершено расследование уголовного дела в отношении главы Баландинского сельского поселения Красноармейского района Веры Галицковой, которой предъявлено обвинение в совершении преступлений, предусмотренных ч.3 ст.160 УК РФ (растрата), ч.3 ст.30, ч.2 ст.286 УК РФ (покушении получение на превышение должностных полномочий), ч.2 ст.286 УК РФ (превышение должностных полномочий), ч.3 ст.30, п.«в» ч.5 ст.290 УК РФ (покушении получение на получение взятки), ч.4 ст.290 УК РФ (получение взятки).
По данным следствия, в 2016 года обвиняемая получила взятки от местных жителей в общей сумме 220 тысяч рублей за незаконное предоставление 2 земельных участков на территории  Баландинского сельского поселения. Также, превышая должностные полномочия, она незаконно предоставила гражданам 4 земельных участка, стоимостью более 400 тысяч рублей и покушалась на получение взятки в сумме 500 тысяч рублей за выделение 3 земельных участков. Кроме того, обвиняемой было присвоено имущество сельского поселения на сумму более 40 тысяч рублей. 
Оперативное сопровождение по уголовному делу осуществлялось сотрудниками ГУ МВД Российской Федерации по Челябинской области. По ходатайству следователя СК судом в отношении обвиняемой избрана мера пресечения в виде домашнего ареста.  В рамках расследования уголовного дела следователем СК внесено представление председателю Совета депутатов Баландинского сельского поселения с требованием об устранении причин, способствовавших совершению преступления.   
Следствием собрана достаточная доказательная база, в связи с чем уголовное дело направлено для рассмотрения в суд.
  
Следственное управление
СК России по Челябинской области
16.01.2018"
/news/item/1612689/,chel,В Челябинской области осужден муниципальный служащий признанный виновным в получении взятки,[],26 Ноября 2021,"Собранные следственными органами Следственного комитета Российской Федерации по Челябинской области доказательства признаны судом достаточными для вынесения приговора в отношении старшего инженера отдела управления транспорта администрации города Челябинска, признанного виновным в совершении преступления, предусмотренного ч.2 ст.290 УК РФ (получение взятки).
Следствием и судом установлено, что в 2020 году осужденный получил взятку в сумме 35 тысяч рублей от представителя коммерческой организации за оказание покровительства при выполнении муниципального контракта по оказанию услуг в виде пассажирских перевозок.
Преступление выявлено сотрудниками Управления ФСБ России по Челябинской области, которые осуществляли оперативное сопровождение уголовного дела.
Приговором суда осужденному назначено наказание в виде 2 лет лишения свободы условно.
  
Следственное управление
СК России по Челябинской области
24.09.2021"
/news/item/1726997/,chel,В Челябинской области начальник структурного подразделения промышленного предприятия подозревается в получении взяток,"['взятка', 'деньги', 'следователь СК']",26 Ноября 2021,"Следственными органами Следственного комитета Российской Федерации по Челябинской области начальник структурного подразделения промышленного предприятия подозревается в совершении преступлений, предусмотренных ч.3 ст.290 УК РФ (получение взятки).
По данным следствия, в 2018 году подозреваемый получил взятки в сумме  более 75 тысяч рублей от директора коммерческой организации за заключение договоров  на поставку металлопродукции.  

Преступление выявлено сотрудниками ГУ МВД России по Челябинской области, которые осуществляют оперативное сопровождение уголовного дела.
В настоящее время проводятся следственные действия по установлению обстоятельств совершенного преступления. Решается вопрос об избрании меры пресечения и предъявлении обвинения.
 
Следственное управление
СК России по Челябинской области
28.09.2022"
/news/item/1640858/,chel,В Челябинской области сотрудник полиции подозревается в получении взятки,[],25 Ноября 2021,"Следственными органами Следственного комитета Российской Федерации по Челябинской области возбуждено уголовное дело в отношении участкового уполномоченного районного отдела полиции областного центра, подозреваемого в совершении преступления, предусмотренного ч.3 ст.290 УК РФ (получение взятки).
По данным следствия, в период с мая 2020 по февраль 2021 гг. сотрудник полиции получил взятку от предпринимателя на сумму более 48 тысяч рублей за предоставление информации об умерших гражданах на территории Челябинска для последующего оказания предпринимателем ритуальных услуг.
Преступление выявлено сотрудниками управления собственной безопасности ГУ МВД России по Челябинской области, которые  осуществляют оперативное сопровождение по уголовному делу.
В настоящее время проводятся следственные действия, направленные на сбор и закрепление доказательственной базы. Решается вопрос о предъявлении обвинения и избрании меры пресечения.
  
Следственное управление
СК России по Челябинской области
20.12.2021"
