Link,Topic,Card Title,Tags,Date,Card Text
/news/item/1817825/,zabaykalye,Следователи СК завершили расследование уголовного дела в отношении бывшего заместителя директора государственного учреждения,"['взятка', 'коррупция', 'чиновник']",26 Января 2021,"Следователи второго отдела по расследованию особо важных дел следственного управления СК России по Забайкальскому краю завершили расследование уголовного дела в отношении Виктора Гуслякова, бывшего заместителя директора по строительству объектов промышленно-гражданского строительства государственного казенного учреждения «Служба единого заказчика» Забайкальского края. Он обвиняется по чч. 5 и 6 ст. 290 УК РФ (получение взяток организованной группой в крупном и особом крупном размерах).
По версии следствия, в 2021-2022 годах Гусляков в составе организованной группы с двумя другими работниками службы единого заказчика получал взятки от коммерческих структур за оказание содействия в заключении и приемке государственных контрактов на строительство социальных объектов, в том числе Забайкальский государственного театра кукол «Тридевятое царство», трех многоквартирных жилых домов для переселенцев из аварийного жилья и лиц из числа детей-сирот в краевом центре и Оловяннинском районе Забайкальского края, а также школы-детского сада в поселке Могзон Хилокского района Забайкальского края.
Следователи собрали необходимую доказательственную базу, уголовное дело с утверждённым обвинительным заключением направлено для рассмотрения в суд. По действующему законодательству Гуслякову грозит уголовное наказание вплоть до 15 лет лишения свободы со штрафом в размере до 70-кратной суммы взятки.
В целях обеспечения исполнения приговора на имущество Гуслякова, в том числе автомобиль, 2 стояночных места для автомобилей в г. Москва, нежилое помещение в г. Улан-Удэ по ходатайству следствия наложен арест. Общая стоимость арестованного имущества - около 12 млн рублей.
Расследование уголовного дела в отношении других фигурантов продолжается."
/news/item/1792939/,zabaykalye,Следователи СК задержали адвоката по подозрению в даче взятки,"['взятка', 'коррупция']",15 Января 2021,"Следователи второго отдела по расследованию особо важных дел следственного управления СК России по Забайкальскому краю задержали по подозрению в совершении преступления, предусмотренного п. «а» ч. 4 ст. 291 УК РФ (дача взятки должностному лицу в значительном размере за совершение заведомо незаконных действий, группой лиц по предварительному сговору) жительницу Читы, адвоката палаты адвокатов Забайкальского края.
По версии следствия, в 2016 году подозреваемая дала взятку в сумме 50 тысяч рублей работнику управления архитектуры и градостроительства комитета по развитию инфраструктуры администрации городского округа «Город Чита» за выдачу документа, содержащего заведомо недостоверные сведения для последующего незаконного кадастрового учета изменений объекта недвижимости в городе Чите.
С учетом особого правового статуса адвоката, в соответствии с требования уголовно-процессуального законодательства, уголовное дело возбуждено руководителем следственного управления СК России по Забайкальскому краю Алексеем Вольным.
Уголовное дело возбуждено по материалам оперативной разработки управления ФСБ. Сегодня следователи провели обыски по месту жительства и работы подозреваемой. В ближайшее время будет решён вопрос об избрании в отношении подозреваемой меры пресечения.
По действующему законодательству за данное преступление предусмотрена уголовная ответственность в виде лишения свободы на срок до 12 лет со штрафом в размере до 60-кратной суммы взятки."
/news/item/1843759/,zabaykalye,Бывший сотрудник исправительной колонии предстанет перед судом по обвинению в получении взяток и преступлении в сфере незаконного оборота наркотиков,"['взятка', 'коррупция', 'ФСИН']",20 Декабря 2020,"Следственным отделом по Оловяннинскому району следственного управления СК России завершено расследование уголовного дела в отношении 21-летнего забайкальца, бывшего младшего инспектора группы безопасности исправительной колонии № 7 УФСИН по Забайкальскому краю. Он обвиняется в получении взятки за незаконные действия (ч. 3 ст. 290 УК РФ), в мелком взяточничестве (ч. 1 ст. 291.2 УК РФ), двух фактах превышения должностного положения, совершенных из корыстной заинтересованности (п. «е» ч. 3 ст. 286 УК РФ), а также в пособничестве в покушении на незаконные приобретение и хранение наркотических средств, совершенные в крупном размере (ч. 5 ст. 33, ч. 3 ст. 30 ч. 2 ст. 228 УК РФ).
Кроме того, следователи предъявили обвинение двум заключённым колонии. Они в совершении преступлений, предусмотренных ч. 3 ст. 291 УК РФ (дача взятки за незаконные действия), ч. 1 ст. 291.2 УК РФ (мелкое взяточничество, не превышающее десяти тысяч рублей), а также ч. 3 ст. 30 ч. 2 ст. 228 УК РФ (покушение на незаконное приобретение наркотических средств в крупном размере).
По версии следствия, сотрудник исправительной колонии за деньги проносил на территорию учреждения запрещённые предметы – сотовые телефоны, зарядные устройства к ним и наушники. Инспектор группы безопасности пронёс на территорию ИК-7 сотовый телефон и наушники. Для того, чтобы запрещённые к проносу предметы не обнаружили при досмотре, обвиняемый примотал телефон к внутренней поверности бёдер. За незаконные действия заключённый перевёл на банковскую карту сотрудника 14 тысяч рублей. Другой заключённый договорился с этим же сотрудников о незаконном проносе наркотиков, за что перевёл ему 10 тысяч рублей. Инспектор ИК был задержан сотрудниками УФСИН при попытке проноса около 14 граммов наркотических средств.
После возбуждения уголовного дела сотрудник ИК-7 уволен по отрицательным основаниям.
Следователи собрали необходимую доказательственную базу, уголовное дело с утверждённым обвинительным заключением направлено для рассмотрения в суд."
/news/item/1482959/,zabaykalye,Бывший прокурорский работник арестована по обвинению в получении взятки,"['взятка', 'Прокуратура']",06 Декабря 2020,"Следственными органами Следственного комитета Российской Федерации по Забайкальскому краю предъявлено обвинение 53-летней женщине, бывшему работнику прокуратуры Читинского района. Она обвиняется в совершении преступления, предусмотренного ч. 5 ст. 290 УК РФ (получение взятки в крупном размере).
По версии следствия, обвиняемая, занимая должность в прокуратуре Читинского района, используя полномочия прокурорского работника, незаконно потребовала от одного из чиновников Читинского района взамен за общее покровительство оформить документы и безвозмездно передать ей земельный участок в одном из сёл Читинского района Забайкалья. В результате на экс-работника прокуратуры был оформлен земельный участок стоимостью свыше 200 тысяч рублей.
Сегодня судом Центрального района города Читы удовлетворено ходатайство следователей об избрании в отношении обвиняемой меры пресечения в виде заключения под стражу. Суд учел доводы следствия о том, что, оставаясь на свободе, обвиняемая может оказать давление на свидетелей и других участников предварительного следствия, либо может скрыться. 
Уголовное дело возбуждено по материалам прокуратуры Забайкальского края и регионального управления ФСБ. Обвиняемая уволена из органов прокуратуры. Расследованием уголовного дела занимаются следователи второго отдела по расследованию особо важных дел."
/news/item/1359309/,zabaykalye,Cледователи СКР задержали по подозрению во взяточничестве директора крупнейшего в регионе горнодобывающего предприятия,['взятка'],02 Декабря 2020,"Следственными органами Следственного комитета Российской Федерации по Забайкальскому краю возбуждено уголовное дело в отношении генерального директора ПАО «Приаргунское производственное горно-химическое объединение имени Е.П. Славского». Он подозревается в совершении преступления, предусмотренного ч. 5 ст. 290 УК РФ (получение взятки в крупном размере). Кроме того, уголовное дело возбуждено в отношении одного из депутатов Совета муниципального района «Город Краснокаменск и Краснокаменский район» Забайкальского края VI созыва, который подозревается в совершении преступления, предусмотренного п. “б” ч. 4 ст. 291 УК РФ (дача взятки в крупном размере).
По данным следствия, депутат, который является руководителем одного из местных обществ с ограниченной ответственностью, дал взятку гендиректору ПАО “ППГХО” в сумме 500 тыс. рублей за возможность оказания услуг по организации питания работников ППГХО.
Оба подозреваемых задержаны следователями на 48 часов, готовятся документы для избрания подозреваемым меры пресечения в виде заключения под стражу. В рабочих кабинетах подозреваемых, а также по местам их жительства проведены обыски.
С учетом особого правового статуса депутата, решение о возбуждении в его отношении уголовного дела принято и.о. руководителя регионального следственного управления СКР Алексеем Вольным. Расследование уголовного дела поручено следователям Второго отдела по расследованию особо важных дел.
Преступление выявлено сотрудниками Управления экономической безопасности и противодействия коррупции регионального УМВД. 
В настоящее время проводятся следственные действия, направленные на установление всех обстоятельств совершенных преступлений. Расследование уголовного дела продолжается."
/news/item/1193010/,zabaykalye,Следователи предъявили окончательное обвинение во взяточничестве бывшим руководителям Службы единого заказчика Забайкальского края,"['взятка', 'деньги', 'коррупция', 'чиновник']",05 Ноября 2020,"Первым отделом по расследованию особо важных дел следственного управления Следственного комитета Российской Федерации по Забайкальскому краю предъявлены обвинения в окончательной редакциибывшим работникам государственного казенного учреждения «Служба единого заказчика» Забайкальского края: экс-директору Геннадию Литвинцеву, бывшему главному инженеру Константину Выжлову и бывшему заместителю директора Максиму Майорову.
Литвинцев  и Выжлов обвиняются в восьми фактах получения взяток в крупном и особо крупном размерах, совершённых ими организованной группой (п. «в» ч. 5 ст. 290 УК РФ, ч. 6 ст. 290 УК РФ), помимо этого Литвинцеву предъявлено обвинение еще по двум эпизодам получения взяток в крупных размерах.  
Майорову предъявлено обвинение по двум фактам оказания Литвинцеву и Выжлову посредничества во взяточничестве в особо крупном размере (ч. 4 ст. 291.1. УК РФ).
Уголовное дело возбуждено по материалам оперативно–розыскной деятельности управления ФСБ по Забайкальскому краю.
По версии следствия, в 2013-2016 годах обвиняемые, занимая руководящие должности в ГКУ «Служба единого заказчика» Забайкальского края, которое контролирует исполнение государственных контрактов на строительство автомобильных дорог, объектов жилищно-коммунального назначения, здравоохранения, образования, промышленного и гражданского строительства, использовали свои полномочия для получения взяток в виде так называемых откатов при заключении и исполнении государственных контрактов, исчисляемых в виде процентов от общей суммы контракта.
Выжлов занимался поиском подрядчиков, готовых платить откаты, оказывал содействие руководителям юридических лиц в успешном прохождении аукционов и заключении контрактов, лично получал от них деньги в виде взяток. Литвинцев, являясь директором ГКУ «Служба единого заказчика» Забайкальского края подписывал контракты с взяткодателями, обеспечивал им покровительство по службе при посредничестве Майорова, распределял суммы взяток, которые передавались ему Майоровым и Выжловым.
По материалам следствия минимальная сумма «отката» для Литвинцева и его соучастников составила 250 тысяч рублей за заключение контракта стоимостью 2,5 млн. рублей на выполнению работ по консервации здания церкви в селе Калинино Нерчинского района Забайкалья. Максимальная сумма взятки обвиняемым составила 12,5 млн. рублей в виде отката за контракт на строительство жилья семьям, пострадавшим от пожаров в 2015 году.
Взятки фигуранты дела получали как в служебных кабинетах ГКУ «Служба единого заказчика», так и в автомобилях и на квартирах взяткодателей в Чите.
Следствием установлено, что на назначении Литвинцева в 2013 году на должность директора «Службы единого заказчика» Забайкальского края настоял тогда действующий губернатор Забайкальского края Константин Ильковский, состоящий в дружеских отношениях с обвиняемым и проработавший вместе с ним много лет в Республике Саха (Якутия). Назначенные Литвинцевым на должности в ГКУ «Служба единого заказчика» Забайкальского края Выжлов и Майоров также прибыли в  регион из Якутии, где ранее работали в организациях и учреждениях, возглавляемых Ильковским и Литвинцевым.
Материалами дела доказано, что в период с марта 2014 по май 2016 года обвиняемые достигли соглашений с взяткодателями на получение откатов на общую сумму более 50 млн. рублей, но успели получить лишь часть взяток, на сумму около 18,4 млн. рублей, после чего в связи с уходом Ильковского с поста губернатора Забайкальского края, уволились из ГКУ «Служба единого заказчика» Забайкальского края и покинули регион.
27 ноября 2017 года обвиняемые и их защитники приступили к ознакомлению с материалами уголовного дела, объем которого составляет 26 томов.
С момента задержания 14 декабря 2016 года все трое фигурантов дела продолжают содержаться под стражей. В декабре 2017 года по ходатайству руководителя первого отдела по расследованию особо важных дел регионального следственного управления Забайкальский краевой суд продлил каждому из обвиняемых срок содержания под стражей на 03 месяца, то есть до марта 2018 года. Также по ходатайству следствия суд установил время ознакомления с материалами уголовного дела обвиняемому Выжлову, который явно злоупотреблял предоставленным ему правом и препятствовал следствию, затягивая ознакомление с материалами уголовного дела.
В случае, если вина обвиняемых будет доказана, им грозит наказание вплоть до 25 лет лишения свободы."
