Link,Topic,Card Title,Tags,Date,Card Text
/news/item/1537364/,mordovia,В Республике Мордовия бывший начальник коммерческого одела предприятия подозревается в совершении коррупционного преступления,['коммерческий подкуп'],26 Августа 2014,"Следственным отделом по Ленинскому району  города Саранск Следственного управления Следственного комитета России по Республике Мордовия возбуждено уголовное дело в отношении 45-летнего мужчины, подозреваемого в совершении преступлений, предусмотренных чч.7,8 ст.204 УК РФ (коммерческий подкуп).
По версии следствия, в 2017-2019 гг. подозреваемый, занимавший должность начальника коммерческого отдела ООО «ЭМ-Кабель», за лоббирование в силу занимаемой должности интересов двух коммерческих организаций получил от их представителей денежные средства  в размере более 744 тысяч рублей и около  1 миллиона  390 тысяч рублей соответственно. Коммерческий подкуп перечислялся ему частями на банковские карты. Денежными средствами мужчина распорядился по собственному усмотрению.
Допрошенный в качестве подозреваемого мужчина не отрицал, что получал денежные средства. Судом по ходатайству следствия в отношении него избрана мера пресечения в виде домашнего ареста. В ближайшее время следователем СК ему буде предъявлено обвинение.
Оперативное сопровождение по уголовному делу осуществляют сотрудники УЭБиПК МВД по Республике Мордовия.
Проводится комплекс следственных действий, направленный на закрепление доказательственной базы. Расследование продолжается."
/news/item/1250463/,mordovia,Следственное управление призывает граждан сообщать о фактах коррупции в правоохранительные органы,"['коррупция', 'мероприятия']",20 Августа 2014,"В целях предупреждения и искоренения фактов коррупции просим граждан, столкнувшихся с коррупционными проявлениями,  незамедлительно обращаться с заявлением в правоохранительные органы.
Уголовным кодексом Российской Федерации предусмотрена ответственность за получение и дачу взятки,  а также посредничество во взяточничестве, коммерческий подкуп и посредничество в коммерческом подкупе.
Лицо, давшее взятку или совершившее коммерческий подкуп, может быть освобождено от ответственности, если:
- активно способствовало раскрытию и (или) расследованию преступления;
 - установлен факт вымогательства;
- добровольно сообщило о совершённом преступлении в правоохранительные органы, имеющие право возбудить уголовное дело.
При этом стоит отметить, что заведомо ложный донос о вымогательстве взятки или коммерческом подкупе рассматривается Уголовным кодексом Российской Федерации как преступление и наказывается лишением свободы на срок до шести лет (статья 306).
Противодействие коррупционным преступлениям - один из ключевых приоритетов в работе Следственного комитета Российской Федерации, поскольку именно коррупция является предпосылкой для совершения других преступлений. Важнейший принцип, которого придерживается Следственный комитет в деле борьбы с коррупцией, - неотвратимость наказания вне зависимости от статуса преступника.
Телефонная линия Следственного управления СК России по Республике Мордовия «Остановим коррупцию»: (8342) 47-11-69"
/news/item/1140248/,mordovia,Бывший заместитель начальника отдела  безопасности исправительного учреждения признан виновным в злоупотреблении должностными полномочиями,[],19 Августа 2014,"Собранные Зубово-Полянским межрайонным следственным отделом Следственного управления Следственного комитета Российской Федерации по Республике Мордовия  доказательства признаны судом достаточными для вынесения приговора бывшему заместителю начальника отдела безопасности ФКУ ЛИУ-19 УФСИН России по Республике Мордовия Владимиру Данилкину. Он признан виновным в совершении пяти эпизодов преступления, предусмотренного ч.1 ст.285 УК РФ (злоупотребление должностными полномочиями).
Следствием и судом установлено, что обвиняемый, состоя в указанной должности и используя свои служебные полномочия вопреки интересам службы с целью получения материальной выгоды, с сентября по ноябрь 2010 года договорился с тремя осужденными о создании им за материальное вознаграждение благоприятных условий отбывания наказания и проносе на территорию исправительного учреждения запрещенных предметов: спиртосодержащей жидкости, телефонов и денег. Получив в результате за это денежное вознаграждение в сумме около 12 тысяч рублей. Противоправная деятельность обвиняемого была выявлена во взаимодействии с сотрудниками республиканского УФСБ. 
Приговором суда Данилкину назначено наказание в виде 3 лет лишения свободы с отбыванием в колонии-поселении."
/news/item/1308858/,mordovia,Заместитель начальника исправительной колонии подозревается в получении взятки в значительном размере,['взятка'],11 Августа 2014,"Зубово-Полянским межрайонным следственным отделом Следственного управления Следственного комитета России по Республике Мордовия возбуждено уголовное дело в отношении бывшего заместителя начальника ФКУ ИК-12 УФСИН России по Республике Мордовия, подозреваемого в совершении преступления, предусмотренного ч.3 ст.290 УК РФ  (получение взятки в значительном размере).
По данным следствия, с мая по сентябрь 2016 года подозреваемый, занимая указанную должность,  получил от директора коммерческой организации взятку за содействие в заключении государственных контрактов на поставку ткани как с единственным поставщиком. Денежные средства в общей сумме 109,5 тысяч рублей были перечислены посредством банковских переводов.
Свою причастность к получению денежных средств сотрудник исправительного учреждения не отрицает, в связи с чем судом по ходатайству следствия в отношении него избрана мера пресечения в виде домашнего ареста.
Уголовное дело возбуждено по материалам оперативно-розыскной деятельности сотрудников УЭБиПК МВД по республике при содействии содействии регионального управления ФСИН.
В настоящее время проводятся следственные действия, направленные на установление всех обстоятельств совершенного преступления и закрепление доказательственной базы. Расследование уголовного дела продолжается."
/news/item/1140163/,mordovia,Покушение на мошенничество,[],04 Августа 2014,"Следствием установлено, что в июне 2009 года сотрудниками следственного отдела проводилась доследственная проверка по факту невыплаты заработной платы работникам одного из издательств города Саранска. К проведению проверки привлекался оперуполномоченный УБЭП МВД по республике. 
По результатам проведенной проверки было вынесено постановление об отказе в возбуждении уголовное дела. Пользуясь сложившимися обстоятельствами, 45-летний майор милиции стал требовать у директора издательства денежные средства в размере 30 тысяч рублей за «урегулирование проблем с правоохранительными органами и последующее взаимовыгодное сотрудничество». 

Сотрудник милиции был задержан сотрудниками УФСБ и Следственного управления по республике с поличным при получении денег в сумме 20 тысяч рублей.   
В настоящее время проводятся следственные действия, направленные на установление всех обстоятельств совершенного преступления.
Расследование уголовного дела продолжается."
/news/item/1852218/,mordovia,Сотруднику исправительной колонии предъявлено обвинение в получении взятки от осужденного,['взятка'],04 Августа 2014,"Следователем Зубово-Полянского межрайонного следственного отдела Следственного управления Следственного комитета Российской Федерации по Республике Мордовия 38-летнему мастеру цеха ФКУ ИК-11 УФСИН России по Республике Мордовия предъявлено обвинение в совершении преступления, предусмотренного ч.3 ст.290 УК РФ (получение взятки).
По версии следствия, в декабре 2023 года обвиняемый по договоренности с одним из осужденных получил через пункт выдачи интернет-заказов мобильный телефон, который тайно пронес на режимную территорию и передал его осужденному. После этого также через пункт выдачи он получил в качестве взятки за совершенные им незаконные действия мобильный телефон и телевизор на общую сумму 50 тысяч рублей.
Противоправная деятельность мужчины выявлена и пресечена сотрудниками региональных УФСБ и УФСИН.
По уголовному делу проводятся следственные действия, направленные на выяснение всех обстоятельств совершенного преступления и закрепление доказательственной базы. Устанавливаются дополнительные эпизоды противоправной деятельности фигуранта."
/news/item/1140182/,mordovia,В суд за мошенничество и покушение на дачу взятки следователю,[],18 Июля 2014,"Установлено, в январе 2011 года в Ковылкинский межрайонный следственный отдел Следственного комитета  по Республики Мордовия из органа внутренних дел поступил материал проверки  в отношении руководителя сельхозпредприятия, являющегося депутатом Совета депутатов сельского поселения, по факту хищения им денежных средств, выделенных из бюджета республики. С целью избежания привлечения к уголовной ответственности депутат пытался передать старшему следователю отдела взятку в размере 10 тысяч рублей, однако был задержан при попытке передачи денег сотрудниками правоохранительных органов. По результатам проведенной проверки в отношении злоумышленника были возбуждены уголовные дела по фактам мошеннических действий и покушении на дачу взятки. 

 Так, по версии следствия, в период с августа по март 2009 года директор сельхозпредприятия представил в ГУ «Центр занятости населения Ковылкинского района» не соответствующие действительности сведения о том, что семь подчиненных ему работников, как иногородние,  имеют право на получение социальной выплаты на оплату найма жилого помещения. Согласно порядка предоставления адресной поддержки, направленной на снижение напряженности на рынке труда Республики Мордовия, право на получение социальной выплаты они не имели, так как часть вообще не являлась иногородними, а часть проживала без договора найма в помещении красного уголка на ферме предприятия. Денежные средства в размере более 460 тысяч рублей были перечислены посредством банковского перевода, которыми  злоумышленник распорядился в личных целях. Кроме того, в сентябре 2010 года на счет руководимого им сельхозпредприятия поступила субсидия из республиканского бюджета на ликвидацию последствий засухи 2010 года в сумме более 1 млн. рублей. Отчитываясь в Министерство сельского хозяйства республики об израсходованных денежных средствах, злоумышленник представил ложные сведения о потраченных 210 тысячах рублей на приобретение кормов для крупнорогатого скота, фактически же ничего не приобретал и потратил деньги на личные цели. 
Следователем собрана достаточная доказательственная база, в связи с чем уголовное дело с утвержденным обвинительным заключением направлено в суд для рассмотрения по существу."
/news/item/1671175/,mordovia,Следствием установлены обстоятельства совершения коррупционного преступления бывшим заведующим автогаражом,['коммерческий подкуп'],14 Июля 2014,"Пролетарским межрайонным следственным отделом Следственного управления Следственного комитета Российской Федерации  по Республике Мордовия завершено расследование уголовного дела в отношении бывшего  заведующего автогаражом ОАО «Птицефабрика «Атемарская». Мужчине предъявлено обвинение в совершении преступления, предусмотренного ч.6 ст.204 УК РФ (коммерческий подкуп).
По данным следствия,  в ноябре 2020 года в ходе телефонного разговора обвиняемый предложил индивидуальному предпринимателю регулярно передавать ему денежные средства в размере 2-3% от стоимости оказанных услуг по техническому обслуживанию и ремонту двигателей и агрегатов птицефабрики, на что последний дал согласие. В дальнейшем индивидуальный предприниматель в рамках договоренности за оказанное содействие в виде отбора в качестве поставщика необходимых услуг несколько раз перечислял на банковскую карту обвиняемому денежное вознаграждение. Всего таким образом фигурантом в качестве коммерческого подкупа было получено 114,5 тысяч рублей.   
Уголовное дело следствием возбуждалось на основании материалов, представленных сотрудниками УЭБиПК МВД по Республике Мордовия.        
Следователем СК собрана достаточная доказательственная база, в связи с чем уголовное дело с утвержденным прокурором обвинительным заключением направлено в суд для рассмотрения по существу."
/news/item/1878446/,mordovia,В Ардатовском районе по обвинению в мошенничестве перед судом предстанет бывший глава сельского поселения,['мошенничество'],19 Июня 2014,"Ардатовским межрайонным следственным отделом следственного управления Следственного комитета Российской Федерации по Республике Мордовия завершено расследование уголовного дела в отношении 44-летнего бывшего главы одного из сельских поселений района. Следствием ему предъявлено обвинение в совершении трех эпизодов преступления, предусмотренного ч.3 ст.159 УК РФ (мошенничество, совершенное с использованием своего служебного положения).
По данным следствия, в марте ­– апреле 2021 года обвиняемый изготовил фиктивные документы, согласно которым местным жителем производилась очистка сельских дорог от снега. В действительности данные работы местный житель не выполнял. В результате обвиняемым были незаконно получены и потрачены на личные нужды денежные средства в размере   более 18 тысяч рублей. Аналогичны образом в 2022 и 2023 годах им были похищены денежные средства в размере более 37 тысяч и 39 тысяч рублей соответственно.
В ходе следствия вину в совершении инкриминируемых деяний мужчина признал полностью и возместил причиненный противоправными действиями ущерб.
Следователем СК собрана достаточная доказательственная база, в связи с чем уголовное дело с утвержденным обвинительным заключением направлено в суд для рассмотрения по существу."
