Link,Topic,Card Title,Tags,Date,Card Text
/news/item/1422503/,kamchatka,Бывшему Главе Петропавловск-Камчатского городского округа предъявлено обвинение,"['взятка', 'коррупция']",05 Марта 2022,"Следователем отдела по расследованию особо важных дел следственного управления Следственного комитета Российской Федерации по Камчатскому краю предъявлено обвинение бывшему Главе Петропавловск-Камчатского городского округа. Он обвиняется в совершении двух эпизодов получения взятки в крупном размере (п. «в» ч.5 ст. 290 УК РФ).
По версии следствия, Глава Петропавловск-Камчатского городского округа в период с декабря 2018 года по апрель 2019 года, получил частями от начальника МКУ «Служба благоустройства Петропавловск-Камчатского городского округа» за общее покровительство через своего родного брата взятку в виде денег в общей сумме 700 тысяч рублей.
Кроме того, обвиняемый в период с февраля по март 2019 года, получил взятку в виде денег в размере 200 тысяч рублей, переданную предпринимателем через директора МКУ «Служба автомобильных дорог Петропавловск-Камчатского городского округа» и своего родного брата за содействие при заключении муниципальных контактов и беспрепятственное подписание актов выполненных работ.
В отношении обвиняемого избрана мера пресечения в виде  домашнего ареста сроком на 1 месяц. Расследование уголовного дела продолжается."
/news/item/1649162/,kamchatka,Начальник тыла Камчатского линейного отдела МВД России на транспорте подозревается в получении взятки,['взятка'],01 Марта 2022,"Следственным управлением СК России по Камчатскому краю возбуждено уголовное дело в отношении начальника тыла Камчатского линейного отдела МВД на транспорте. Должностное лицо подозревается в получении взятки за незаконные действия (ч.3 ст. 290 УК РФ).
По версии следствия, 56-летний подозреваемый, являясь начальником тыла Камчатского линейного отдела МВД России на транспорте, в период с июня по сентябрь 2021 года получил от двух лиц, 35-летней женщины и 32-летнего мужчины, действующих в составе организованной группы, взятку в виде денег в размере 30 тысяч рублей за бездействие при организации незаконной провозки немаркированной зернистой икры рыбы лососевых пород в багаже пассажиров, вылетающих авиарейсами за пределы Камчатского края.
Более того, подозреваемый не принимал мер к привлечению членов организованной группы к установленной ответственности, и оказывал им содействие в возвращении изъятой немаркированной икры в ходе административных процедур.
При пресечении  деятельности организованной группы в сентябре 2021 года оперативными службами установлен факт попытки незаконного провоза около 1700 килограммов немаркированной икры.
Подозреваемый продолжает содержаться под стражей по ранее возбужденному уголовному делу.
В настоящее время мужчина уволен со службы в органах МВД России.
В отношении взяткодателей следственным управлением возбуждены уголовные дела по факту дачи взятки должностному лицу, совершенному группой лиц (п. «а» ч. 4 ст. 291 УК РФ).
Уголовное дело расследуется при оперативном сопровождении сотрудников региональных управлений МВД России и ФСБ России.
Органом следствия проводится комплекс следственных действий, направленный на детальное установление всех обстоятельств произошедшего.
Расследование уголовного дела продолжается."
/news/item/1455885/,kamchatka,Задержан и заключен под стражу бывший сотрудник администрации Олюторского муниципального района,"['злоупотребление', 'служебный подлог', 'чиновник']",03 Февраля 2022,"Олюторским межрайонным следственным отделом СУ СК России по Камчатскому краю во взаимодействии с сотрудниками прокуратуры Олюторского района и отделения в с. Тиличики УФСБ России по Камчатскому краю пресечена попытка подозреваемого скрыться от органов предварительного следствия.
Ранее в отношении бывшего руководителя управления по вопросам строительства, транспорта, энергетики, жилищно - коммунального хозяйства и муниципального имущества администрации Олюторского муниципального района было возбуждено и расследовалось уголовное дело. Он подозревается в совершении преступлений, предусмотренных ч. 1 ст. 285 УК РФ (злоупотребление должностными полномочиями) и ч. 2 ст. 292 УК РФ (служебный подлог).
По версии следствия в декабре 2019 года подозреваемый, являясь  должностным лицом администрации Олюторского муниципального района, принял и оплатил коммерческой организации услуги по исполнению комплекса работ по устройству ледовой переправы через бухту Скрытая, между селами Тиличики и Корф, и ее очистке от снега, несмотря на то, что переправа фактически не возводилась.
         По причине отсутствия работ по устройству ледяной переправы, в декабре 2019 года, вездеход, следовавший между вышеуказанными селами,  имея на борту около 40 пассажиров, провалился задней частью под лед, что привело к организации и осуществлению спасательной операции.
      Подозреваемый, будучи достоверно осведомленным об избрании в отношении него меры пресечения в виде подписки о невыезде и надлежащем поведении, опасаясь наказания за совершенное преступление, предпринял 13.04.2020 попытку скрыться от органов предварительного следствия. Так, в указанное время, подозреваемый посредством авиасообщения покинул пределы села Тиличики Олюторского района Камчатского края, убыв в город Петропавловск-Камчатский, а 14.04.2020 года намеревался убыть посредством авиасообщения в город Санкт-Петербург, для чего приобрел авиабилеты по указному маршруту и прошел регистрацию в аэропорту.
         Во время ожидания вылета своего рейса, в помещении стерильной зоны аэропорта, подозреваемый был задержан сотрудниками правоохранительных органов. В этот же день указанному лицу предъявлено обвинение в совершении преступлений, предусмотренных ч. 2 ст. 292 и ч. 1 ст. 285 УК РФ, а 16.04.2020 года в отношении обвиняемого судом избрана мера пресечения в виде заключения под стражу. 
Расследование уголовного дела продолжается, проводятся следственные и иные процессуальные действия, направленные на установление всех обстоятельств произошедшего."
/news/item/1771440/,kamchatka,Бывший начальник исправительного центра признан виновным в совершении коррупционного преступления,['взятка'],21 Января 2022,"Собранные следственным управлением СК России по Камчатскому краю доказательства признаны судом достаточными для вынесения приговора бывшему начальнику участка, функционирующего как исправительный центр при ФКУ «Исправительная колония № 5» УФСИН России по Камчатскому краю.
Должностное лицо признано виновным в получении взятки в крупном размере (п. «в» ч.5 ст. 290 УК РФ).
Из материалов уголовного дела следует, что 34-летний обвиняемый, являясь начальником подразделения исправительной колонии № 5, ответственным за организацию трудоустройства осужденных, в 2020 году от имени пенитенциарного учреждения заключил договор со строительной компанией по подбору и привлечению к оплачиваемому труду в качестве подсобных рабочих осужденных к принудительным работам.
В дальнейшем, осознавая, что одностороннее прекращение договорных отношений с фирмой может повлечь существенный вред законным интересам юридического лица в виде неисполнения обязательств перед третьими лицами, обвиняемый выдвинул директору компании незаконное требование о передаче ему взятки в крупном размере за продолжение выполнения ранее взятых договорных обязательств.
С указанной целью мужчина прибыл в вечернее время 14 ноября 2022 года на участок местности, расположенный недалеко от дома по улице Вулканная краевого центра, где получил от директора фирмы взятку в виде денег в сумме 270 000 рублей, что составило крупный размер.
Однако после получения незаконного вознаграждения фигурант уголовного дела был задержан сотрудниками правоохранительных органов.
В ходе следствия обвиняемый дал признательные показания в инкриминируемом преступлении и сотрудничал со следствием.
Фигурант уголовного дела освобожден от занимаемой должности.
Уголовное дело расследовано при оперативном сопровождении сотрудниками УФСБ России по Камчатскому краю и ОСБ УФСИН России по Камчатскому краю.
Приговором суда мужчине назначено наказание в виде 3 лет лишения свободы с отбыванием наказания в колонии строгого режима, со штрафом в размере 810 тыс. руб. и лишением права занимать определенные должности на государственной службе на 4 года. Приговор не вступил в законную силу."
/news/item/1411362/,kamchatka,В совершении коррупционных преступлений подозревается начальник казенного учреждения и двое жителей краевого центра,"['взятка', 'посредничество']",18 Января 2022,"Отделом по расследованию особо важных дел СУ СК РФ по Камчатскому краю на основании материалов оперативно-розыскной деятельности сотрудников УФСБ России по Камчатскому краю, возбуждено уголовное дело по факту дачи взятки и посредничестве во взяточничестве (ч.4 ст. 291 УК РФ, ч.3 ст. 291.1 УК РФ).
В совершении указанных преступлений подозревается директор  муниципального казенного учреждения «Служба автомобильных дорог Петропавловск-Камчатского городского округа» и двое жителей краевого центра.
По версии следствия, в период с февраля по март 2019 года житель краевого центра, являясь родным братом главы Петропавловск-Камчатского городского округа, действуя в интересах и по поручению последнего, получил частями от посредника директора муниципального казенного учреждения «Служба автомобильных дорог Петропавловск-Камчатского городского округа» для последующей передачи главе, взятку в сумме 200 тысяч рублей, за способствование последним совершению действий в пользу взяткодателя и представляемого им ИП, а именно за: оказание содействия в заключении МКУ «Служба автомобильных дорог Петропавловск-Камчатского городского округа» муниципальных контрактов, представление возможности заключения договоров подрядов и субподрядов на выполнение различных работ для муниципальных нужд, беспрепятственное подписание актов выполненных работ и т.д.
В настоящее время следствием проводится комплекс следственных и иных процессуальных действий, направленных на установление всех обстоятельств произошедшего. Расследование уголовного дела продолжается."
/news/item/1142508/,kamchatka,"Бывший начальник отдела по экономическому развитию, инвестициям и делам коренных малочисленных народов Севера администрации Олюторского муниципального района подозревается еще в трех  преступлениях",[],14 Января 2022,"Олюторским межрайонным следственным отделом следственного управления СКР по Камчатскому краю на основании результатов совместной работы с сотрудниками УЭБ и ПК УМВД России по Камчатскому краю возбуждено уголовное дело в отношении бывшего начальника отдела по экономическому развитию, инвестициям и делам коренных малочисленных народов Севера администрации Олюторского муниципального района. Она подозревается в совершении преступлений, предусмотренных ч.3 ст. 159.2 УК РФ (мошенничество при получении выплат),  ч.1 ст. 285 УК РФ (злоупотребление должностными полномочиями) и ч. 3 ст. 30, ч. 4 ст. 159.2 УК РФ (покушение на мошенничество при получении выплат).
По версии следствия, в 2014 и 2015 годах подозреваемая, занимая вышеуказанную должность, действуя из корыстной заинтересованности, незаконно обратила выделенные администрацией Олюторского муниципального района в качестве субсидий денежные средства, подысканным ею для этих целей общинам коренных малочисленных народов севера, предоставив в последующем в администрацию заведомо ложные сведения о целевом использовании общиной этих денежных средств. 
Так, действуя при пособничестве находившейся в ее служебном подчинении советника по делам КМНС администрации Олюторского муниципального района, подозреваемая в 2014 году похитила предоставленные администрацией Олюторского муниципального района в качестве субсидии общине КМНС «Надежда» денежные средства в крупном размере в сумме свыше 600 тысяч  рублей.
В 2015 году при пособничестве советника по делам КМНС и председателя правлений общин КМНС «Пылговаям» и «Надежда», подозреваемая пыталась похитить предоставленные данным общинам в качестве субсидий средства в особо крупном размере на общую сумму 2 миллиона 400 рублей, однако свой преступный умысел довести до конца не смогла по независящим от нее обстоятельствам, ввиду того, что председатель правления общин КМНС после получения субсидий отказалась переводить данные денежные средства в пользу подозреваемой, самостоятельно присвоив их.
Пособники предприимчивой чиновницы подозреваются в совершении преступлений, предусмотренных ч. 5 ст. 33, ч. 3 ст. 159.2 УК РФ и ч. 5 ст. 33, ч. 3 ст. 30, ч. 4 ст. 159.2 УК РФ (пособничество в покушении на мошенничество при получении выплат и пособничество в мошенничестве).
Как сообщалось ранее, бывший начальник отдела по экономическому развитию, инвестициям и делам коренных малочисленных народов Севера администрации Олюторского муниципального района является фигуранткой по уголовному делу, возбужденному по признакам преступлений, предусмотренных ч.3 ст. 159.2 УК РФ (мошенничество при получении выплат) и ч.1 ст. 285 УК РФ (злоупотребление должностными полномочиями). В 2013 году она обманным способом похитила 700 тысяч рублей, причинив имущественный ущерб администрации Олюторского муниципального района.
 В настоящее время следствием проводится комплекс мероприятий, направленных на установление всех обстоятельств произошедшего. Расследование уголовных дел продолжается."
