Link,Topic,Card Title,Tags,Date,Card Text
/news/item/1351795/,kchr,В Карачаево-Черкесии по обвинению в получении взятки  перед судом предстанут бывшие сотрудники полиции,[],08 Ноября 2019,"Следственными органами Следственного комитета Российской Федерации по Карачаево-Черкесской Республике завершено расследование уголовного дела в отношении двух бывших сотрудников полиции. Они обвиняется в совершении преступления, предусмотренного п.п. «а», «б» ч. 5 ст. 290 УК РФ (получение взятки группой лиц по предварительному сговору, сопряжённое с вымогательством).
По версии следствия, обвиняемые, занимая должности оперуполномоченных уголовного розыска МО МВД России «Зеленчукский» выявили факт продажи местным жителем гладкоствольного огнестрельного оружия жителю Зеленчукского района. Вопреки интересам службы сотрудники уголовного розыска высказали угрозу принятия мер, направленных на привлечение продавца ружья к уголовной ответственности за сбыт огнестрельного оружия. Запугав продавца ружья злоумышленники стали вымогать у него денежные средства в сумме 400 тыс. руб. 
Опасаясь высказанных угроз, которые могли повлечь его привлечение к уголовной ответственности продавец ружья вынужденно согласился на их требование с условием, если сумма денежных средств будет снижена до 150 тыс. руб.
Понимая, что оперуполномоченные уголовного розыска своими действиями совершает преступление, продавец обратился в УФСБ России по КЧР в Зеленчукском районе с заявлением о вымогательстве у него взятки сотрудниками полиции в размере 150 тыс. руб.
В рамках оперативно-розыскных мероприятий сотрудниками УФСБ России по КЧР оба сотрудника уголовного розыска были задержаны с поличным при получении взятки.
Уголовное дело направлено в Зеленчукский районный суд Карачаево-Черкесской Республики для рассмотрения по существу.
 
Следственное управление 
СКР по КЧР
тел. 8 (878-22) 8-11-74
http://kchr.sledcom.ru//"
/news/item/1421577/,kchr,В Карачаево-Черкесской Республике возбуждено уголовное дело о незаконной реализации лесных насаждений,"['должностное лицо', 'злоупотребление', 'СКР']",14 Июня 2019,"Зеленчукский межрайонный следственный отдел следственного управления Следственного комитета Российской Федерации по Карачаево-Черкесской Республике возбудил уголовное дело в отношении бывшего руководителя одного из лесхозов в республике, по признакам  преступления, предусмотренного ч.1 ст.285 УК РФ – злоупотребление должностными полномочиями.
По данным следствия, 53-летний местный житель, используя свое служебное положение вопреки интересам службы, из корыстных побуждений, незаконно заключил с индивидуальным предпринимателем договор о передаче древесины твердых пород, причинив ущерб лесхозу на сумму более двухсот тысяч рублей.
В настоящее время следователь следственного отдела осмотрел место происшествия, назначил экспертизы, избрал в отношении подозреваемого меру пресечения. В рамках уголовного дела ведутся допросы свидетелей, проводятся иные мероприятия, направленные на установление всех обстоятельств совершённого преступления. Расследование уголовного дела продолжается."
/news/item/1786567/,kchr,В Зеленчукском районе участковый уполномоченный признан виновным в злоупотреблении должностными полномочиями,['злоупотребление'],08 Мая 2019,"Доказательства, собранные следователем Следственного комитета Российской Федерации по Карачаево-Черкесской Республике, признаны судом достаточными для вынесения приговора участковому уполномоченному полиции отделения участковых уполномоченных полиции по обслуживанию Урупского района (место дислокации ст. Преградная) отдела участковых уполномоченных полиции и по делам несовершеннолетних Межмуниципального отдела Министерства внутренних дел России «Зеленчукский». Он признан виновным в совершении преступления, предусмотренного ч. 1 ст. 285 УК РФ (злоупотребление должностными полномочиями).
Как установлено следствием и судом, в августе 2020 года фигурант уголовного дела, желая упростить свою работу и угодить руководству, без должного проведения проверки составил рапорт об отсутствии какого-либо правонарушения и преступлений в отношении лиц, которые занимались предпринимательской деятельностью, осуществляя добычу лома цветных металлов.
Своими преступными действиями сотрудник МО МВД России «Зеленчукский» существенно нарушил охраняемые законом интересы общества и государства, поскольку поставил под угрозу право собственности государства на недра при недропользовании, на лесные участки, общественные отношения, возникающие в связи с осуществлением предпринимательской деятельности, обеспечивающие единую государственную политику в области правовых основ единого рынка, а также защиту прав и законных интересов граждан, их здоровья, охрану окружающей среды, тем самым дискредитировал и подорвал авторитет правоохранительных органов.
Уголовное дело было возбуждено по материалам УФСБ России по Карачаево-Черкесской Республике. Сотрудниками ОРЧ ОСБ МВД по КЧР в отношении сотрудника полиции была проведена служебная проверка, по результатам которой было принято решение рассмотреть вопрос о пребывании его в органах внутренних после вынесения приговора судебными органами.
Следователем Зеленчукского межрайонного следственного отдела произведен значительный объем следственных и процессуальных действий, допрошены свидетели, проведены очные ставки, выемки и осмотры служебной документации, экспертизы, собрана достаточная доказательственная база.
Приговором суда мужчине назначено наказание в виде 2 лет лишения права занимать должности в правоохранительных органах РФ, связанных с исполнением функций представителя власти."
/news/item/975470/,kchr,Окончено следствие по факту дачи взятки,[],12 Апреля 2019,"Следственными органами Следственного комитета Российской Федерации по Карачаево-Черкесской Республике окончено расследование уголовного дела в отношении заместителя директора КЧРГАУ «Урупский лесхоз», 43-летнего Далхата Боташев, по факту дачи взятки должностному лицу в значительном размере  (ч. 3 ст. 291 УК РФ).
По данным следствия Боташев являясь заместителя директора КЧРГАУ «Урупский лесхоз» в августе 2015 года передал начальнику отдела УФСБ России по КЧР в Зеленчукском районе денежные средства в сумме 100 000 рублей за дачу своим подчинённым сотрудникам незаконных указаний (приказа) о прекращении проводимых оперативно-розыскных мероприятий, направленных на выявление и раскрытие незаконной вырубки семидесяти девяти деревьев породы «Бук восточный», что в дальнейшем могло послужить поводом и основанием для возбуждения уголовного.
После того, как Боташев довел свой преступный умысел до конца и передал сотруднику УФСБ денежные средства в сумме 100000 рублей, его преступные действия были пресечены и задокументированы сотрудниками УФСБ России по Карачаево-Черкесской Республике.
Мера пресечения в отношении Боташева на период следственных действий была избрана в виде подписки о невыезде.   
В настоящее время следствие по делу окончено, собрано достаточно доказательств подтверждающих причастность к совершению данного преступления заместителя директора Боташева, уголовное дело направлено в Зеленчукский районный суд для рассмотрения по существу.
 ""Следственное управление СКР по КЧР"" 
<su-sk-kchr@mail.ru>:"
/news/item/1843089/,kchr,В Черкесске перед судом предстанет директор муниципального предприятия за дачу взятки,['СКР'],13 Февраля 2019,"Первым отделом по расследованию особо важных дел следственного управления СКР по Карачаево-Черкесской Республике завершено расследование уголовного дела в отношении руководителя муниципального предприятия. Он обвиняется в совершении преступления, предусмотренного п. «б» ч. 4 ст. 291 УК РФ (дача взятки в крупном размере).  
По данным следствия, 15 августа 2023 года обвиняемый с целью прекращения проведения проверки деятельности возглавляемого им предприятия передал оперуполномоченному УФСБ России по КЧР, действовавшему в рамках оперативного мероприятия, взятку в сумме 500 тысяч рублей. После передачи денег мужчина был задержан сотрудниками правоохранительных органов, денежные средства изъяты.
Собранная в ходе следствия доказательственная база признана достаточной для направления уголовного дела в суд с утвержденным обвинительным заключением."
/news/item/1022679/,kchr,"По факту вымогательства и получения взятки инспекторами государственного контроля, надзора и охраны водных  биологических ресурсов возбуждено уголовное дело",[],24 Декабря 2018,"Следственными органами Следственного комитета Российской Федерации по Карачаево-Черкесской Республики возбуждено уголовное дело в отношении начальника Кавказского отдела государственного контроля, надзора и охраны водных биологических ресурсов Азово-Черноморского территориального управления Федерального агентства по рыболовству 42-летнего Артура Батчаева и инспектора этого же управления 47-летнего Роберта Хапаева, подозреваемых в вымогательстве и получении взятки п.п. («а», «б» ч. 5 ст. 290 УК РФ).
По версии следствия, сотрудники агенства Батчаев А.Х-М. и Хапаев Р.Х. получив сведения о том, что местный житель занимается строительными работами в водоохранной зоне реки Малый Зеленчук на восточной окраине а. Адиль-Халк Ногайского района КЧР  прибыли к нему с целью вымогательства взятки.
Убедившись, что потерпевшим не согласовано проведение строительных работ с Азово-Черноморским территориальным управлением Федерального агентства по рыболовству, сообщили ему, что проведение строительных работ в водоохранной  зоне без предварительного согласования является административным правонарушением и потребовали от него передать денежные  средства в сумме 30 000 рублей, за – не составление административного протокола  и соответственно последующего не привлечения к административной ответственности, пригрозив, что в случае его отказа от передачи им взятки в отношении него будет составлен административный протокол с последующим привлечением к административной ответственности с наложением штрафа в сумме 300 000 рублей, кроме того будет изъята строительная техника.
Потерпевший осознав, что Батчаев А.Х-М. и Хапаев Р.Х. совершают в отношении него незаконные действия, обратился в ОМВД России по г. Черкесску с заявлением о вымогательстве денежных средств и дал свое согласие на участие в проведении оперативно-розыскных мероприятий.
При передаче денежных средств в сумме 30000 тысяч рублей преступная деятельность Батчаева А.Х-М. и Хапаева Р.Х. была пресечена сотрудниками ОБОП УУР МВД по Карачаево-Черкесской Республике.
В настоящее время по делу проводятся все необходимые следственные мероприятия, назначены фоноскопическая и судебная химическая экспертизы, злоумышленникам предъявлено обвинение в инкриминируемом деянии, решается вопрос об избрании в отношении них меры пресечения.
Следствие продолжается.
 
 Старший помощник руководителя следственного 
управления СКР по Карачаево-Черкесской Республике
полковник юстиции Шуваев Сергей Николаевич   
 
тел. 8 (878-22) 6-79-50
http://kchr.sledcom.ru//"
/news/item/1246606/,kchr,В Карачаево-Черкесской Республике в рамках расследования уголовного дела о хищении бюджетных средств задержан ранее объявленный в федеральный розыск начальник тыла регионального МВД,[],09 Декабря 2018,"Следственными органами Следственного комитета Российской Федерации по Карачаево-Черкесской Республике в рамках расследования уголовного дела о хищении бюджетных средств задержан ранее объявленный в федеральный розыск начальник тыла регионального МВД полковник полиции Мухтар Пхешхов (ч. 4 ст. 159 УК РФ).
Напомню, что в производстве следователя следственного управления республики находится уголовное дело, возбужденное в отношении двух местных жителей Биляла Джанибекова и Али Анчокова возбужденного по факту хищения бюджетных средств посредством приобретения по завышенной цене объектов недвижимости для размещения подразделений УФМС России по региону. Джанибекову уже предъявлено обвинение в совершении указанного преступления, а Анчоков скрылся от органов следствия и объявлен в федеральный розыск.
Следствием также установлена причастность к совершению указанного преступления начальника тыла регионального МВД России Мухтара Пхешхова.
По данным следствия, Пхешхов с мая по декабрь 2016 года, используя свое служебное положение вступил в сговор с Анчоковым и Джанибековым направленный на хищение бюджетных средств, выделенных на закупку земельного участка и здания для нужд регионального подразделения УФМС России, путем искусственного завышения стоимости здания и земельного участка, расположенных в городе Черкесске.
В результате преступной деятельности похищены денежные средства в размере более 22 миллионов рублей, что является особо крупным размером.
В связи с тем, что Пхешхов скрывался от следственных органов, следователем было вынесено постановление об объявлении его в федеральный розыск.
Накануне вечером Пхешхов явился в следственные органы Следственного комитета России по Карачаево-Черкесской Республике со своим адвокатом.
В настоящее время Пхешхов задержан и содержится в ИВС отдела МВД России по г. Черкесску.
В ближайшие часы следователем будет направлено ходатайство в Черкесский городской суд об избрании в отношении Пхешхова меры пресечения в виде заключения под стражу.
Расследование уголовного дела продолжается.
 
Следственное управление 
СКР по КЧР
полковник юстиции
Сергей Шуваев
тел. 8 (878-22) 8-11-74
http://kchr.sledcom.ru//"
